scrape_date,name,brand,category,country,currency,price,price_eur,bottle_size_ml,price_per_ml,amazon_rating,amazon_reviews,availability,amazon_url,fragrantica_url,year,rating,votes,gender,fragrance_family,main_accords,perfumers,top_notes,middle_notes,base_notes,votes_love,votes_like,votes_ok,votes_dislike,votes_hate,season_spring,season_summer,season_fall,season_winter,wear_day,wear_night,brand_origin,sentiment_polarisation,crowd_pleaser_index,season_dominant,note_count,years_on_market,gender_id,brand_origin_id,fam_,fam_aromatic,fam_aromatic_aquatic,fam_aromatic_fougere,fam_aromatic_fruity,fam_aromatic_spicy,fam_chypre_fruity,fam_floral,fam_floral_aldehyde,fam_floral_fruity,fam_oriental,fam_oriental_floral,fam_oriental_fougere,fam_oriental_spicy,fam_oriental_vanilla,fam_oriental_woody,fam_woody_aquatic,fam_woody_aromatic,fam_woody_floral_musk,fam_woody_spicy,price_per_ml_scaled,votes_scaled
2026-04-16,My Way,Giorgio Armani,designer,UAE,AED,319.0,73.74,90.0,0.8193,4.6,,in_stock,https://www.amazon.ae/s?k=Giorgio+Armani+My+Way+90ml,https://www.fragrantica.com/perfume/Giorgio-Armani/My-Way-62036.html,,3.78,12969,female,Floral,"white floral, tuberose, citrus, animalic, vanilla","Perfumers, Perfumers, Bruno Jovanovic, Carlos Benaïm","Orange Blossom, Bergamot","Tuberose, Indian Jasmine","Madagascar Vanilla, White Musk, Virginian Cedar",4400,4300,2000,1700,596,5100,3600,2600,1800,5000,2000,designer,0.29270544783010155,0.6694367497691598,spring,7,,0,1,0.0,0.0,0.0,0.0,0.0,0.0,0.0,1.0,0.0,0.0,0.0,0.0,0.0,0.0,0.0,0.0,0.0,0.0,0.0,0.0,0.11856993439193686,0.37623848679431676
2026-04-16,La Nuit de l'Homme,Yves Saint Laurent,designer,UAE,AED,376.77,87.09,100.0,0.8709,5.0,,in_stock,https://www.amazon.ae/s?k=Yves+Saint+Laurent+La+Nuit+de+L+Homme+100ml,https://www.fragrantica.com/perfume/Yves-Saint-Laurent/La-Nuit-de-L-Homme-5521.html,,4.45,23871,male,Woody Spicy,"aromatic, warm spicy, lavender, woody, fresh spicy, citrus","Perfumers, Perfumers, Anne Flipo, Dominique Ropion, Pierre Wargnye",Cardamom,"Lavender, Virginia Cedar, Bergamot","Vetiver, Caraway",14500,7000,1100,1100,154,6700,3000,11100,10800,4700,12100,designer,0.6014085687934938,0.9013163410748721,fall,6,,1,1,0.0,0.0,0.0,0.0,0.0,0.0,0.0,0.0,0.0,0.0,0.0,0.0,0.0,0.0,0.0,0.0,0.0,0.0,0.0,1.0,0.1267471712465532,0.6930005520527646
2026-04-16,Black Opium,Yves Saint Laurent,designer,UAE,AED,490.75,113.44,90.0,1.2604,5.0,,in_stock,https://www.amazon.ae/s?k=Yves+Saint+Laurent+Black+Opium+90ml,https://www.fragrantica.com/perfume/Yves-Saint-Laurent/Black-Opium-25324.html,,3.94,33444,female,Oriental Vanilla,"vanilla, coffee, sweet, white floral, warm spicy, soft spicy, woody, fruity, balsamic, powdery","Perfumers, Perfumers, Honorine Blanc, Marie Salamagne, Nathalie Lorson, Olivier Cresp","Pear, Pink Pepper, Orange Blossom","Coffee, Jasmine, Bitter Almond, Licorice","Vanilla, Patchouli, Cashmere Wood, Cedar",13000,11800,3300,4400,958,3200,2100,11600,13400,5200,13700,designer,0.3599139219319744,0.7412278079980872,winter,11,,0,1,0.0,0.0,0.0,0.0,0.0,0.0,0.0,0.0,0.0,0.0,0.0,0.0,0.0,0.0,1.0,0.0,0.0,0.0,0.0,0.0,0.1884726316123102,0.9711479791963273
2026-04-16,La Vie Est Belle,Lancome,designer,UAE,AED,449.0,103.79,100.0,1.0379,4.7,,in_stock,https://www.amazon.ae/s?k=Lancome+La+Vie+Est+Belle+100ml,https://www.fragrantica.com/perfume/Lanc-me/La-Vie-Est-Belle-14982.html,,3.65,34434,female,Floral Fruity Gourmand,"sweet, vanilla, fruity, patchouli, woody, white floral, powdery, iris, earthy, warm spicy","Perfumers, Perfumers, Anne Flipo, Dominique Ropion, Olivier Polge","Black Currant, Pear","Iris, Jasmine, Orange Blossom","Praline, Vanilla, Patchouli, Tonka Bean",11200,10900,2800,8100,1500,5900,3300,9100,10600,9100,9200,designer,0.2811594202898551,0.6405797101449275,winter,9,,0,1,0.0,0.0,0.0,0.0,0.0,0.0,0.0,0.0,0.0,0.0,0.0,0.0,0.0,0.0,0.0,0.0,0.0,0.0,0.0,0.0,0.15321225951633863,0.9999128337740071
2026-04-16,Pegasus,Parfums de Marly,designer,UAE,AED,830.5,191.97,100.0,1.9197,2.4,,in_stock,https://www.amazon.ae/s?k=Parfums+de+Marly+Pegasus+125ml,https://www.fragrantica.com/perfume/Parfums-de-Marly/Pegasus-16938.html,,4.08,6319,male,Oriental Fougere,"almond, vanilla, powdery, nutty, sweet, lavender, fruity, woody, floral, fresh spicy","Perfumers, Perfumers, Hamid Merati-Kashani","Heliotrope, Cumin, Bergamot, Pink Pepper","Bitter Almond, Lavender, Jasmine","Vanilla, Sandalwood, Amber, Musk, Cedar",3000,1800,690,627,181,2400,801,3100,3000,2600,2700,niche,0.44760241346459195,0.7621467132422991,fall,12,,1,2,0.0,0.0,0.0,0.0,0.0,0.0,0.0,0.0,0.0,0.0,0.0,0.0,1.0,0.0,0.0,0.0,0.0,0.0,0.0,0.0,0.29295426452410384,0.1830200191765697
2026-04-16,Yara,Lattafa,arabic,UAE,AED,83.0,19.19,100.0,0.1919,5.0,,in_stock,https://www.amazon.ae/s?k=Lattafa+Yara+100ml,https://www.fragrantica.com/perfume/Lattafa-Perfumes/Yara-76880.html,,3.97,10861,female,Oriental Vanilla,"sweet, vanilla, powdery, tropical, fruity, musky, floral, citrus","Perfumers, Perfumers","Orchid, Heliotrope, Tangerine","Gourmand Accord, Tropical Fruits","Vanilla, Musk, Sandalwood",4000,4000,1700,830,325,4800,3900,2600,2400,5100,1600,arabic,0.3385536619069553,0.7369875633348687,spring,8,,0,0,0.0,0.0,0.0,0.0,0.0,0.0,0.0,0.0,0.0,0.0,0.0,0.0,0.0,0.0,1.0,0.0,0.0,0.0,0.0,0.0,0.019143608760419636,0.31498968532992416
2026-04-16,Yara Moi,Lattafa,arabic,UAE,AED,224.99,52.01,100.0,0.5201,4.5,,in_stock,https://www.amazon.ae/s?k=Lattafa+Yara+Moi+100ml,https://www.fragrantica.com/perfume/Lattafa-Perfumes/Yara-Moi-80722.html,,3.64,2124,female,,"woody, white floral, patchouli, warm spicy, caramel, powdery, fruity, amber, sweet, balsamic","Perfumers, Perfumers","Jasmine, Peach","Caramel, Amber","Patchouli, Sandalwood",566,746,401,308,103,797,536,712,532,860,444,arabic,0.217984934086629,0.6177024482109228,spring,6,,0,0,1.0,0.0,0.0,0.0,0.0,0.0,0.0,0.0,0.0,0.0,0.0,0.0,0.0,0.0,0.0,0.0,0.0,0.0,0.0,0.0,0.07115463852175842,0.0611325798297353
2026-04-16,Raghba,Lattafa,arabic,UAE,AED,151.54,35.03,100.0,0.3503,,,in_stock,https://www.amazon.ae/s?k=Lattafa+Raghba+100ml,https://www.fragrantica.com/perfume/Lattafa-Perfumes/Raghba-25807.html,,3.88,4151,unisex,Oriental Vanilla,"vanilla, sweet, oud, amber, powdery, balsamic, smoky, woody, warm spicy, musky","Perfumers, Perfumers","Vanilla, Sugar, Agarwood (Oud), Incense, Sandalwood, Musk",,,1500,1500,452,466,209,507,298,1800,2000,952,1700,arabic,0.3128180276229707,0.7269202810758421,winter,6,,2,0,0.0,0.0,0.0,0.0,0.0,0.0,0.0,0.0,0.0,0.0,0.0,0.0,0.0,0.0,1.0,0.0,0.0,0.0,0.0,0.0,0.04424582422110234,0.12002789319231776
2026-04-16,Badee Al Oud Amethyst,Lattafa,arabic,UAE,AED,99.0,22.88,100.0,0.2288,,,in_stock,https://www.amazon.ae/s?k=Lattafa+Badee+Al+Oud+Amethyst+100ml,https://www.fragrantica.com/perfume/Lattafa-Perfumes/Bade-e-Al-Oud-Amethyst-68214.html,,4.04,3729,unisex,Oriental Vanilla,"rose, oud, amber, soft spicy, floral, vanilla, citrus, fresh spicy, white floral","Perfumers, Perfumers","Pink Pepper, Bergamot","Turkish Rose, Bulgarian Rose, Jasmine","Agarwood (Oud), Amber, Vanilla",1700,1100,486,297,157,1200,502,2000,2200,1100,2100,arabic,0.41256684491978607,0.7486631016042781,winter,8,,2,0,0.0,0.0,0.0,0.0,0.0,0.0,0.0,0.0,0.0,0.0,0.0,0.0,0.0,0.0,1.0,0.0,0.0,0.0,0.0,0.0,0.024991283952965036,0.1077665107359735
2026-04-16,Fakhar Black,Lattafa,arabic,UAE,AED,88.0,20.34,100.0,0.2034,,,in_stock,https://www.amazon.ae/s?k=Lattafa+Fakhar+Black+100ml,https://www.fragrantica.com/perfume/Lattafa-Perfumes/Fakhar-Black-70465.html,,4.23,7050,male,Oriental,"aromatic, fresh spicy, woody, fruity, fresh, citrus, lavender, green, amber, herbal","Perfumers, Perfumers","Apple, Bergamot, Ginger","Lavender, Sage, Juniper Berries, Geranium","Tonka Bean, Cedar, Amberwood, Vetiver",3200,2700,774,264,102,4800,4800,3400,1600,4700,3000,arabic,0.4400568181818182,0.8380681818181818,spring,11,,1,0,0.0,0.0,0.0,0.0,0.0,0.0,0.0,0.0,0.0,0.0,1.0,0.0,0.0,0.0,0.0,0.0,0.0,0.0,0.0,0.0,0.02096605495863839,0.20425952291018973
2026-04-16,Raghba Wood Intense,Lattafa,arabic,UAE,AED,151.54,35.03,100.0,0.3503,,,in_stock,https://www.amazon.ae/s?k=Lattafa+Raghba+Wood+Intense+100ml,https://www.fragrantica.com/perfume/Lattafa-Perfumes/Raghba-Wood-Intense-28713.html,,4.1,2049,male,Oriental Woody,"woody, amber, sweet, balsamic, smoky, caramel, vanilla, oud, powdery, soft spicy","Perfumers, Perfumers","Caramel, Licorice, Guaiac Wood, Cedar","Agarwood (Oud), Sugar, Sandalwood, Cashmere Wood","Incense, Vanilla, Amber, Oakmoss, Musk",953,652,209,161,74,323,103,1100,1300,480,1100,arabic,0.4289897510980966,0.7833089311859444,winter,13,,1,0,0.0,0.0,0.0,0.0,0.0,0.0,0.0,0.0,0.0,0.0,0.0,0.0,0.0,0.0,0.0,1.0,0.0,0.0,0.0,0.0,0.04424582422110234,0.05895342417991109
2026-04-16,Hawas for Him,Rasasi,arabic,UAE,AED,89.0,20.57,100.0,0.2057,4.3,,in_stock,https://www.amazon.ae/s?k=Rasasi+Hawas+for+Him+100ml,https://www.fragrantica.com/perfume/Rasasi/Hawas-for-Him-46890.html,,4.31,10075,male,Aromatic Aquatic,"fruity, citrus, aquatic, fresh, warm spicy, amber, sweet, musky, aromatic, animalic","Perfumers, Perfumers","Apple, Bergamot, Lemon, Cinnamon","Watery Notes, Plum, Orange Blossom, Cardamon","Ambergris, Musk, Patchouli, Driftwood",5400,3100,922,409,172,6400,7500,2900,1400,6700,3200,arabic,0.5226432070378886,0.8497450764770569,summer,12,,1,0,0.0,0.0,1.0,0.0,0.0,0.0,0.0,0.0,0.0,0.0,0.0,0.0,0.0,0.0,0.0,0.0,0.0,0.0,0.0,0.0,0.02133054419828214,0.2921521341197664
2026-04-16,Hawas Ice,Rasasi,arabic,UAE,AED,89.0,20.57,100.0,0.2057,4.3,,in_stock,https://www.amazon.ae/s?k=Rasasi+Hawas+Ice+100ml,https://www.fragrantica.com/perfume/Rasasi/Hawas-Ice-89050.html,,4.44,5770,male,Aromatic,"fruity, citrus, sweet, fresh, aromatic, musky, powdery, fresh spicy, green, white floral","Perfumers, Perfumers","Apple, Italian Lemon, Sicilian Bergamot, Star Anise","Plum, Orange Blossom, Cardamon","Musk, Amber, Driftwood, Moss",3600,1500,401,168,105,3800,4300,2100,1000,4000,1800,arabic,0.6052996189816419,0.8832698302736405,summer,11,,1,0,0.0,1.0,0.0,0.0,0.0,0.0,0.0,0.0,0.0,0.0,0.0,0.0,0.0,0.0,0.0,0.0,0.0,0.0,0.0,0.0,0.02133054419828214,0.16706859981985644
2026-04-16,Hawas Black,Rasasi,arabic,UAE,AED,89.0,20.57,100.0,0.2057,4.3,,in_stock,https://www.amazon.ae/s?k=Rasasi+Hawas+Black+100ml,https://www.fragrantica.com/perfume/Rasasi/Hawas-Black-96817.html,,4.26,2660,male,Aromatic Fruity,"woody, citrus, mossy, earthy, fresh spicy, fruity, patchouli, sweet, aromatic","Perfumers, Perfumers","Bergamot, Grapefruit, Pineapple","Patchouli, Cedarwood, Jasmine","Oakmoss, Woody Notes, Amber",1500,633,252,146,100,1600,1500,1600,1400,1600,1500,arabic,0.5321170657544659,0.8107183580387686,spring,9,,1,0,0.0,0.0,0.0,0.0,1.0,0.0,0.0,0.0,0.0,0.0,0.0,0.0,0.0,0.0,0.0,0.0,0.0,0.0,0.0,0.0,0.02133054419828214,0.07670627887381236
2026-04-16,Hawas Elixir,Rasasi,arabic,UAE,AED,89.0,20.57,100.0,0.2057,4.3,,in_stock,https://www.amazon.ae/s?k=Rasasi+Hawas+Elixir+100ml,https://www.fragrantica.com/perfume/Rasasi/Hawas-Elixir-110808.html,,4.54,992,unisex,Oriental Vanilla,"vanilla, aromatic, green, sweet, fresh spicy, warm spicy, amber, chocolate, lavender, powdery","Perfumers, Perfumers","Mint, Bergamot, Artemisia","Dark Chocolate, Lavender, Benzoin","Vanilla, Tonka Bean, White Musk",664,239,57,21,11,316,86,626,754,281,671,arabic,0.6582661290322581,0.9102822580645161,winter,9,,2,0,0.0,0.0,0.0,0.0,0.0,0.0,0.0,0.0,0.0,0.0,0.0,0.0,0.0,0.0,1.0,0.0,0.0,0.0,0.0,0.0,0.02133054419828214,0.028241857221721824
2026-04-16,Hawas Viper,Rasasi,arabic,UAE,AED,89.0,20.57,100.0,0.2057,4.3,,in_stock,https://www.amazon.ae/s?k=Rasasi+Hawas+Viper+100ml,https://www.fragrantica.com/perfume/Rasasi/Hawas-Viper-113594.html,,3.71,140,male,Oriental,"aromatic, warm spicy, tobacco, green, sweet, cannabis, fruity, coffee, herbal, fresh spicy","Perfumers, Perfumers","Saffron, cannabis, Thyme, Green Notes, Davana","Tobacco, Coffee, Cinnamon, Violet, Raspberry","Gurjan balsam, Musk, Tonka",75,18,7,12,28,33,13,58,83,29,66,arabic,0.3357142857142857,0.6642857142857143,winter,13,,1,0,0.0,0.0,0.0,0.0,0.0,0.0,0.0,0.0,0.0,0.0,1.0,0.0,0.0,0.0,0.0,0.0,0.0,0.0,0.0,0.0,0.02133054419828214,0.003486649039718744
2026-04-16,Royal Blend Bourbon,French Avenue,arabic,UAE,AED,127.0,29.36,100.0,0.2936,4.3,,in_stock,https://www.amazon.ae/s?k=French+Avenue+Royal+Blend+Bourbon+100ml,https://www.fragrantica.com/perfume/French-Avenue/Royal-Blend-Bourbon-103478.html,,3.69,216,unisex,Aromatic,"woody, warm spicy, aromatic, cinnamon, green, fresh spicy, balsamic, amber","Perfumers, Perfumers","Cinnamon, Peppermint, Bark, Basil","Bourbon Whiskey, Lavender","Oak, Peru Balsam",77,65,25,29,20,39,10,106,116,43,101,arabic,0.2638888888888889,0.6574074074074074,winter,8,,2,0,0.0,1.0,0.0,0.0,0.0,0.0,0.0,0.0,0.0,0.0,0.0,0.0,0.0,0.0,0.0,0.0,0.0,0.0,0.0,0.0,0.035260372095971604,0.005694860098207281
2026-04-16,Azzure Oud,French Avenue,arabic,UAE,AED,146.85,33.94,100.0,0.3394,4.1,,in_stock,https://www.amazon.ae/s?k=French+Avenue+Azzure+Oud+100ml,https://www.fragrantica.com/perfume/French-Avenue/Azzure-Oud-94714.html,,3.83,1414,male,Oriental,"fruity, oud, leather, sweet, woody, tropical, amber, warm spicy, animalic, fresh","Perfumers, Perfumers","Passionfruit, Fruity Notes, Rose, Saffron","Oud, Benzoin, Patchouli","Leather, Amber, Guaiac Wood, Cedarwood, Sandalwood, Vanilla, Labdanum",642,337,135,146,154,433,166,761,947,415,817,arabic,0.3451202263083451,0.6923620933521923,winter,14,,1,0,0.0,0.0,0.0,0.0,0.0,0.0,0.0,0.0,0.0,0.0,1.0,0.0,0.0,0.0,0.0,0.0,0.0,0.0,0.0,0.0,0.04251846217235586,0.04050323967806607
2026-04-16,Vulcan Feu,French Avenue,arabic,UAE,AED,164.85,38.1,100.0,0.381,4.5,,in_stock,https://www.amazon.ae/s?k=French+Avenue+Vulcan+Feu+100ml,https://www.fragrantica.com/perfume/French-Avenue/Vulcan-Feu-105520.html,,4.45,4326,unisex,Floral,"tropical, fruity, sweet, citrus, woody, fresh, fresh spicy, aromatic, terpenic, amber","Perfumers, Perfumers","Mango, Lemon, Ginger, Rhubarb","Pink Pepper, Jasmine, Violet, Praline","Tonka Bean, Cedarwood, Ambergris, Moss",2900,901,309,167,88,2600,3200,860,363,2800,1000,arabic,0.6442153493699886,0.8707903780068729,summer,12,,2,0,0.0,0.0,0.0,0.0,0.0,0.0,0.0,1.0,0.0,0.0,0.0,0.0,0.0,0.0,0.0,0.0,0.0,0.0,0.0,0.0,0.04911096320243415,0.12511258970857425
2026-04-16,Veneno,French Avenue,arabic,UAE,AED,180.0,41.61,100.0,0.4161,4.2,,in_stock,https://www.amazon.ae/s?k=French+Avenue+Veneno+100ml,https://www.fragrantica.com/perfume/French-Avenue/Veneno-105519.html,,4.19,461,unisex,Aromatic Fruity,"smoky, fruity, cinnamon, tobacco, warm spicy, vanilla, sweet, fresh, green, mossy","Perfumers, Perfumers, Jean-Louis Sieuzac","Apple, Smoke, Cinnamon","Tobacco, Moss","Bourbon Vanilla, Orcanox™",242,131,39,32,17,97,33,264,293,86,261,arabic,0.4880694143167028,0.8091106290672451,winter,7,,2,0,0.0,0.0,0.0,0.0,1.0,0.0,0.0,0.0,0.0,0.0,0.0,0.0,0.0,0.0,0.0,0.0,0.0,0.0,0.0,0.0,0.05467338594656271,0.012813435220966384
2026-04-16,Tres Nuit,Armaf,arabic,UAE,AED,75.0,17.34,100.0,0.1734,4.0,,in_stock,https://www.amazon.ae/s?k=Armaf+Tres+Nuit+100ml,https://www.fragrantica.com/perfume/Armaf/Tres-Nuit-27711.html,,4.13,3328,male,Aromatic Spicy,"powdery, violet, lavender, woody, iris, citrus, amber, aromatic, floral, animalic","Perfumers, Perfumers","Iris, Lemon, Vervain","Lavender, Violet, Spicy Notes","Ambergris, Sandalwood",1400,1300,323,267,47,1900,1800,1000,296,1900,699,arabic,0.4054540005993407,0.8091099790230746,spring,8,,1,0,0.0,0.0,0.0,0.0,0.0,1.0,0.0,0.0,0.0,0.0,0.0,0.0,0.0,0.0,0.0,0.0,0.0,0.0,0.0,0.0,0.016211847485024244,0.09611529186158004
2026-04-16,L'Aventure,Al Haramain,arabic,UAE,AED,250.0,57.79,100.0,0.5779,4.3,,in_stock,https://www.amazon.ae/s?k=Al+Haramain+L+Aventure+100ml,https://www.fragrantica.com/perfume/Al-Haramain-Perfumes/L-Aventure-40405.html,,4.17,2697,male,Chypre Fruity,"citrus, aromatic, woody, musky, fresh spicy, white floral, powdery","Perfumers, Perfumers","Lemon, Bergamot, elemi","Woody Notes, Jasmine, Lily-of-the-Valley","Musk, Patchouli, Amber",1300,943,243,198,54,1500,1500,1200,550,1500,928,arabic,0.4550766983199416,0.8192111029948868,spring,9,,1,0,0.0,0.0,0.0,0.0,0.0,0.0,1.0,0.0,0.0,0.0,0.0,0.0,0.0,0.0,0.0,0.0,0.0,0.0,0.0,0.0,0.08031441158758834,0.07778132899439232
2026-04-16,L'Aventure Knight,Al Haramain,arabic,UAE,AED,250.0,57.79,100.0,0.5779,4.3,,in_stock,https://www.amazon.ae/s?k=Al+Haramain+L+Aventure+Knight+100ml,https://www.fragrantica.com/perfume/Al-Haramain-Perfumes/L-Aventure-Knight-51824.html,,3.99,868,male,Oriental Fougere,"powdery, citrus, ozonic, iris, woody, amber, green, musky, aquatic, animalic","Perfumers, Perfumers","Lemon Verbena, Bergamot, Tea","Violet Leaf, Iris","Powdery Notes, Ambergris, Musk, Sandalwood",353,300,102,82,31,530,477,345,133,511,271,arabic,0.3709677419354839,0.7523041474654378,spring,9,,1,0,0.0,0.0,0.0,0.0,0.0,0.0,0.0,0.0,0.0,0.0,0.0,0.0,1.0,0.0,0.0,0.0,0.0,0.0,0.0,0.0,0.08031441158758834,0.02463898654734579
2026-04-16,Supremacy Silver,Afnan,arabic,UAE,AED,111.0,25.66,100.0,0.2566,3.9,,in_stock,https://www.amazon.ae/s?k=Afnan+Supremacy+Silver+100ml,https://www.fragrantica.com/perfume/Afnan/Supremacy-Silver-27352.html,,4.06,2262,male,Woody Floral Musk,"fruity, leather, woody, sweet, smoky, citrus, musky, mossy, tropical, fresh","Perfumers, Perfumers, Imran Fazlani","Pineapple, Black Currant, Bergamot, Apple","Birch, Patchouli, Moroccan Jasmine, Rose","Musk, Oakmoss, Ambergris, Vanilla",958,801,246,198,59,1200,1200,964,465,1200,753,arabic,0.3974358974358974,0.7776304155614501,spring,12,,1,0,0.0,0.0,0.0,0.0,0.0,0.0,0.0,0.0,0.0,0.0,0.0,0.0,0.0,0.0,0.0,0.0,0.0,0.0,1.0,0.0,0.029396849545180813,0.06514222622541187
2026-04-16,Supremacy Gold,Afnan,arabic,UAE,AED,97.0,22.42,100.0,0.2242,5.0,,in_stock,https://www.amazon.ae/s?k=Afnan+Supremacy+Gold+100ml,https://www.fragrantica.com/perfume/Afnan/Supremacy-Gold-27351.html,,3.83,247,unisex,Oriental,"amber, powdery, fresh spicy, floral, violet, vanilla, iris, oud, warm spicy, woody","Perfumers, Perfumers","Nutmeg, Violet, Peach Blossom, Cumin","Iris, Patchouli","Amber, Vanilla, Agarwood (Oud), Benzoin",87,80,39,33,8,96,49,121,105,82,98,arabic,0.31983805668016196,0.6761133603238867,fall,10,,2,0,0.0,0.0,0.0,0.0,0.0,0.0,0.0,0.0,0.0,0.0,1.0,0.0,0.0,0.0,0.0,0.0,0.0,0.0,0.0,0.0,0.02426230547367754,0.00659557776680129
2026-04-16,Saffron Oud,Arabian Oud,arabic,UAE,AED,550.0,127.13,100.0,1.2713,4.0,,in_stock,https://www.amazon.ae/s?k=Arabian+Oud+Saffron+Oud+100ml,https://www.fragrantica.com/perfume/Arabian-Oud/Saffron-Oud-91547.html,,4.7,79,unisex,,,"Perfumers, Perfumers",,,,59,17,2,1,0,30,16,40,49,28,46,arabic,0.7468354430379747,0.9620253164556962,winter,0,,2,0,1.0,0.0,0.0,0.0,0.0,0.0,0.0,0.0,0.0,0.0,0.0,0.0,0.0,0.0,0.0,0.0,0.0,0.0,0.0,0.0,0.1901999936610567,0.0017142691111950493
2026-04-17,Fahrenheit,Dior,designer,USA,USD,100.0,84.88,100.0,0.8488,4.6,,in_stock,https://www.amazon.com/s?k=Dior+Fahrenheit,https://www.fragrantica.com/perfume/Dior/Fahrenheit-228.html,,4.0,22029,male,Aromatic Fougere,"leather, woody, ozonic, fresh spicy, aromatic, animalic, aquatic, floral, citrus, green","Perfumers, Perfumers, Jean-Louis Sieuzac, Maurice Roger, Michel Almairac","Nutmeg Flower, Lavender, Cedar, Mandarin Orange, Chamomile, Bergamot, Hawthorn, Lemon","Violet Leaf, Nutmeg, Cedar, Sandalwood, Carnation, Honeysuckle, Jasmine, Lily-of-the-Valley","Leather, Vetiver, Musk, Amber, Patchouli, Tonka Bean",10600,6100,989,3300,979,4400,2200,7900,8000,5500,7900,designer,0.43795520757465406,0.7601966496722505,winter,21,,1,1,0.0,0.0,0.0,1.0,0.0,0.0,0.0,0.0,0.0,0.0,0.0,0.0,0.0,0.0,0.0,0.0,0.0,0.0,0.0,0.0,0.12324490507432409,0.6394804892930819
2026-04-17,Dior Homme Intense 2025,Dior,designer,USA,USD,177.43,150.59,100.0,1.5059,4.1,,in_stock,https://www.amazon.com/s?k=Dior+Homme+Intense,https://www.fragrantica.com/perfume/Dior/Dior-Homme-Intense-2025-101596.html,,4.1,1815,male,Oriental Woody,"iris, woody, powdery, musky, violet, floral, earthy","Perfumers, Perfumers",Tuscan Iris,Ambrette,Virginia Cedar,1100,331,135,88,192,424,132,866,962,435,853,designer,0.49187432286023836,0.7751895991332611,winter,3,,1,1,0.0,0.0,0.0,0.0,0.0,0.0,0.0,0.0,0.0,0.0,0.0,0.0,0.0,0.0,0.0,1.0,0.0,0.0,0.0,0.0,0.22737789610471934,0.05215445855245954
2026-04-17,Miss Dior EDP 2021,Dior,designer,USA,USD,162.51,137.93,100.0,1.3793,4.6,,in_stock,https://www.amazon.com/s?k=Dior+Miss+Dior+Eau+de+Parfum,https://www.fragrantica.com/perfume/Dior/Miss-Dior-Eau-de-Parfum-2021--68905.html,,3.89,6646,female,Oriental Floral,"powdery, vanilla, rose, floral, fruity, sweet, fresh, iris, musky, amber","Perfumers, Perfumers, François Demachy","Iris, Peony, Lily-of-the-Valley","Rose, Apricot, Peach","Vanilla, Musk, Tonka Bean, Sandalwood, Benzoin",2400,2200,1100,711,195,2700,1600,1600,1200,2600,1000,designer,0.3337874659400545,0.696336663639116,spring,11,,0,1,0.0,0.0,0.0,0.0,0.0,0.0,0.0,0.0,0.0,0.0,0.0,1.0,0.0,0.0,0.0,0.0,0.0,0.0,0.0,0.0,0.20731514056606762,0.1925211378098033
2026-04-17,J'adore,Dior,designer,USA,USD,151.99,129.0,100.0,1.29,4.6,,in_stock,https://www.amazon.com/s?k=Dior+Jadore,https://www.fragrantica.com/perfume/Dior/J-adore-210.html,,3.8,28786,female,Floral Fruity,"white floral, floral, fruity, sweet, fresh, citrus, aquatic, powdery, ozonic, tuberose","Perfumers, Perfumers, Calice Becker","Pear, Melon, Magnolia, Peach, Mandarin Orange, Bergamot","Jasmine, Lily-of-the-Valley, Tuberose, Freesia, Rose, Orchid, Violet, Plum","Musk, Vanilla, Cedar, Blackberry",9000,11600,2000,5700,489,8100,4900,5800,4200,8700,5500,designer,0.2956337490013547,0.7155510785369412,spring,18,,0,1,0.0,0.0,0.0,0.0,0.0,0.0,0.0,0.0,0.0,1.0,0.0,0.0,0.0,0.0,0.0,0.0,0.0,0.0,0.0,0.0,0.19316344965294285,0.8358078856379114
2026-04-17,Gris Dior,Dior,designer,USA,USD,117.99,100.14,100.0,1.0014,4.5,,in_stock,https://www.amazon.com/s?k=Dior+Gris+Dior,https://www.fragrantica.com/perfume/Dior/Gris-Dior-48387.html,,4.21,3552,unisex,Floral,"woody, earthy, mossy, rose, patchouli, citrus, warm spicy, amber, powdery, floral","Perfumers, Perfumers, François Demachy","Oakmoss, Rose, Patchouli, Bergamot, Cedar, Amber, Sandalwood",,,1800,1100,381,201,95,1400,962,1400,1000,1400,1000,designer,0.47665641599105396,0.8107352530053117,spring,7,,2,1,0.0,0.0,0.0,0.0,0.0,0.0,0.0,1.0,0.0,0.0,0.0,0.0,0.0,0.0,0.0,0.0,0.0,0.0,0.0,0.0,0.14742797375677474,0.10262370340238836
2026-04-17,Silver Mountain Water,Creed,designer,USA,USD,490.0,415.89,100.0,4.1589,4.2,,in_stock,https://www.amazon.com/s?k=Creed+Silver+Mountain+Water,https://www.fragrantica.com/perfume/Creed/Silver-Mountain-Water-472.html,,4.16,10445,unisex,Aromatic,"citrus, green, fruity, musky, woody, aromatic, powdery, fresh spicy, fresh, floral","Perfumers, Perfumers, Olivier Creed, Pierre Bourdon","Bergamot, Mandarin Orange","Green Tea, Black Currant","Musk, Sandalwood, Petitgrain, Galbanum",5000,3400,986,920,158,4600,4600,1600,991,4600,1200,niche,0.46272935779816515,0.8027522935779816,spring,8,,2,2,0.0,1.0,0.0,0.0,0.0,0.0,0.0,0.0,0.0,0.0,0.0,0.0,0.0,0.0,0.0,0.0,0.0,0.0,0.0,0.0,0.6478083103546638,0.3029026353255659
2026-04-17,Green Irish Tweed,Creed,designer,USA,USD,490.0,415.89,100.0,4.1589,4.2,,in_stock,https://www.amazon.com/s?k=Creed+Green+Irish+Tweed,https://www.fragrantica.com/perfume/Creed/Green-Irish-Tweed-474.html,,4.3,11655,male,Woody Floral Musk,"ozonic, aquatic, iris, powdery, woody, amber, animalic, violet, balsamic, green","Perfumers, Perfumers, Olivier Creed, Pierre Bourdon","Iris, Vervain",Violet Leaf,"Ambergris, Sandalwood",6700,3100,766,977,171,5800,4800,3500,1400,5500,2400,niche,0.5573672528598258,0.8366057708724604,spring,5,,1,2,0.0,0.0,0.0,0.0,0.0,0.0,0.0,0.0,0.0,0.0,0.0,0.0,0.0,0.0,0.0,0.0,0.0,0.0,1.0,0.0,0.6478083103546638,0.33805967980939655
2026-04-17,Millesime Imperial,Creed,designer,USA,USD,37.0,31.4,100.0,0.314,5.0,,in_stock,https://www.amazon.com/s?k=Creed+Millesime+Imperial,https://www.fragrantica.com/perfume/Creed/Millesime-Imperial-466.html,,4.23,7084,unisex,Woody Floral Musk,"marine, citrus, salty, fruity, aromatic, powdery, musky, sweet, woody, iris","Perfumers, Perfumers, Olivier Creed, Pierre Bourdon","Sea Salt, Fruity Notes","Sicilian Lemon, Bergamot, Iris, Mandarin Orange","Sea Notes, Musk, Woody Notes",3600,2200,554,594,81,2700,3400,875,361,3200,944,niche,0.5006402048655569,0.8251529378289941,summer,9,,2,2,0.0,0.0,0.0,0.0,0.0,0.0,0.0,0.0,0.0,0.0,0.0,0.0,0.0,0.0,0.0,0.0,0.0,0.0,1.0,0.0,0.03849323317802922,0.2052474068047767
2026-04-17,Viking,Creed,designer,USA,USD,510.0,432.86,100.0,4.3286,4.2,,in_stock,https://www.amazon.com/s?k=Creed+Viking,https://www.fragrantica.com/perfume/Creed/Viking-41698.html,,3.96,4102,male,Woody Aromatic,"aromatic, fresh spicy, green, citrus, soft spicy, lavender, woody, rose, musky, warm spicy","Perfumers, Perfumers, Olivier Creed","Pink Pepper, Peppermint, Bergamot, Lemon, Absinthe, Orange","Lavender, Bulgarian Rose, Clove, Allspice, Orris Root, Jasmine","Vetiver, Cedar, White Musk, Tonka Bean",1800,1200,458,572,108,1700,1200,1700,1300,1800,1200,niche,0.4088931851135814,0.7249879168680522,spring,16,,1,2,0.0,0.0,0.0,0.0,0.0,0.0,0.0,0.0,0.0,0.0,0.0,0.0,0.0,0.0,0.0,0.0,0.0,1.0,0.0,0.0,0.6747012772970745,0.11860417816776593
2026-04-17,Royal Oud,Creed,designer,USA,USD,41.99,35.64,100.0,0.3564,3.8,,in_stock,https://www.amazon.com/s?k=Creed+Royal+Oud,https://www.fragrantica.com/perfume/Creed/Royal-Oud-12317.html,,4.36,5502,unisex,Oriental Fougere,"woody, musky, powdery, citrus, aromatic, soft spicy, oud, green, amber","Perfumers, Perfumers, Julien Rasquinet, Olivier Creed","Pink Pepper, Lemon, Sicilian Bergamot","Cedar, Angelica, Galbanum","Sandalwood, Agarwood (Oud), Musk",3300,1500,311,404,60,1700,696,2400,2200,1800,2100,niche,0.5811659192825112,0.8609865470852018,fall,9,,2,2,0.0,0.0,0.0,0.0,0.0,0.0,0.0,0.0,0.0,0.0,0.0,0.0,1.0,0.0,0.0,0.0,0.0,0.0,0.0,0.0,0.045212513074070544,0.15928175029781794
