scrape_date,name,brand,category,country,currency,price,price_eur,bottle_size_ml,price_per_ml,amazon_rating,amazon_reviews,availability,amazon_url,fragrantica_url,year,rating,votes,gender,fragrance_family,main_accords,perfumers,top_notes,middle_notes,base_notes,votes_love,votes_like,votes_ok,votes_dislike,votes_hate,season_spring,season_summer,season_fall,season_winter,wear_day,wear_night,brand_origin,sentiment_polarisation,crowd_pleaser_index,season_dominant,note_count,years_on_market,gender_id,brand_origin_id,fam_,fam_aromatic,fam_aromatic_aquatic,fam_aromatic_fougere,fam_aromatic_fruity,fam_aromatic_spicy,fam_chypre_fruity,fam_floral,fam_floral_aldehyde,fam_floral_fruity,fam_oriental,fam_oriental_floral,fam_oriental_fougere,fam_oriental_spicy,fam_oriental_vanilla,fam_oriental_woody,fam_woody_aquatic,fam_woody_aromatic,fam_woody_floral_musk,fam_woody_spicy,price_per_ml_scaled,votes_scaled
2026-04-14,Le Male,Jean Paul Gaultier,designer,USA,USD,77.68,66.48,100.0,0.6648,4.6,,in_stock,https://www.amazon.com/s?k=Jean+Paul+Gaultier+Le+Male,https://www.fragrantica.com/perfume/Jean-Paul-Gaultier/Le-Male-430.html,,4.0,24153,female,Oriental Fougere,"aromatic, vanilla, fresh spicy, lavender, warm spicy, green, powdery, sweet, amber, woody","Perfumers, Perfumers, Francis Kurkdjian","Lavender, Mint, Cardamom, Bergamot, Artemisia","Cinnamon, Orange Blossom, Caraway","Vanilla, Tonka Bean, Amber, Sandalwood, Cedar",9800,8800,1900,3200,458,8500,5600,9400,9600,9100,9500,designer,0.38670419736733175,0.7699312857024588,winter,13,,0,1,0.0,0.0,0.0,0.0,0.0,0.0,0.0,0.0,0.0,0.0,0.0,0.0,1.0,0.0,0.0,0.0,0.0,0.0,0.0,0.0,0.09399961962723467,0.7018059150260273
2026-04-14,Ultra Male,Jean Paul Gaultier,designer,USA,USD,91.99,78.73,100.0,0.7873,4.7,,in_stock,https://www.amazon.com/s?k=Jean+Paul+Gaultier+Ultra+Male,https://www.fragrantica.com/perfume/Jean-Paul-Gaultier/Ultra-Male-30947.html,,4.45,16731,male,Oriental Fougere,"vanilla, fruity, aromatic, sweet, cinnamon, warm spicy, fresh spicy, lavender, powdery, green","Perfumers, Perfumers, Francis Kurkdjian","Pear, Lavender, Mint, Bergamot, Lemon","Cinnamon, Clary Sage, Caraway","Black Vanilla Husk, Amber, Patchouli, Cedar",10700,4100,828,871,202,5600,2700,9200,10400,4000,10400,designer,0.6285851146637926,0.8861744805700258,winter,12,,1,1,0.0,0.0,0.0,0.0,0.0,0.0,0.0,0.0,0.0,0.0,0.0,0.0,1.0,0.0,0.0,0.0,0.0,0.0,0.0,0.0,0.11341447952326612,0.4859685346206415
2026-04-14,Le Male Le Parfum,Jean Paul Gaultier,designer,USA,USD,105.9,90.64,125.0,0.7251,,,in_stock,https://www.amazon.com/s?k=Jean+Paul+Gaultier+Le+Male+Le+Parfum,https://www.fragrantica.com/perfume/Jean-Paul-Gaultier/Le-Male-Le-Parfum-61856.html,,4.6,25603,male,Oriental,"warm spicy, vanilla, lavender, aromatic, powdery, iris, woody, amber, violet","Perfumers, Perfumers, Natalie Gracia-Cetto, Quentin Bisch",Cardamom,"Lavender, Iris","Vanilla, Oriental notes, Woodsy Notes",18800,4600,1200,577,377,7900,2800,16200,18800,7200,16800,designer,0.7209438835407372,0.915707912655553,winter,6,,1,1,0.0,0.0,0.0,0.0,0.0,0.0,0.0,0.0,0.0,0.0,1.0,0.0,0.0,0.0,0.0,0.0,0.0,0.0,0.0,0.0,0.10355648535564853,0.74397301305726
2026-04-14,Classique,Jean Paul Gaultier,designer,USA,USD,82.58,70.68,100.0,0.7068,4.6,,in_stock,https://www.amazon.com/s?k=Jean+Paul+Gaultier+Classique,https://www.fragrantica.com/perfume/Jean-Paul-Gaultier/Classique-427.html,,3.92,12440,female,Oriental Floral,"white floral, sweet, powdery, citrus, vanilla, soft spicy, floral, anis, woody, yellow floral","Perfumers, Perfumers, Jacques Cavallier Belletrud","Orange Blossom, Star Anise, Rose, Mandarin Orange, Pear, Bergamot","Ylang-Ylang, Ginger, Orchid, Tuberose, Iris, Plum","Vanilla, Amber, Musk, Cinnamon, Sandalwood",4700,4700,507,2300,169,1700,1100,3100,3300,2400,3500,designer,0.36611182934712344,0.7595345830639948,winter,17,,0,1,0.0,0.0,0.0,0.0,0.0,0.0,0.0,0.0,0.0,0.0,0.0,1.0,0.0,0.0,0.0,0.0,0.0,0.0,0.0,0.0,0.10065614302015975,0.36118300520545554
2026-04-14,Scandal Pour Homme,Jean Paul Gaultier,designer,USA,USD,84.52,72.34,100.0,0.7234,4.6,,in_stock,https://www.amazon.com/s?k=Jean+Paul+Gaultier+Scandal+Pour+Homme,https://www.fragrantica.com/perfume/Jean-Paul-Gaultier/Scandal-Pour-Homme-68074.html,,4.27,6998,male,Oriental Woody,"caramel, aromatic, sweet, citrus, vanilla, amber, soft spicy, woody","Perfumers, Perfumers, Christophe Raynaud, Natalie Gracia-Cetto, Quentin Bisch","Mandarin Orange, Clary Sage","Caramel, Tonka Bean",Vetiver,3900,1900,641,365,193,2300,947,4000,4400,2100,4100,designer,0.5296470924417774,0.8286898128304043,winter,5,,1,1,0.0,0.0,0.0,0.0,0.0,0.0,0.0,0.0,0.0,0.0,0.0,0.0,0.0,0.0,0.0,1.0,0.0,0.0,0.0,0.0,0.10328705464688728,0.20292552418064963
2026-04-14,Le Male Elixir,Jean Paul Gaultier,designer,USA,USD,101.45,86.83,100.0,0.8683,3.2,,in_stock,https://www.amazon.com/s?k=Jean+Paul+Gaultier+Le+Male+Elixir,https://www.fragrantica.com/perfume/Jean-Paul-Gaultier/Le-Male-Elixir-81642.html,,4.52,23518,male,Oriental Fougere,"vanilla, sweet, honey, aromatic, amber, lavender, tobacco, green, fresh spicy, powdery","Perfumers, Perfumers, Quentin Bisch","Lavender, Mint","Vanilla, Benzoin","Honey, Tonka Bean, Tobacco",16800,4100,1300,746,579,5000,2300,14000,18000,6500,14900,designer,0.6895217853347503,0.8884165781083954,winter,7,,1,1,0.0,0.0,0.0,0.0,0.0,0.0,0.0,0.0,0.0,0.0,0.0,0.0,1.0,0.0,0.0,0.0,0.0,0.0,0.0,0.0,0.12625206035247877,0.6833396341640736
2026-04-14,Bleu de Chanel,Chanel,designer,USA,USD,173.95,148.88,100.0,1.4888,5.0,,in_stock,https://www.amazon.com/s?k=Chanel+Bleu+de+Chanel,https://www.fragrantica.com/perfume/Chanel/Bleu-de-Chanel-9099.html,,4.18,20400,male,Woody Aromatic,"citrus, woody, fresh spicy, aromatic, amber, smoky, balsamic, warm spicy, green, fresh","Perfumers, Perfumers, Jacques Polge","Grapefruit, Lemon, Mint, Pink Pepper","Ginger, Nutmeg, Jasmine, Iso E Super","Incense, Cedar, Vetiver, Sandalwood, Patchouli, Labdanum, White Musk",9700,7300,1200,2000,215,8500,7800,7200,5000,8600,7500,designer,0.46460935586578495,0.8327210384521185,spring,15,,1,1,0.0,0.0,0.0,0.0,0.0,0.0,0.0,0.0,0.0,0.0,0.0,0.0,0.0,0.0,0.0,0.0,0.0,1.0,0.0,0.0,0.22459426905033597,0.5926658330182918
2026-04-14,Allure Homme Sport,Chanel,designer,USA,USD,167.99,143.78,100.0,1.4378,4.2,,in_stock,https://www.amazon.com/s?k=Chanel+Allure+Homme+Sport,https://www.fragrantica.com/perfume/Chanel/Allure-Homme-Sport-607.html,,4.26,15010,male,Woody Spicy,"citrus, aromatic, vanilla, aldehydic, marine, sweet, fresh spicy, fresh, amber, powdery","Perfumers, Perfumers, Jacques Polge","Orange, Sea Notes, Aldehydes, Blood Mandarin","Pepper, Neroli, Cedar","Vanilla, Tonka Bean, White Musk, Amber, Vetiver, Elemi resin",7500,5400,835,1200,118,6200,7000,2900,1400,7000,2400,designer,0.4904005846010762,0.8569720321530592,summer,13,,1,1,0.0,0.0,0.0,0.0,0.0,0.0,0.0,0.0,0.0,0.0,0.0,0.0,0.0,0.0,0.0,0.0,0.0,0.0,0.0,1.0,0.21651134778749842,0.43592055137115765
2026-04-14,Coco Mademoiselle,Chanel,designer,USA,USD,173.15,148.19,100.0,1.4819,4.4,,in_stock,https://www.amazon.com/s?k=Chanel+Coco+Mademoiselle,https://www.fragrantica.com/perfume/Chanel/Coco-Mademoiselle-611.html,,4.11,32623,female,Oriental Floral,"citrus, woody, patchouli, sweet, white floral, rose, earthy, vanilla, warm spicy, yellow floral","Perfumers, Perfumers, Jacques Polge","Orange, Mandarin Orange, Bergamot, Orange Blossom","Turkish Rose, Jasmine, Mimosa, Ylang-Ylang","Patchouli, White Musk, Vanilla, Vetiver, Tonka Bean, Opoponax",14800,11500,1800,4000,506,9100,5100,8500,7400,10600,7200,designer,0.43838557320738514,0.8066000122676807,spring,14,,0,1,0.0,0.0,0.0,0.0,0.0,0.0,0.0,0.0,0.0,0.0,0.0,1.0,0.0,0.0,0.0,0.0,0.0,0.0,0.0,0.0,0.22350069735006975,0.9481199290429523
2026-04-14,Chanel No 5 Eau Premiere,Chanel,designer,USA,USD,209.0,178.88,100.0,1.7888,4.4,,in_stock,https://www.amazon.com/s?k=Chanel+No+5+Eau+Premiere,https://www.fragrantica.com/perfume/Chanel/Chanel-N-5-Eau-Premiere-1360.html,,4.21,6177,female,Floral Aldehyde,"woody, aldehydic, fresh, white floral, yellow floral, vanilla, sweet, rose, floral, powdery","Perfumers, Perfumers, Jacques Polge","Aldehydes, Ylang-Ylang, Neroli","Jasmine, Tincture of Rose","Vanille, Sandalwood, Vetyver",2900,2400,72,752,12,1400,820,1100,891,1700,851,designer,0.4706649282920469,0.863754889178618,spring,8,,0,1,0.0,0.0,0.0,0.0,0.0,0.0,0.0,0.0,1.0,0.0,0.0,0.0,0.0,0.0,0.0,0.0,0.0,0.0,0.0,0.0,0.27214086471408644,0.17905022246779304
2026-04-14,Egoiste Platinum,Chanel,designer,USA,USD,171.95,147.17,100.0,1.4717,4.4,,in_stock,https://www.amazon.com/s?k=Chanel+Egoiste+Platinum,https://www.fragrantica.com/perfume/Chanel/Egoiste-Platinum-614.html,,4.23,11901,male,Woody Floral Musk,"aromatic, fresh spicy, woody, lavender, green, herbal","Perfumers, Perfumers, Jacques Polge","Lavender, Rosemary, Neroli, Petitgrain","Geranium, Clary Sage, Galbanum, Jasmine","Oakmoss, Vetiver, Cedar, Sandalwood, Amber",6200,3700,606,1200,151,4900,4200,3700,2100,5000,2700,designer,0.5101627730454584,0.8349498186725142,spring,13,,1,1,0.0,0.0,0.0,0.0,0.0,0.0,0.0,0.0,0.0,0.0,0.0,0.0,0.0,0.0,0.0,0.0,0.0,0.0,1.0,0.0,0.22188411309750222,0.3455084770407421
2026-04-14,Oud Wood,Tom Ford,designer,USA,USD,180.0,154.06,100.0,1.5406,3.0,,in_stock,https://www.amazon.com/s?k=Tom+Ford+Oud+Wood,https://www.fragrantica.com/perfume/Tom-Ford/Oud-Wood-1826.html,,4.29,16675,unisex,Oriental Woody,"woody, oud, warm spicy, aromatic, vanilla, balsamic, fresh spicy, amber, powdery, sweet","Perfumers, Perfumers, Richard Herpin","Agarwood (Oud), Brazilian Rosewood, Cardamom, Sandalwood, Sichuan Pepper, Vanilla, Vetiver, Tonka Bean, Amber",,,9300,4700,1300,1100,313,4000,1700,7500,7300,4700,6800,niche,0.5377251241548495,0.8376712738586729,fall,9,,2,2,0.0,0.0,0.0,0.0,0.0,0.0,0.0,0.0,0.0,0.0,0.0,0.0,0.0,0.0,0.0,1.0,0.0,0.0,0.0,0.0,0.23280398123494359,0.48434001221391804
2026-04-14,Black Orchid,Tom Ford,designer,USA,USD,132.94,113.78,100.0,1.1378,5.0,,in_stock,https://www.amazon.com/s?k=Tom+Ford+Black+Orchid,https://www.fragrantica.com/perfume/Tom-Ford/Black-Orchid-1018.html,,3.89,31376,female,Oriental Floral,"warm spicy, earthy, woody, sweet, amber, patchouli, floral, chocolate, powdery, balsamic","Perfumers, Perfumers, David Apel, Pierre Negrin","Truffle, Gardenia, Black Currant, Ylang-Ylang, Jasmine, Bergamot, Mandarin Orange, Amalfi Lemon","Orchid, Spices, Gardenia, Fruity Notes, Ylang-Ylang, Jasmine, Lotus","Mexican chocolate, Patchouli, Vanille, Incense, Amber, Sandalwood, Vetiver, White Musk",13700,8900,1900,5400,1500,3000,1700,10000,12000,3600,12300,niche,0.3885350318471338,0.7197452229299363,winter,20,,0,2,0.0,0.0,0.0,0.0,0.0,0.0,0.0,0.0,0.0,0.0,0.0,1.0,0.0,0.0,0.0,0.0,0.0,0.0,0.0,0.0,0.16896475212374792,0.9118562247360922
2026-04-14,Tobacco Vanille,Tom Ford,designer,USA,USD,145.0,124.1,100.0,1.241,4.4,,in_stock,https://www.amazon.com/s?k=Tom+Ford+Tobacco+Vanille,https://www.fragrantica.com/perfume/Tom-Ford/Tobacco-Vanille-1825.html,,4.19,29838,unisex,Oriental Spicy,"vanilla, sweet, tobacco, warm spicy, fruity, woody, cacao, powdery","Perfumers, Perfumers, Olivier Gillotin","Tobacco Leaf, Spicy Notes","Vanilla, Cacao, Tonka Bean, Tobacco Blossom","Dried Fruits, Woody Notes",16200,7800,2000,2900,953,2500,1600,11700,14300,5100,12300,niche,0.5107359394365726,0.803939302582655,winter,8,,2,2,0.0,0.0,0.0,0.0,0.0,0.0,0.0,0.0,0.0,0.0,0.0,0.0,0.0,1.0,0.0,0.0,0.0,0.0,0.0,0.0,0.18532078103207814,0.8671300200657225
2026-04-14,Lost Cherry,Tom Ford,designer,USA,USD,91.29,78.13,100.0,0.7813,4.4,,in_stock,https://www.amazon.com/s?k=Tom+Ford+Lost+Cherry,https://www.fragrantica.com/perfume/Tom-Ford/Lost-Cherry-51411.html,,4.07,16966,unisex,Oriental Floral,"cherry, sweet, almond, nutty, fruity, vanilla, warm spicy, amber, woody, balsamic","Perfumers, Perfumers, Louise Turner","Bitter Almond, Black Cherry, Cherry Liqueur","Sour Cherry, Plum, Turkish Rose, Jasmine Sambac","Vanilla, Tonka Bean, Cinnamon, Peru Balsam, Sandalwood, Benzoin, Cloves, Cedar, Patchouli, Vetiver",8000,5000,1900,1500,627,3400,2100,6300,6100,4100,6000,niche,0.4330181476478534,0.7634932753861514,fall,17,,2,2,0.0,0.0,0.0,0.0,0.0,0.0,0.0,0.0,0.0,0.0,0.0,1.0,0.0,0.0,0.0,0.0,0.0,0.0,0.0,0.0,0.11246354760999111,0.49280251257742747
2026-04-14,Tuscan Leather,Tom Ford,designer,USA,USD,144.85,123.97,100.0,1.2397,4.4,,in_stock,https://www.amazon.com/s?k=Tom+Ford+Tuscan+Leather,https://www.fragrantica.com/perfume/Tom-Ford/Tuscan-Leather-1849.html,,4.26,10176,unisex,Leather,"leather, fruity, animalic, sweet, amber, smoky, warm spicy, woody","Perfumers, Perfumers","Raspberry, Saffron, Thyme","Olibanum, Jasmine","Leather, Suede, Woody Notes, Amber",5600,2900,514,947,186,1400,548,3700,3800,2000,3600,niche,0.5335567162708189,0.8376860155711048,winter,9,,2,2,0.0,0.0,0.0,0.0,0.0,0.0,0.0,0.0,0.0,0.0,0.0,0.0,0.0,0.0,0.0,0.0,0.0,0.0,0.0,0.0,0.18511474578420187,0.29534417076220665
2026-04-14,Verde Accento,Xerjoff,designer,USA,USD,160.13,137.05,100.0,1.3705,4.0,,in_stock,https://www.amazon.com/s?k=Xerjoff+Verde+Accento,https://www.fragrantica.com/perfume/Xerjoff/Verde-Accento-105329.html,,4.2,20,unisex,,"woody, citrus, powdery, white floral, patchouli, musky, warm spicy, iris, earthy, soft spicy","Perfumers, Perfumers","Italian Mandarin, Bergamot","Jasmine, Iris, Pink Pepper","Patchouli, Sandalwood, Musk, Amber, Bourbon Vanilla",11,5,2,1,1,5,7,4,1,7,2,niche,0.5,0.8,summer,10,,2,2,1.0,0.0,0.0,0.0,0.0,0.0,0.0,0.0,0.0,0.0,0.0,0.0,0.0,0.0,0.0,0.0,0.0,0.0,0.0,0.0,0.20584506149359708,0.0
2026-04-14,1888,Xerjoff,designer,USA,USD,290.0,248.2,100.0,2.482,4.5,,in_stock,https://www.amazon.com/s?k=Xerjoff+1888,https://www.fragrantica.com/perfume/Xerjoff/1888-21616.html,,4.18,2330,unisex,Oriental Floral,"warm spicy, woody, amber, floral, aromatic, yellow floral, fresh spicy, leather, powdery, rose","Perfumers, Perfumers","Carnation, Pepper, Coriander, Saffron","Ylang-Ylang, Rose, Neroli","Amber, Sandalwood, Patchouli, Birch",1100,759,212,200,32,456,178,958,945,630,809,niche,0.4637429439861051,0.8072079895788102,fall,11,,2,2,0.0,0.0,0.0,0.0,0.0,0.0,0.0,0.0,0.0,0.0,0.0,1.0,0.0,0.0,0.0,0.0,0.0,0.0,0.0,0.0,0.3820051984277926,0.06717654927734318
2026-04-14,Pour Femme Dylan Blue,Versace,designer,USA,USD,127.14,108.82,100.0,1.0882,5.0,,in_stock,https://www.amazon.com/s?k=Versace+Pour+Femme+Dylan+Blue,https://www.fragrantica.com/perfume/Versace/Versace-Pour-Femme-Dylan-Blue-47459.html,,3.78,5986,female,Floral Fruity,"fruity, floral, green, rose, fresh, woody, sweet, musky","Perfumers, Perfumers, Calice Becker, Natalie Gracia-Cetto","Granny Smith apple, Black Currant, Clover, Forget me not, Shiso","Peach, Petalia, Rose, Rose Hip, Jasmine","Musk, White Woods, Patchouli, Styrax",1600,2600,831,887,107,2100,2000,957,647,2200,855,designer,0.24780082987551869,0.6970954356846473,spring,14,,0,1,0.0,0.0,0.0,0.0,0.0,0.0,0.0,0.0,0.0,1.0,0.0,0.0,0.0,0.0,0.0,0.0,0.0,0.0,0.0,0.0,0.16110371497400788,0.17349579783057548
2026-04-14,Bright Crystal,Versace,designer,USA,USD,50.65,43.35,100.0,0.4335,4.4,,in_stock,https://www.amazon.com/s?k=Versace+Bright+Crystal,https://www.fragrantica.com/perfume/Versace/Bright-Crystal-632.html,,3.74,23674,female,Floral Fruity,"floral, citrus, fresh, woody, rose, fresh spicy, aquatic","Perfumers, Perfumers, Alberto Morillas","Yuzu, Pomegranate, Ice","Peony, Lotus, Magnolia","Musk, Mahogany, Amber",5800,11000,2200,4300,343,8600,7700,1700,1400,9500,1500,designer,0.2308082730617942,0.7105697246542317,spring,9,,0,1,0.0,0.0,0.0,0.0,0.0,0.0,0.0,0.0,0.0,1.0,0.0,0.0,0.0,0.0,0.0,0.0,0.0,0.0,0.0,0.0,0.05734119437048307,0.687876232297089
2026-04-14,1 Million,Paco Rabanne,designer,USA,USD,85.99,73.6,100.0,0.736,4.7,,in_stock,https://www.amazon.com/s?k=Paco+Rabanne+1+Million,https://www.fragrantica.com/perfume/Paco-Rabanne/1-Million-3747.html,,3.74,23413,male,Woody Spicy,"warm spicy, cinnamon, citrus, amber, woody, leather, rose, animalic, green, patchouli","Perfumers, Perfumers, Christophe Raynaud, Michel Girard, Olivier Pescheux","Blood Mandarin, Grapefruit, Mint","Cinnamon, Spicy Notes, Rose","Amber, Leather, Woody Notes, Indian Patchouli",7400,8600,2000,4600,751,3600,2100,8500,10000,4100,10200,designer,0.2847415528242902,0.6851954948396214,winter,10,,1,1,0.0,0.0,0.0,0.0,0.0,0.0,0.0,0.0,0.0,0.0,0.0,0.0,0.0,0.0,0.0,0.0,0.0,0.0,0.0,1.0,0.1052840116647648,0.6802861546514671
2026-04-14,Invictus,Rabanne,designer,USA,USD,157.0,134.37,100.0,1.3437,4.6,,in_stock,https://www.amazon.com/s?k=Rabanne+Invictus,https://www.fragrantica.com/perfume/Rabanne/Invictus-18471.html,,3.8,14484,male,Woody Aquatic,"citrus, marine, aromatic, fresh spicy, woody, salty, amber, white floral, aquatic, animalic","Perfumers, Perfumers, Anne Flipo, Dominique Ropion, Olivier Polge, Véronique Nyberg","Sea Notes, Grapefruit, Mandarin Orange","Bay Leaf, Jasmine","Ambergris, Guaiac Wood, Oakmoss, Patchouli",4400,5900,1500,2300,407,6300,7000,3000,1600,6800,3000,designer,0.27524643275660027,0.7100020679671882,summer,9,,1,1,0.0,0.0,0.0,0.0,0.0,0.0,0.0,0.0,0.0,0.0,0.0,0.0,0.0,0.0,0.0,0.0,1.0,0.0,0.0,0.0,0.201597565614302,0.4206240730508622
2026-04-14,Acqua di Gio,Giorgio Armani,designer,USA,USD,120.0,102.7,100.0,1.027,1.0,,in_stock,https://www.amazon.com/s?k=Giorgio+Armani+Acqua+di+Gio,https://www.fragrantica.com/perfume/Giorgio-Armani/Acqua-di-Gio-410.html,,4.13,24147,unisex,Aromatic Aquatic,"citrus, aromatic, marine, fresh spicy, floral, woody, fresh","Perfumers, Perfumers, Alberto Morillas, Annick Menardo, Christian Dussoulier","Lime, Lemon, Bergamot, Jasmine, Orange, Mandarin Orange, Neroli","Sea Notes, Jasmine, Calone, Rosemary, Peach, Freesia, Hiacynth, Cyclamen, Violet, Coriander, Rose, Nutmeg, Mignonette","White Musk, Cedar, Oakmoss, Patchouli, Amber",9600,10400,1800,2000,256,9100,13100,2500,1300,12200,2700,designer,0.38842700365813104,0.8313934153641503,summer,24,,2,1,0.0,0.0,1.0,0.0,0.0,0.0,0.0,0.0,0.0,0.0,0.0,0.0,0.0,0.0,0.0,0.0,0.0,0.0,0.0,0.0,0.15140420945860275,0.7016314304824498
2026-04-14,My Way,Giorgio Armani,designer,USA,USD,,,100.0,,4.5,,unavailable,https://www.amazon.com/s?k=Giorgio+Armani+My+Way,https://www.fragrantica.com/perfume/Giorgio-Armani/My-Way-62036.html,,3.78,12964,female,Floral,"white floral, tuberose, citrus, animalic, vanilla","Perfumers, Perfumers, Bruno Jovanovic, Carlos Benaïm","Orange Blossom, Bergamot","Tuberose, Indian Jasmine","Madagascar Vanilla, White Musk, Virginian Cedar",4300,4300,2000,1700,596,5100,3600,2600,1800,5000,2000,designer,0.2872208436724566,0.6668734491315137,spring,7,,0,1,0.0,0.0,0.0,0.0,0.0,0.0,0.0,1.0,0.0,0.0,0.0,0.0,0.0,0.0,0.0,0.0,0.0,0.0,0.0,0.0,0.16295166769996278,0.37642132201122513
2026-04-14,La Nuit de l'Homme,Yves Saint Laurent,designer,USA,USD,73.58,62.97,100.0,0.6297,4.7,,in_stock,https://www.amazon.com/s?k=Yves+Saint+Laurent+La+Nuit+de+L+Homme,https://www.fragrantica.com/perfume/Yves-Saint-Laurent/La-Nuit-de-L-Homme-5521.html,,4.45,23860,male,Woody Spicy,"aromatic, warm spicy, lavender, woody, fresh spicy, citrus","Perfumers, Perfumers, Anne Flipo, Dominique Ropion, Pierre Wargnye",Cardamom,"Lavender, Virginia Cedar, Bergamot","Vetiver, Caraway",14500,7000,1100,1100,154,6700,3000,11000,10800,4700,12000,designer,0.6014085687934938,0.9013163410748721,fall,6,,1,1,0.0,0.0,0.0,0.0,0.0,0.0,0.0,0.0,0.0,0.0,0.0,0.0,0.0,0.0,0.0,0.0,0.0,0.0,0.0,1.0,0.08843666793457589,0.6932852531479919
2026-04-14,Black Opium,Yves Saint Laurent,designer,USA,USD,122.5,104.84,100.0,1.0484,4.7,,in_stock,https://www.amazon.com/s?k=Yves+Saint+Laurent+Black+Opium,https://www.fragrantica.com/perfume/Yves-Saint-Laurent/Black-Opium-25324.html,,3.94,33428,female,Oriental Vanilla,"vanilla, coffee, sweet, white floral, warm spicy, soft spicy, woody, fruity, balsamic, powdery","Perfumers, Perfumers, Honorine Blanc, Marie Salamagne, Nathalie Lorson, Olivier Cresp","Pear, Pink Pepper, Orange Blossom","Coffee, Jasmine, Bitter Almond, Licorice","Vanilla, Patchouli, Cashmere Wood, Cedar",13000,11800,3200,4400,956,3200,2100,11600,13400,5200,13700,designer,0.36107446936083465,0.7434944237918215,winter,11,,0,1,0.0,0.0,0.0,0.0,0.0,0.0,0.0,0.0,0.0,0.0,0.0,0.0,0.0,0.0,1.0,0.0,0.0,0.0,0.0,0.0,0.1547958666159503,0.9715299386396021
2026-04-14,Good Girl,Carolina Herrera,designer,USA,USD,110.95,94.96,100.0,0.9496,4.7,,in_stock,https://www.amazon.com/s?k=Carolina+Herrera+Good+Girl,https://www.fragrantica.com/perfume/Carolina-Herrera/Good-Girl-39681.html,,3.95,24221,female,Oriental Floral,"sweet, white floral, warm spicy, vanilla, amber, cacao, woody, tuberose, almond, powdery","Perfumers, Perfumers, Louise Turner, Quentin Bisch","Almond, Coffee, Bergamot, Lemon","Tuberose, Jasmine Sambac, Orange Blossom, Bulgarian Rose, Orris","Tonka Bean, Cacao, Vanilla, Praline, Sandalwood, Musk, Amber, Cashmere Wood, Patchouli, Cinnamon, Cedar",9800,8000,2600,3200,688,3600,2100,8300,9000,4000,10100,designer,0.37516469038208167,0.7328722002635046,winter,20,,0,1,0.0,0.0,0.0,0.0,0.0,0.0,0.0,0.0,0.0,0.0,0.0,1.0,0.0,0.0,0.0,0.0,0.0,0.0,0.0,0.0,0.13913718777735515,0.7037834065199058
2026-04-14,Vintage Radio,Lattafa,arabic,USA,USD,30.5,26.1,100.0,0.261,4.6,,in_stock,https://www.amazon.com/s?k=Lattafa+Vintage+Radio,https://www.fragrantica.com/perfume/Lattafa-Perfumes/Vintage-Radio-89454.html,,4.31,3589,unisex,Oriental Woody,"woody, fruity, aromatic, fresh spicy, citrus, lavender, sweet, herbal, warm spicy, powdery","Perfumers, Perfumers","Lavender, Sage, Bergamot","Plum, Palo Santo, Black Pepper","Sandalwood, Oud",2000,971,330,201,65,2000,836,2200,2000,1800,1900,arabic,0.5424726661059714,0.8329128118867396,fall,8,,2,0,0.0,0.0,0.0,0.0,0.0,0.0,0.0,0.0,0.0,0.0,0.0,0.0,0.0,0.0,0.0,1.0,0.0,0.0,0.0,0.0,0.030001901863826553,0.10378922267135836
2026-04-14,Hawas for Him,Rasasi,arabic,USA,USD,32.0,27.39,100.0,0.2739,4.2,,in_stock,https://www.amazon.com/s?k=Rasasi+Hawas+for+Him,https://www.fragrantica.com/perfume/Rasasi/Hawas-for-Him-46890.html,,4.32,10058,male,Aromatic Aquatic,"fruity, citrus, aquatic, fresh, warm spicy, amber, sweet, musky, aromatic, animalic","Perfumers, Perfumers","Apple, Bergamot, Lemon, Cinnamon","Watery Notes, Plum, Orange Blossom, Cardamon","Ambergris, Musk, Patchouli, Driftwood",5400,3100,919,408,172,6400,7500,2800,1400,6700,3100,arabic,0.5228522852285229,0.8500850085008501,summer,12,,1,0,0.0,0.0,1.0,0.0,0.0,0.0,0.0,0.0,0.0,0.0,0.0,0.0,0.0,0.0,0.0,0.0,0.0,0.0,0.0,0.0,0.03204640547736781,0.29191264140518214
2026-04-14,La Yuqawam Homme,Rasasi,arabic,USA,USD,32.99,28.24,75.0,0.3765,4.3,,in_stock,https://www.amazon.com/s?k=Rasasi+La+Yuqawam+Homme,https://www.fragrantica.com/perfume/Rasasi/La-Yuqawam-Homme-19668.html,,4.4,3860,male,Oriental,"leather, fruity, sweet, animalic, amber, woody, musky, warm spicy, smoky","Perfumers, Perfumers","Raspberry, Saffron, Thyme","Olibanum, Jasmine, Artemisia","Leather, Suede, Woody Notes, Amber",2400,971,200,223,66,780,261,2100,2200,1100,2000,arabic,0.6046632124352331,0.8733160621761658,winter,10,,1,0,0.0,0.0,0.0,0.0,0.0,0.0,0.0,0.0,0.0,0.0,1.0,0.0,0.0,0.0,0.0,0.0,0.0,0.0,0.0,0.0,0.04830734119437048,0.11167010788960945
2026-04-14,Qasamat Mohraf,Rasasi,arabic,USA,USD,26.0,22.25,100.0,0.2225,4.4,,in_stock,https://www.amazon.com/s?k=Rasasi+Qasamat+Mohraf,https://www.fragrantica.com/perfume/Rasasi/Qasamat-Mohraf-Oud-Moattar-62547.html,,4.14,84,unisex,"fragrance for women and men. Qasamat Mohraf Oud Moattar was launched in 2020. Top notes are Raspberry, Lemon and Bergamot; middle notes are Rose, Geranium, Jasmine, White Flowers and Lily-of-the-Valley; base notes are Agarwood (Oud), Patchouli, Guaiac Wood, Amber, Vanilla, Sandalwood and Musk. ""Qasamat, is a series of four unisex","rose, woody, oud, white floral, powdery, fresh spicy, patchouli, warm spicy, fruity, sweet","Perfumers, Perfumers","Raspberry, Lemon, Bergamot","Rose, Geranium, Jasmine, White Flowers, Lily-of-the-Valley","Agarwood (Oud), Patchouli, Guaiac Wood, Amber, Vanilla, Sandalwood, Musk",47,17,8,9,3,33,12,39,37,30,39,arabic,0.5238095238095238,0.7619047619047619,fall,15,,2,0,0.0,0.0,0.0,0.0,0.0,0.0,0.0,0.0,0.0,0.0,0.0,0.0,0.0,0.0,0.0,0.0,0.0,0.0,0.0,0.0,0.02390008875364524,0.0018611684648268238
2026-04-14,Hawas Ice,Rasasi,arabic,USA,USD,32.0,27.39,100.0,0.2739,4.2,,in_stock,https://www.amazon.com/s?k=Rasasi+Hawas+Ice,https://www.fragrantica.com/perfume/Rasasi/Hawas-Ice-89050.html,,4.43,5739,male,Aromatic,"fruity, citrus, sweet, fresh, aromatic, musky, powdery, fresh spicy, green, white floral","Perfumers, Perfumers","Apple, Italian Lemon, Sicilian Bergamot, Star Anise","Plum, Orange Blossom, Cardamon","Musk, Amber, Driftwood, Moss",3500,1500,401,168,105,3800,4300,2100,1000,3900,1800,arabic,0.5983433204088826,0.8812125484666902,summer,11,,1,0,0.0,1.0,0.0,0.0,0.0,0.0,0.0,0.0,0.0,0.0,0.0,0.0,0.0,0.0,0.0,0.0,0.0,0.0,0.0,0.0,0.03204640547736781,0.16631285078663446
2026-04-14,Egra Men,Rasasi,arabic,USA,USD,29.4,25.16,100.0,0.2516,4.2,,in_stock,https://www.amazon.com/s?k=Rasasi+Egra+Men,https://www.fragrantica.com/perfume/Rasasi/Egra-Men-19678.html,,4.01,610,male,Woody Aromatic,"woody, aromatic, fresh spicy, green, ozonic, powdery, amber, aquatic, iris, citrus","Perfumers, Perfumers","Violet Leaf, Juniper Berries, Spruce, Grapefruit","Fir, Iris, Galbanum","Ambergris, Oakmoss, Sandalwood, Musk",215,267,64,50,14,354,345,203,72,343,122,arabic,0.3295081967213115,0.7901639344262295,spring,11,,1,0,0.0,0.0,0.0,0.0,0.0,0.0,0.0,0.0,0.0,0.0,0.0,0.0,0.0,0.0,0.0,0.0,0.0,1.0,0.0,0.0,0.028512108533029035,0.017157646785122285
2026-04-14,Hawas Black,Rasasi,arabic,USA,USD,32.0,27.39,100.0,0.2739,4.2,,in_stock,https://www.amazon.com/s?k=Rasasi+Hawas+Black,https://www.fragrantica.com/perfume/Rasasi/Hawas-Black-96817.html,,4.26,2645,male,Aromatic Fruity,"woody, citrus, mossy, earthy, fresh spicy, fruity, patchouli, sweet, aromatic","Perfumers, Perfumers","Bergamot, Grapefruit, Pineapple","Patchouli, Cedarwood, Jasmine","Oakmoss, Woody Notes, Amber",1500,629,253,144,100,1600,1500,1600,1400,1600,1500,arabic,0.5331302361005331,0.8107387661843107,spring,9,,1,0,0.0,0.0,0.0,0.0,1.0,0.0,0.0,0.0,0.0,0.0,0.0,0.0,0.0,0.0,0.0,0.0,0.0,0.0,0.0,0.0,0.03204640547736781,0.07633698781516271
