scrape_date,name,brand,category,country,currency,price,price_eur,bottle_size_ml,price_per_ml,amazon_rating,amazon_reviews,availability,amazon_url,fragrantica_url,year,rating,votes,gender,fragrance_family,main_accords,perfumers,top_notes,middle_notes,base_notes,votes_love,votes_like,votes_ok,votes_dislike,votes_hate,season_spring,season_summer,season_fall,season_winter,wear_day,wear_night,brand_origin,sentiment_polarisation,crowd_pleaser_index,season_dominant,note_count,years_on_market,gender_id,brand_origin_id,fam_,fam_aromatic,fam_aromatic_aquatic,fam_aromatic_fougere,fam_aromatic_fruity,fam_aromatic_spicy,fam_chypre_fruity,fam_floral,fam_floral_aldehyde,fam_floral_fruity,fam_oriental,fam_oriental_floral,fam_oriental_fougere,fam_oriental_spicy,fam_oriental_vanilla,fam_oriental_woody,fam_woody_aquatic,fam_woody_aromatic,fam_woody_floral_musk,fam_woody_spicy,price_per_ml_scaled,votes_scaled
2026-04-15,Vulcan Feu,French Avenue,arabic,UAE,AED,164.85,38.1,100.0,0.381,4.5,,in_stock,https://www.amazon.ae/s?k=French+Avenue+Vulcan+Feu+100ml,https://www.fragrantica.com/perfume/French-Avenue/Vulcan-Feu-105520.html,,4.45,4306,unisex,Floral,"tropical, fruity, sweet, citrus, woody, fresh, fresh spicy, aromatic, terpenic, amber","Perfumers, Perfumers","Mango, Lemon, Ginger, Rhubarb","Pink Pepper, Jasmine, Violet, Praline","Tonka Bean, Cedarwood, Ambergris, Moss",2800,900,309,165,88,2600,3200,856,363,2800,1000,arabic,0.6363209760675739,0.8681370248709526,summer,12,,2,0,0.0,0.0,0.0,0.0,0.0,0.0,0.0,1.0,0.0,0.0,0.0,0.0,0.0,0.0,0.0,0.0,0.0,0.0,0.0,0.0,0.04911096320243415,0.1245314815352878
2026-04-15,Veneno,French Avenue,arabic,UAE,AED,180.0,41.61,100.0,0.4161,4.2,,in_stock,https://www.amazon.ae/s?k=French+Avenue+Veneno+100ml,https://www.fragrantica.com/perfume/French-Avenue/Veneno-105519.html,,4.19,461,unisex,Aromatic Fruity,"smoky, fruity, cinnamon, tobacco, warm spicy, vanilla, sweet, fresh, green, mossy","Perfumers, Perfumers, Jean-Louis Sieuzac","Apple, Smoke, Cinnamon","Tobacco, Moss","Bourbon Vanilla, Orcanox™",242,131,39,32,17,97,33,264,293,86,261,arabic,0.4880694143167028,0.8091106290672451,winter,7,,2,0,0.0,0.0,0.0,0.0,1.0,0.0,0.0,0.0,0.0,0.0,0.0,0.0,0.0,0.0,0.0,0.0,0.0,0.0,0.0,0.0,0.05467338594656271,0.012813435220966384
2026-04-15,Tres Nuit,Armaf,arabic,UAE,AED,75.0,17.34,100.0,0.1734,4.0,,in_stock,https://www.amazon.ae/s?k=Armaf+Tres+Nuit+100ml,https://www.fragrantica.com/perfume/Armaf/Tres-Nuit-27711.html,,4.13,3328,male,Aromatic Spicy,"powdery, violet, lavender, woody, iris, citrus, amber, aromatic, floral, animalic","Perfumers, Perfumers","Iris, Lemon, Vervain","Lavender, Violet, Spicy Notes","Ambergris, Sandalwood",1400,1300,323,267,47,1900,1800,1000,296,1900,699,arabic,0.4054540005993407,0.8091099790230746,spring,8,,1,0,0.0,0.0,0.0,0.0,0.0,1.0,0.0,0.0,0.0,0.0,0.0,0.0,0.0,0.0,0.0,0.0,0.0,0.0,0.0,0.0,0.016211847485024244,0.09611529186158004
2026-04-15,L'Aventure,Al Haramain,arabic,UAE,AED,250.0,57.79,100.0,0.5779,4.3,,in_stock,https://www.amazon.ae/s?k=Al+Haramain+L+Aventure+100ml,https://www.fragrantica.com/perfume/Al-Haramain-Perfumes/L-Aventure-40405.html,,4.17,2697,male,Chypre Fruity,"citrus, aromatic, woody, musky, fresh spicy, white floral, powdery","Perfumers, Perfumers","Lemon, Bergamot, elemi","Woody Notes, Jasmine, Lily-of-the-Valley","Musk, Patchouli, Amber",1300,943,243,198,54,1500,1500,1200,550,1500,928,arabic,0.4550766983199416,0.8192111029948868,spring,9,,1,0,0.0,0.0,0.0,0.0,0.0,0.0,1.0,0.0,0.0,0.0,0.0,0.0,0.0,0.0,0.0,0.0,0.0,0.0,0.0,0.0,0.08031441158758834,0.07778132899439232
2026-04-15,L'Aventure Knight,Al Haramain,arabic,UAE,AED,250.0,57.79,100.0,0.5779,4.3,,in_stock,https://www.amazon.ae/s?k=Al+Haramain+L+Aventure+Knight+100ml,https://www.fragrantica.com/perfume/Al-Haramain-Perfumes/L-Aventure-Knight-51824.html,,3.99,868,male,Oriental Fougere,"powdery, citrus, ozonic, iris, woody, amber, green, musky, aquatic, animalic","Perfumers, Perfumers","Lemon Verbena, Bergamot, Tea","Violet Leaf, Iris","Powdery Notes, Ambergris, Musk, Sandalwood",353,300,102,82,31,530,477,345,133,511,271,arabic,0.3709677419354839,0.7523041474654378,spring,9,,1,0,0.0,0.0,0.0,0.0,0.0,0.0,0.0,0.0,0.0,0.0,0.0,0.0,1.0,0.0,0.0,0.0,0.0,0.0,0.0,0.0,0.08031441158758834,0.02463898654734579
2026-04-15,Supremacy Silver,Afnan,arabic,UAE,AED,111.0,25.66,100.0,0.2566,3.9,,in_stock,https://www.amazon.ae/s?k=Afnan+Supremacy+Silver+100ml,https://www.fragrantica.com/perfume/Afnan/Supremacy-Silver-27352.html,,4.06,2257,male,Woody Floral Musk,"fruity, leather, woody, sweet, smoky, citrus, musky, mossy, tropical, fresh","Perfumers, Perfumers, Imran Fazlani","Pineapple, Black Currant, Bergamot, Apple","Birch, Patchouli, Moroccan Jasmine, Rose","Musk, Oakmoss, Ambergris, Vanilla",956,797,247,198,59,1200,1100,962,464,1200,752,arabic,0.39743021710234827,0.7766947275143996,spring,12,,1,0,0.0,0.0,0.0,0.0,0.0,0.0,0.0,0.0,0.0,0.0,0.0,0.0,0.0,0.0,0.0,0.0,0.0,0.0,1.0,0.0,0.029396849545180813,0.06499694918209026
2026-04-15,Supremacy Gold,Afnan,arabic,UAE,AED,97.0,22.42,100.0,0.2242,5.0,,in_stock,https://www.amazon.ae/s?k=Afnan+Supremacy+Gold+100ml,https://www.fragrantica.com/perfume/Afnan/Supremacy-Gold-27351.html,,3.83,248,unisex,Oriental,"amber, powdery, fresh spicy, floral, violet, vanilla, iris, oud, warm spicy, woody","Perfumers, Perfumers","Nutmeg, Violet, Peach Blossom, Cumin","Iris, Patchouli","Amber, Vanilla, Agarwood (Oud), Benzoin",87,80,40,33,8,96,49,121,105,82,98,arabic,0.3185483870967742,0.6733870967741935,fall,10,,2,0,0.0,0.0,0.0,0.0,0.0,0.0,0.0,0.0,0.0,0.0,1.0,0.0,0.0,0.0,0.0,0.0,0.0,0.0,0.0,0.0,0.02426230547367754,0.006624633175465613
2026-04-15,Saffron Oud,Arabian Oud,arabic,UAE,AED,102.0,23.58,100.0,0.2358,3.7,,in_stock,https://www.amazon.ae/s?k=Arabian+Oud+Saffron+Oud+100ml,https://www.fragrantica.com/perfume/Arabian-Oud/Saffron-Oud-91547.html,,4.7,79,unisex,,,"Perfumers, Perfumers",,,,59,17,2,1,0,30,16,40,49,28,46,arabic,0.7468354430379747,0.9620253164556962,winter,0,,2,0,1.0,0.0,0.0,0.0,0.0,0.0,0.0,0.0,0.0,0.0,0.0,0.0,0.0,0.0,0.0,0.0,0.0,0.0,0.0,0.0,0.026100599030141676,0.0017142691111950493
2026-04-16,Sauvage,Dior,designer,USA,USD,229.01,194.41,100.0,1.9441,4.6,,in_stock,https://www.amazon.com/s?k=Dior+Sauvage,https://www.fragrantica.com/perfume/Dior/Sauvage-31861.html,,3.86,31926,male,Aromatic Fougere,"fresh spicy, amber, citrus, aromatic, musky, woody, lavender, herbal, warm spicy","Perfumers, Perfumers, François Demachy","Calabrian bergamot, Pepper","Sichuan Pepper, Lavender, Pink Pepper, Vetiver, Patchouli, Geranium, elemi","Ambroxan, Cedar, Labdanum",12400,10300,3200,4400,1700,14200,13200,13200,9600,14100,12800,designer,0.334375,0.709375,spring,12,,1,1,0.0,0.0,0.0,1.0,0.0,0.0,0.0,0.0,0.0,0.0,0.0,0.0,0.0,0.0,0.0,0.0,0.0,0.0,0.0,0.0,0.29682101993597665,0.9270418688438853
2026-04-16,Sauvage Elixir,Dior,designer,USA,USD,175.99,149.4,100.0,1.494,4.6,,in_stock,https://www.amazon.com/s?k=Dior+Sauvage+Elixir,https://www.fragrantica.com/perfume/Dior/Sauvage-Elixir-68415.html,,4.31,17787,male,Aromatic,"warm spicy, fresh spicy, woody, aromatic, lavender, soft spicy, cinnamon, amber, powdery, balsamic","Perfumers, Perfumers, François Demachy","Nutmeg, Cinnamon, Cardamom, Grapefruit",Lavender,"Licorice, Sandalwood, Amber, Patchouli, Haitian Vetiver",11300,3400,1300,1000,809,5900,2400,10200,11600,5400,10500,designer,0.5890841709248132,0.8254253467347971,winter,10,,1,1,0.0,1.0,0.0,0.0,0.0,0.0,0.0,0.0,0.0,0.0,0.0,0.0,0.0,0.0,0.0,0.0,0.0,0.0,0.0,0.0,0.22549206047351905,0.5162274457390242
2026-04-16,Sauvage EDP,Dior,designer,USA,USD,133.99,113.74,100.0,1.1374,4.5,,in_stock,https://www.amazon.com/s?k=Dior+Sauvage+Parfum,https://www.fragrantica.com/perfume/Dior/Sauvage-Eau-de-Parfum-48100.html,,4.21,13745,male,Oriental Fougere,"fresh spicy, citrus, amber, lavender, musky, aromatic, herbal, anis, soft spicy, floral","Perfumers, Perfumers, François Demachy",Bergamot,"Sichuan Pepper, Lavender, Star Anise, Nutmeg","Ambroxan, Vanilla",7200,4100,1100,994,372,7300,6000,7400,6800,6900,7300,designer,0.49600464913555137,0.820862995786721,fall,7,,1,1,0.0,0.0,0.0,0.0,0.0,0.0,0.0,0.0,0.0,0.0,0.0,0.0,1.0,0.0,0.0,0.0,0.0,0.0,0.0,0.0,0.1689803809704922,0.3987854839178313
2026-04-16,Fahrenheit,Dior,designer,USA,USD,100.0,84.89,100.0,0.8489,4.6,,in_stock,https://www.amazon.com/s?k=Dior+Fahrenheit,https://www.fragrantica.com/perfume/Dior/Fahrenheit-228.html,,4.0,22015,male,Aromatic Fougere,"leather, woody, ozonic, fresh spicy, aromatic, animalic, aquatic, floral, citrus, green","Perfumers, Perfumers, Jean-Louis Sieuzac, Maurice Roger, Michel Almairac","Nutmeg Flower, Lavender, Cedar, Mandarin Orange, Chamomile, Bergamot, Hawthorn, Lemon","Violet Leaf, Nutmeg, Cedar, Sandalwood, Carnation, Honeysuckle, Jasmine, Lily-of-the-Valley","Leather, Vetiver, Musk, Amber, Patchouli, Tonka Bean",10600,6100,986,3300,977,4400,2200,7900,8000,5500,7900,designer,0.4381459727723899,0.7603697126986295,winter,21,,1,1,0.0,0.0,0.0,1.0,0.0,0.0,0.0,0.0,0.0,0.0,0.0,0.0,0.0,0.0,0.0,0.0,0.0,0.0,0.0,0.0,0.12326075243256948,0.6390737135717813
2026-04-16,Dior Homme Intense 2025,Dior,designer,USA,USD,177.43,150.62,100.0,1.5062,4.1,,in_stock,https://www.amazon.com/s?k=Dior+Homme+Intense,https://www.fragrantica.com/perfume/Dior/Dior-Homme-Intense-2025-101596.html,,4.1,1809,male,Oriental Woody,"iris, woody, powdery, musky, violet, floral, earthy","Perfumers, Perfumers",Tuscan Iris,Ambrette,Virginia Cedar,1100,330,136,86,192,423,132,862,958,435,849,designer,0.4924078091106291,0.7754880694143167,winter,3,,1,1,0.0,0.0,0.0,0.0,0.0,0.0,0.0,0.0,0.0,0.0,0.0,0.0,0.0,0.0,0.0,1.0,0.0,0.0,0.0,0.0,0.22742543817945546,0.0519801261004736
2026-04-16,Miss Dior EDP 2021,Dior,designer,USA,USD,156.95,133.23,100.0,1.3323,4.6,,in_stock,https://www.amazon.com/s?k=Dior+Miss+Dior+Eau+de+Parfum,https://www.fragrantica.com/perfume/Dior/Miss-Dior-Eau-de-Parfum-2021--68905.html,,3.89,6642,female,Oriental Floral,"powdery, vanilla, rose, floral, fruity, sweet, fresh, iris, musky, amber","Perfumers, Perfumers, François Demachy","Iris, Peony, Lily-of-the-Valley","Rose, Apricot, Peach","Vanilla, Musk, Tonka Bean, Sandalwood, Benzoin",2400,2200,1100,711,195,2700,1600,1600,1200,2600,1000,designer,0.3337874659400545,0.696336663639116,spring,11,,0,1,0.0,0.0,0.0,0.0,0.0,0.0,0.0,0.0,0.0,0.0,0.0,1.0,0.0,0.0,0.0,0.0,0.0,0.0,0.0,0.0,0.19986688219073878,0.192404916175146
2026-04-16,J'adore,Dior,designer,USA,USD,151.99,129.02,100.0,1.2902,4.6,,in_stock,https://www.amazon.com/s?k=Dior+Jadore,https://www.fragrantica.com/perfume/Dior/J-adore-210.html,,3.8,28786,female,Floral Fruity,"white floral, floral, fruity, sweet, fresh, citrus, aquatic, powdery, ozonic, tuberose","Perfumers, Perfumers, Calice Becker","Pear, Melon, Magnolia, Peach, Mandarin Orange, Bergamot","Jasmine, Lily-of-the-Valley, Tuberose, Freesia, Rose, Orchid, Violet, Plum","Musk, Vanilla, Cedar, Blackberry",9000,11600,2000,5700,489,8100,4900,5800,4200,8700,5500,designer,0.2956337490013547,0.7155510785369412,spring,18,,0,1,0.0,0.0,0.0,0.0,0.0,0.0,0.0,0.0,0.0,1.0,0.0,0.0,0.0,0.0,0.0,0.0,0.0,0.0,0.0,0.0,0.1931951443694336,0.8358078856379114
2026-04-16,Gris Dior,Dior,designer,USA,USD,116.42,98.83,100.0,0.9883,4.5,,in_stock,https://www.amazon.com/s?k=Dior+Gris+Dior,https://www.fragrantica.com/perfume/Dior/Gris-Dior-48387.html,,4.21,3552,unisex,Floral,"woody, earthy, mossy, rose, patchouli, citrus, warm spicy, amber, powdery, floral","Perfumers, Perfumers, François Demachy","Oakmoss, Rose, Patchouli, Bergamot, Cedar, Amber, Sandalwood",,,1800,1100,381,201,95,1400,962,1400,1000,1400,1000,designer,0.47665641599105396,0.8107352530053117,spring,7,,2,1,0.0,0.0,0.0,0.0,0.0,0.0,0.0,1.0,0.0,0.0,0.0,0.0,0.0,0.0,0.0,0.0,0.0,0.0,0.0,0.0,0.14535196982662987,0.10262370340238836
2026-04-16,Silver Mountain Water,Creed,designer,USA,USD,490.0,415.96,100.0,4.1596,4.2,,in_stock,https://www.amazon.com/s?k=Creed+Silver+Mountain+Water,https://www.fragrantica.com/perfume/Creed/Silver-Mountain-Water-472.html,,4.16,10445,unisex,Aromatic,"citrus, green, fruity, musky, woody, aromatic, powdery, fresh spicy, fresh, floral","Perfumers, Perfumers, Olivier Creed, Pierre Bourdon","Bergamot, Mandarin Orange","Green Tea, Black Currant","Musk, Sandalwood, Petitgrain, Galbanum",5000,3400,986,920,158,4600,4600,1600,991,4600,1200,niche,0.46272935779816515,0.8027522935779816,spring,8,,2,2,0.0,1.0,0.0,0.0,0.0,0.0,0.0,0.0,0.0,0.0,0.0,0.0,0.0,0.0,0.0,0.0,0.0,0.0,0.0,0.0,0.6479192418623815,0.3029026353255659
2026-04-16,Green Irish Tweed,Creed,designer,USA,USD,490.0,415.96,100.0,4.1596,4.2,,in_stock,https://www.amazon.com/s?k=Creed+Green+Irish+Tweed,https://www.fragrantica.com/perfume/Creed/Green-Irish-Tweed-474.html,,4.3,11652,male,Woody Floral Musk,"ozonic, aquatic, iris, powdery, woody, amber, animalic, violet, balsamic, green","Perfumers, Perfumers, Olivier Creed, Pierre Bourdon","Iris, Vervain",Violet Leaf,"Ambergris, Sandalwood",6700,3100,766,976,171,5800,4800,3500,1400,5500,2400,niche,0.5574148382139503,0.8366771962776403,spring,5,,1,2,0.0,0.0,0.0,0.0,0.0,0.0,0.0,0.0,0.0,0.0,0.0,0.0,0.0,0.0,0.0,0.0,0.0,0.0,1.0,0.0,0.6479192418623815,0.3379725135834036
2026-04-16,Millesime Imperial,Creed,designer,USA,USD,37.0,31.41,100.0,0.3141,5.0,,in_stock,https://www.amazon.com/s?k=Creed+Millesime+Imperial,https://www.fragrantica.com/perfume/Creed/Millesime-Imperial-466.html,,4.23,7082,unisex,Woody Floral Musk,"marine, citrus, salty, fruity, aromatic, powdery, musky, sweet, woody, iris","Perfumers, Perfumers, Olivier Creed, Pierre Bourdon","Sea Salt, Fruity Notes","Sicilian Lemon, Bergamot, Iris, Mandarin Orange","Sea Notes, Musk, Woody Notes",3600,2200,554,593,81,2700,3400,874,361,3200,944,niche,0.5007114399544679,0.8252703471826978,summer,9,,2,2,0.0,0.0,0.0,0.0,0.0,0.0,0.0,0.0,0.0,0.0,0.0,0.0,0.0,0.0,0.0,0.0,0.0,0.0,1.0,0.0,0.038509080536274595,0.20518929598744806
2026-04-16,Viking,Creed,designer,USA,USD,510.0,432.94,100.0,4.3294,4.2,,in_stock,https://www.amazon.com/s?k=Creed+Viking,https://www.fragrantica.com/perfume/Creed/Viking-41698.html,,3.96,4102,male,Woody Aromatic,"aromatic, fresh spicy, green, citrus, soft spicy, lavender, woody, rose, musky, warm spicy","Perfumers, Perfumers, Olivier Creed","Pink Pepper, Peppermint, Bergamot, Lemon, Absinthe, Orange","Lavender, Bulgarian Rose, Clove, Allspice, Orris Root, Jasmine","Vetiver, Cedar, White Musk, Tonka Bean",1800,1200,458,572,108,1700,1200,1700,1300,1800,1200,niche,0.4088931851135814,0.7249879168680522,spring,16,,1,2,0.0,0.0,0.0,0.0,0.0,0.0,0.0,0.0,0.0,0.0,0.0,0.0,0.0,0.0,0.0,0.0,0.0,1.0,0.0,0.0,0.6748280561630375,0.11860417816776593
2026-04-16,Royal Oud,Creed,designer,USA,USD,41.99,35.65,100.0,0.3565,3.8,,in_stock,https://www.amazon.com/s?k=Creed+Royal+Oud,https://www.fragrantica.com/perfume/Creed/Royal-Oud-12317.html,,4.36,5502,unisex,Oriental Fougere,"woody, musky, powdery, citrus, aromatic, soft spicy, oud, green, amber","Perfumers, Perfumers, Julien Rasquinet, Olivier Creed","Pink Pepper, Lemon, Sicilian Bergamot","Cedar, Angelica, Galbanum","Sandalwood, Agarwood (Oud), Musk",3300,1500,311,404,60,1700,696,2400,2200,1800,2100,niche,0.5811659192825112,0.8609865470852018,fall,9,,2,2,0.0,0.0,0.0,0.0,0.0,0.0,0.0,0.0,0.0,0.0,0.0,0.0,1.0,0.0,0.0,0.0,0.0,0.0,0.0,0.0,0.04522836043231593,0.15928175029781794
2026-04-16,Wind Flowers,Creed,designer,USA,USD,460.0,390.49,100.0,3.9049,4.1,,in_stock,https://www.amazon.com/s?k=Creed+Wind+Flowers,https://www.fragrantica.com/perfume/Creed/Wind-Flowers-70182.html,,3.61,1019,female,Floral,"white floral, sweet, powdery, musky, tuberose, rose, woody, iris, animalic, fruity","Perfumers, Perfumers, Olivier Creed","Jasmine, Orange Blossom, Peach","Jasmine Sambac, Tuberose, Rose","Musk, Orange Blossom, Praline, Iris, Sandalwood",318,278,201,154,68,351,271,174,100,333,133,niche,0.24533856722276742,0.5848871442590775,spring,10,,0,2,0.0,0.0,0.0,0.0,0.0,0.0,0.0,1.0,0.0,0.0,0.0,0.0,0.0,0.0,0.0,0.0,0.0,0.0,0.0,0.0,0.6075560204113973,0.02902635325565854
2026-04-16,Le Male,Jean Paul Gaultier,designer,USA,USD,124.95,106.07,100.0,1.0607,4.5,,in_stock,https://www.amazon.com/s?k=Jean+Paul+Gaultier+Le+Male,https://www.fragrantica.com/perfume/Jean-Paul-Gaultier/Le-Male-430.html,,4.0,24160,female,Oriental Fougere,"aromatic, vanilla, fresh spicy, lavender, warm spicy, green, powdery, sweet, amber, woody","Perfumers, Perfumers, Francis Kurkdjian","Lavender, Mint, Cardamom, Bergamot, Artemisia","Cinnamon, Orange Blossom, Caraway","Vanilla, Tonka Bean, Amber, Sandalwood, Cedar",9800,8800,1900,3200,458,8500,5600,9400,9600,9100,9500,designer,0.38670419736733175,0.7699312857024588,winter,13,,0,1,0.0,0.0,0.0,0.0,0.0,0.0,0.0,0.0,0.0,0.0,0.0,0.0,1.0,0.0,0.0,0.0,0.0,0.0,0.0,0.0,0.15682545719628535,0.7013975651567539
2026-04-16,Ultra Male,Jean Paul Gaultier,designer,USA,USD,91.8,77.93,100.0,0.7793,4.7,,in_stock,https://www.amazon.com/s?k=Jean+Paul+Gaultier+Ultra+Male,https://www.fragrantica.com/perfume/Jean-Paul-Gaultier/Ultra-Male-30947.html,,4.45,16733,male,Oriental Fougere,"vanilla, fruity, aromatic, sweet, cinnamon, warm spicy, fresh spicy, lavender, powdery, green","Perfumers, Perfumers, Francis Kurkdjian","Pear, Lavender, Mint, Bergamot, Lemon","Cinnamon, Clary Sage, Caraway","Black Vanilla Husk, Amber, Patchouli, Cedar",10700,4100,829,871,202,5600,2700,9200,10400,4000,10400,designer,0.6285474793437912,0.8861214225841216,winter,12,,1,1,0.0,0.0,0.0,0.0,0.0,0.0,0.0,0.0,0.0,0.0,0.0,0.0,1.0,0.0,0.0,0.0,0.0,0.0,0.0,0.0,0.11223099109378466,0.48560304500682805
2026-04-16,Le Male Le Parfum,Jean Paul Gaultier,designer,USA,USD,107.99,91.67,100.0,0.9167,4.6,,in_stock,https://www.amazon.com/s?k=Jean+Paul+Gaultier+Le+Male+Le+Parfum,https://www.fragrantica.com/perfume/Jean-Paul-Gaultier/Le-Male-Le-Parfum-61856.html,,4.6,25638,male,Oriental,"warm spicy, vanilla, lavender, aromatic, powdery, iris, woody, amber, violet","Perfumers, Perfumers, Natalie Gracia-Cetto, Quentin Bisch",Cardamom,"Lavender, Iris","Vanilla, Oriental notes, Woodsy Notes",18800,4600,1200,578,377,7900,2800,16200,18800,7200,16800,designer,0.7209156720798279,0.9156720798278224,winter,6,,1,1,0.0,0.0,0.0,0.0,0.0,0.0,0.0,0.0,0.0,0.0,1.0,0.0,0.0,0.0,0.0,0.0,0.0,0.0,0.0,0.0,0.13400526132293744,0.7443414591626231
2026-04-16,Scandal Pour Homme,Jean Paul Gaultier,designer,USA,USD,84.52,71.75,100.0,0.7175,4.6,,in_stock,https://www.amazon.com/s?k=Jean+Paul+Gaultier+Scandal+Pour+Homme,https://www.fragrantica.com/perfume/Jean-Paul-Gaultier/Scandal-Pour-Homme-68074.html,,4.27,7006,male,Oriental Woody,"caramel, aromatic, sweet, citrus, vanilla, amber, soft spicy, woody","Perfumers, Perfumers, Christophe Raynaud, Natalie Gracia-Cetto, Quentin Bisch","Mandarin Orange, Clary Sage","Caramel, Tonka Bean",Vetiver,3900,1900,640,365,194,2300,949,4000,4400,2100,4100,designer,0.5295042148878412,0.8286898128304043,winter,5,,1,1,0.0,0.0,0.0,0.0,0.0,0.0,0.0,0.0,0.0,0.0,0.0,0.0,0.0,0.0,0.0,1.0,0.0,0.0,0.0,0.0,0.10243732369813952,0.20298108492895953
2026-04-16,Le Male Elixir,Jean Paul Gaultier,designer,USA,USD,107.99,91.67,100.0,0.9167,4.6,,in_stock,https://www.amazon.com/s?k=Jean+Paul+Gaultier+Le+Male+Elixir,https://www.fragrantica.com/perfume/Jean-Paul-Gaultier/Le-Male-Elixir-81642.html,,4.52,23545,male,Oriental Fougere,"vanilla, sweet, honey, aromatic, amber, lavender, tobacco, green, fresh spicy, powdery","Perfumers, Perfumers, Quentin Bisch","Lavender, Mint","Vanilla, Benzoin","Honey, Tonka Bean, Tobacco",16800,4100,1300,748,580,5000,2300,14000,18100,6500,14900,designer,0.689391363481809,0.8883032981978919,winter,7,,1,1,0.0,0.0,0.0,0.0,0.0,0.0,0.0,0.0,0.0,0.0,0.0,0.0,1.0,0.0,0.0,0.0,0.0,0.0,0.0,0.0,0.13400526132293744,0.6835284888281953
2026-04-16,Bleu de Chanel,Chanel,designer,USA,USD,173.0,146.86,100.0,1.4686,5.0,,in_stock,https://www.amazon.com/s?k=Chanel+Bleu+de+Chanel,https://www.fragrantica.com/perfume/Chanel/Bleu-de-Chanel-9099.html,,4.18,20410,male,Woody Aromatic,"citrus, woody, fresh spicy, aromatic, amber, smoky, balsamic, warm spicy, green, fresh","Perfumers, Perfumers, Jacques Polge","Grapefruit, Lemon, Mint, Pink Pepper","Ginger, Nutmeg, Jasmine, Iso E Super","Incense, Cedar, Vetiver, Sandalwood, Patchouli, Labdanum, White Musk",9700,7300,1200,2000,216,8500,7800,7200,5000,8600,7500,designer,0.46453761755485895,0.832680250783699,spring,15,,1,1,0.0,0.0,0.0,0.0,0.0,0.0,0.0,0.0,0.0,0.0,0.0,0.0,0.0,0.0,0.0,0.0,0.0,1.0,0.0,0.0,0.22146683147919238,0.5924397826655432
2026-04-16,Allure Homme Sport,Chanel,designer,USA,USD,167.99,142.61,100.0,1.4261,4.2,,in_stock,https://www.amazon.com/s?k=Chanel+Allure+Homme+Sport,https://www.fragrantica.com/perfume/Chanel/Allure-Homme-Sport-607.html,,4.26,15017,male,Woody Spicy,"citrus, aromatic, vanilla, aldehydic, marine, sweet, fresh spicy, fresh, amber, powdery","Perfumers, Perfumers, Jacques Polge","Orange, Sea Notes, Aldehydes, Blood Mandarin","Pepper, Neroli, Cedar","Vanilla, Tonka Bean, White Musk, Amber, Vetiver, Elemi resin",7500,5400,836,1200,118,6200,7000,2900,1400,7000,2400,designer,0.49036800850272355,0.8569151056197688,summer,13,,1,1,0.0,0.0,0.0,0.0,0.0,0.0,0.0,0.0,0.0,0.0,0.0,0.0,0.0,0.0,0.0,0.0,0.0,0.0,0.0,1.0,0.21473170422490567,0.43574396373885
2026-04-16,Coco Mademoiselle,Chanel,designer,USA,USD,173.15,146.99,100.0,1.4699,4.4,,in_stock,https://www.amazon.com/s?k=Chanel+Coco+Mademoiselle,https://www.fragrantica.com/perfume/Chanel/Coco-Mademoiselle-611.html,,4.11,32629,female,Oriental Floral,"citrus, woody, patchouli, sweet, white floral, rose, earthy, vanilla, warm spicy, yellow floral","Perfumers, Perfumers, Jacques Polge","Orange, Mandarin Orange, Bergamot, Orange Blossom","Turkish Rose, Jasmine, Mimosa, Ylang-Ylang","Patchouli, White Musk, Vanilla, Vetiver, Tonka Bean, Opoponax",14800,11500,1800,4000,506,9100,5100,8500,7400,10600,7200,designer,0.43838557320738514,0.8066000122676807,spring,14,,0,1,0.0,0.0,0.0,0.0,0.0,0.0,0.0,0.0,0.0,0.0,0.0,1.0,0.0,0.0,0.0,0.0,0.0,0.0,0.0,0.0,0.22167284713638236,0.9474678211349042
2026-04-16,Chanel No 5 Eau Premiere,Chanel,designer,USA,USD,209.0,177.42,100.0,1.7742,4.4,,in_stock,https://www.amazon.com/s?k=Chanel+No+5+Eau+Premiere,https://www.fragrantica.com/perfume/Chanel/Chanel-N-5-Eau-Premiere-1360.html,,4.21,6177,female,Floral Aldehyde,"woody, aldehydic, fresh, white floral, yellow floral, vanilla, sweet, rose, floral, powdery","Perfumers, Perfumers, Jacques Polge","Aldehydes, Ylang-Ylang, Neroli","Jasmine, Tincture of Rose","Vanille, Sandalwood, Vetyver",2900,2400,73,751,12,1400,820,1100,891,1700,851,designer,0.4706649282920469,0.863754889178618,spring,8,,0,1,0.0,0.0,0.0,0.0,0.0,0.0,0.0,0.0,1.0,0.0,0.0,0.0,0.0,0.0,0.0,0.0,0.0,0.0,0.0,0.0,0.2698963582770752,0.17889415114623586
2026-04-16,Egoiste Platinum,Chanel,designer,USA,USD,171.95,145.97,100.0,1.4597,4.4,,in_stock,https://www.amazon.com/s?k=Chanel+Egoiste+Platinum,https://www.fragrantica.com/perfume/Chanel/Egoiste-Platinum-614.html,,4.23,11906,male,Woody Floral Musk,"aromatic, fresh spicy, woody, lavender, green, herbal","Perfumers, Perfumers, Jacques Polge","Lavender, Rosemary, Neroli, Petitgrain","Geranium, Clary Sage, Galbanum, Jasmine","Oakmoss, Vetiver, Cedar, Sandalwood, Amber",6200,3700,606,1200,151,4900,4200,3700,2100,5000,2700,designer,0.5101627730454584,0.8349498186725142,spring,13,,1,1,0.0,0.0,0.0,0.0,0.0,0.0,0.0,0.0,0.0,0.0,0.0,0.0,0.0,0.0,0.0,0.0,0.0,0.0,1.0,0.0,0.22005641659535355,0.3453525873841416
2026-04-16,Oud Wood,Tom Ford,designer,USA,USD,180.0,152.8,100.0,1.528,3.0,,in_stock,https://www.amazon.com/s?k=Tom+Ford+Oud+Wood,https://www.fragrantica.com/perfume/Tom-Ford/Oud-Wood-1826.html,,4.29,16676,unisex,Oriental Woody,"woody, oud, warm spicy, aromatic, vanilla, balsamic, fresh spicy, amber, powdery, sweet","Perfumers, Perfumers, Richard Herpin","Agarwood (Oud), Brazilian Rosewood, Cardamom, Sandalwood, Sichuan Pepper, Vanilla, Vetiver, Tonka Bean, Amber",,,9300,4700,1300,1100,312,4000,1700,7500,7300,4700,6800,niche,0.5378171373863092,0.8377213977979895,fall,9,,2,2,0.0,0.0,0.0,0.0,0.0,0.0,0.0,0.0,0.0,0.0,0.0,0.0,0.0,0.0,0.0,1.0,0.0,0.0,0.0,0.0,0.2308801622769484,0.48394688671296165
2026-04-16,Black Orchid,Tom Ford,designer,USA,USD,132.94,112.85,100.0,1.1285,5.0,,in_stock,https://www.amazon.com/s?k=Tom+Ford+Black+Orchid,https://www.fragrantica.com/perfume/Tom-Ford/Black-Orchid-1018.html,,3.89,31397,female,Oriental Floral,"warm spicy, earthy, woody, sweet, amber, patchouli, floral, chocolate, powdery, balsamic","Perfumers, Perfumers, David Apel, Pierre Negrin","Truffle, Gardenia, Black Currant, Ylang-Ylang, Jasmine, Bergamot, Mandarin Orange, Amalfi Lemon","Orchid, Spices, Gardenia, Fruity Notes, Ylang-Ylang, Jasmine, Lotus","Mexican chocolate, Patchouli, Vanille, Incense, Amber, Sandalwood, Vetiver, White Musk",13700,8900,1900,5400,1500,3000,1700,10100,12000,3600,12300,niche,0.3885350318471338,0.7197452229299363,winter,20,,0,2,0.0,0.0,0.0,0.0,0.0,0.0,0.0,0.0,0.0,0.0,0.0,1.0,0.0,0.0,0.0,0.0,0.0,0.0,0.0,0.0,0.16756996608665334,0.9116715576604585
2026-04-16,Tobacco Vanille,Tom Ford,designer,USA,USD,145.0,123.09,100.0,1.2309,4.4,,in_stock,https://www.amazon.com/s?k=Tom+Ford+Tobacco+Vanille,https://www.fragrantica.com/perfume/Tom-Ford/Tobacco-Vanille-1825.html,,4.19,29866,unisex,Oriental Spicy,"vanilla, sweet, tobacco, warm spicy, fruity, woody, cacao, powdery","Perfumers, Perfumers, Olivier Gillotin","Tobacco Leaf, Spicy Notes","Vanilla, Cacao, Tonka Bean, Tobacco Blossom","Dried Fruits, Woody Notes",16200,7800,2000,2900,953,2500,1600,11700,14300,5100,12300,niche,0.5107359394365726,0.803939302582655,winter,8,,2,2,0.0,0.0,0.0,0.0,0.0,0.0,0.0,0.0,0.0,0.0,0.0,0.0,0.0,1.0,0.0,0.0,0.0,0.0,0.0,0.0,0.18379766092992297,0.8671877269953802
