scrape_date,name,brand,category,country,currency,price,price_eur,bottle_size_ml,price_per_ml,amazon_rating,amazon_reviews,availability,amazon_url,fragrantica_url,year,rating,votes,gender,fragrance_family,main_accords,perfumers,top_notes,middle_notes,base_notes,votes_love,votes_like,votes_ok,votes_dislike,votes_hate,season_spring,season_summer,season_fall,season_winter,wear_day,wear_night,brand_origin,sentiment_polarisation,crowd_pleaser_index,season_dominant,note_count,years_on_market,gender_id,brand_origin_id,fam_,fam_aromatic,fam_aromatic_aquatic,fam_aromatic_fougere,fam_aromatic_fruity,fam_aromatic_spicy,fam_chypre_fruity,fam_floral,fam_floral_aldehyde,fam_floral_fruity,fam_oriental,fam_oriental_floral,fam_oriental_fougere,fam_oriental_spicy,fam_oriental_vanilla,fam_oriental_woody,fam_woody_aquatic,fam_woody_aromatic,fam_woody_floral_musk,fam_woody_spicy,price_per_ml_scaled,votes_scaled
2026-04-14,Hawas Elixir,Rasasi,arabic,USA,USD,45.5,38.94,100.0,0.3894,4.4,,in_stock,https://www.amazon.com/s?k=Rasasi+Hawas+Elixir,https://www.fragrantica.com/perfume/Rasasi/Hawas-Elixir-110808.html,,4.54,987,unisex,Oriental Vanilla,"vanilla, aromatic, green, sweet, fresh spicy, warm spicy, amber, chocolate, lavender, powdery","Perfumers, Perfumers","Mint, Bergamot, Artemisia","Dark Chocolate, Lavender, Benzoin","Vanilla, Tonka Bean, White Musk",660,238,57,21,11,312,86,619,747,279,664,arabic,0.6575481256332321,0.9098277608915907,winter,9,,2,0,0.0,0.0,0.0,0.0,0.0,0.0,0.0,0.0,0.0,0.0,0.0,0.0,0.0,0.0,1.0,0.0,0.0,0.0,0.0,0.0,0.05035184480791176,0.028121092273242793
2026-04-14,Hawas Viper,Rasasi,arabic,USA,USD,32.0,27.39,100.0,0.2739,4.2,,in_stock,https://www.amazon.com/s?k=Rasasi+Hawas+Viper,https://www.fragrantica.com/perfume/Rasasi/Hawas-Viper-113594.html,,3.71,139,male,Oriental,"warm spicy, aromatic, tobacco, sweet, green, cannabis, coffee, fruity, herbal, musky","Perfumers, Perfumers","Saffron, cannabis, Thyme, Green Notes, Davana","Tobacco, Coffee, Cinnamon, Violet, Raspberry","Gurjan balsam, Musk, Tonka",74,18,7,12,28,32,13,58,83,29,66,arabic,0.33093525179856115,0.6618705035971223,winter,13,,1,0,0.0,0.0,0.0,0.0,0.0,0.0,0.0,0.0,0.0,0.0,1.0,0.0,0.0,0.0,0.0,0.0,0.0,0.0,0.0,0.0,0.03204640547736781,0.003460610114287376
2026-04-14,Royal Blend Bourbon,French Avenue,arabic,USA,USD,48.5,41.51,100.0,0.4151,4.1,,in_stock,https://www.amazon.com/s?k=French+Avenue+Royal+Blend+Bourbon,https://www.fragrantica.com/perfume/French-Avenue/Royal-Blend-Bourbon-103478.html,,3.69,214,unisex,Aromatic,"woody, warm spicy, aromatic, cinnamon, green, fresh spicy, balsamic, amber","Perfumers, Perfumers","Cinnamon, Peppermint, Bark, Basil","Bourbon Whiskey, Lavender","Oak, Peru Balsam",76,64,25,29,20,39,10,104,114,42,98,arabic,0.2616822429906542,0.6542056074766355,winter,8,,2,0,0.0,1.0,0.0,0.0,0.0,0.0,0.0,0.0,0.0,0.0,0.0,0.0,0.0,0.0,0.0,0.0,0.0,0.0,0.0,0.0,0.05442500316977304,0.00564166690900631
2026-04-14,Vulcan Feu,French Avenue,arabic,USA,USD,40.89,35.0,100.0,0.35,4.5,,in_stock,https://www.amazon.com/s?k=French+Avenue+Vulcan+Feu,https://www.fragrantica.com/perfume/French-Avenue/Vulcan-Feu-105520.html,,4.45,4272,unisex,Floral,"tropical, fruity, sweet, citrus, woody, fresh, fresh spicy, aromatic, amber, terpenic","Perfumers, Perfumers","Mango, Lemon, Ginger, Rhubarb","Pink Pepper, Jasmine, Violet, Praline","Tonka Bean, Cedarwood, Ambergris, Moss",2800,891,304,162,87,2600,3200,853,361,2800,1000,arabic,0.6392554194156456,0.8696983977379831,summer,12,,2,0,0.0,0.0,0.0,0.0,0.0,0.0,0.0,1.0,0.0,0.0,0.0,0.0,0.0,0.0,0.0,0.0,0.0,0.0,0.0,0.0,0.04410739191073919,0.12365137988193212
2026-04-14,Veneno,French Avenue,arabic,USA,USD,49.99,42.78,100.0,0.4278,4.4,,in_stock,https://www.amazon.com/s?k=French+Avenue+Veneno,https://www.fragrantica.com/perfume/French-Avenue/Veneno-105519.html,,4.19,460,unisex,Aromatic Fruity,"smoky, fruity, cinnamon, tobacco, warm spicy, vanilla, sweet, fresh, green, mossy","Perfumers, Perfumers, Jean-Louis Sieuzac","Apple, Smoke, Cinnamon","Tobacco, Moss","Bourbon Vanilla, Orcanox™",242,130,39,32,17,95,33,262,291,85,259,arabic,0.4891304347826087,0.808695652173913,winter,7,,2,0,0.0,0.0,0.0,0.0,1.0,0.0,0.0,0.0,0.0,0.0,0.0,0.0,0.0,0.0,0.0,0.0,0.0,0.0,0.0,0.0,0.05643780905287181,0.012795533195684416
2026-04-14,Club de Nuit Intense Man,Armaf,arabic,USA,USD,76.99,65.89,100.0,0.6589,4.5,,in_stock,https://www.amazon.com/s?k=Armaf+Club+de+Nuit+Intense+Man,https://www.fragrantica.com/perfume/Armaf/Club-de-Nuit-Intense-Man-34696.html,,4.09,26371,male,Woody Spicy,"citrus, fruity, leather, smoky, woody, aromatic, sweet, fresh, musky","Perfumers, Perfumers","Lemon, Pineapple, Bergamot, Black Currant, Apple","Birch, Jasmine, Rose","Musk, Ambergris, Patchouli, Vanilla",12200,8400,2700,2000,1000,14800,14300,12900,8700,14700,12900,arabic,0.42585551330798477,0.7832699619771863,spring,12,,1,0,0.0,0.0,0.0,0.0,0.0,0.0,0.0,0.0,0.0,0.0,0.0,0.0,0.0,0.0,0.0,0.0,0.0,0.0,0.0,1.0,0.09306453657918093,0.7663070346351819
2026-04-14,Club de Nuit Intense,Armaf,arabic,USA,USD,26.62,22.78,100.0,0.2278,4.3,,in_stock,https://www.amazon.com/s?k=Armaf+Club+de+Nuit+Intense,https://www.fragrantica.com/perfume/Armaf/Club-de-Nuit-Intense-27656.html,,4.11,3341,female,Chypre Floral,"rose, fresh spicy, warm spicy, patchouli, oud, vanilla, woody, floral, amber, powdery","Perfumers, Perfumers","Rose, Saffron, Geranium","Nutmeg, Pepper, Violet, Caraway","Patchouli, Agarwood (Oud), Vanilla, Amber",1500,1100,252,331,84,600,257,1500,1500,726,1500,arabic,0.43342516069788795,0.7958371594735231,fall,11,,0,0,0.0,0.0,0.0,0.0,0.0,0.0,0.0,0.0,0.0,0.0,0.0,0.0,0.0,0.0,0.0,0.0,0.0,0.0,0.0,0.0,0.0247400786103715,0.09657719487015441
2026-04-14,Club de Nuit Milestone,Armaf,arabic,USA,USD,34.2,29.27,100.0,0.2927,4.5,,in_stock,https://www.amazon.com/s?k=Armaf+Club+de+Nuit+Milestone,https://www.fragrantica.com/perfume/Armaf/Club-de-Nuit-Milestone-64104.html,,3.94,4520,unisex,Woody Floral Musk,"marine, aromatic, woody, powdery, musky, fruity, violet, citrus, amber, salty","Perfumers, Perfumers","Sea Notes, Red Fruits, Bergamot","Violet, White Woods, Sandalwood","Musk, Ambroxan, Vetiver",1900,1400,618,391,241,2600,2900,988,390,2700,933,arabic,0.3646153846153846,0.7252747252747253,summer,9,,2,0,0.0,0.0,0.0,0.0,0.0,0.0,0.0,0.0,0.0,0.0,0.0,0.0,0.0,0.0,0.0,0.0,0.0,0.0,1.0,0.0,0.03502599213896285,0.13086340768313606
2026-04-14,Tres Nuit,Armaf,arabic,USA,USD,22.22,19.02,100.0,0.1902,4.5,,in_stock,https://www.amazon.com/s?k=Armaf+Tres+Nuit,https://www.fragrantica.com/perfume/Armaf/Tres-Nuit-27711.html,,4.13,3324,male,Aromatic Spicy,"powdery, violet, lavender, woody, iris, citrus, amber, aromatic, floral, animalic","Perfumers, Perfumers","Iris, Lemon, Vervain","Lavender, Violet, Spicy Notes","Ambergris, Sandalwood",1400,1300,322,267,47,1900,1800,1000,295,1900,698,arabic,0.4055755395683453,0.8093525179856115,spring,8,,1,0,0.0,0.0,0.0,0.0,0.0,1.0,0.0,0.0,0.0,0.0,0.0,0.0,0.0,0.0,0.0,0.0,0.0,0.0,0.0,0.0,0.01878090528718144,0.09608282199668479
2026-04-14,Hunter Intense,Armaf,arabic,USA,USD,25.29,21.64,100.0,0.2164,4.4,,in_stock,https://www.amazon.com/s?k=Armaf+Hunter+Intense,https://www.fragrantica.com/perfume/Armaf/Hunter-Intense-50327.html,,4.26,1148,male,Woody Aromatic,"citrus, fresh spicy, aromatic, lavender, warm spicy","Perfumers, Perfumers","Bergamot, Pomelo, Mandarin Orange, Lemon","Lavender, Geranium, Ylang Ylang, Tuberose","Black Pepper, Cardamom",551,423,106,53,15,678,688,575,260,698,522,arabic,0.46689895470383275,0.8484320557491289,summer,10,,1,0,0.0,0.0,0.0,0.0,0.0,0.0,0.0,0.0,0.0,0.0,0.0,0.0,0.0,0.0,0.0,0.0,0.0,1.0,0.0,0.0,0.02293330797514898,0.032803094192572775
2026-04-14,Legesi Homme,Armaf,arabic,USA,USD,26.13,22.36,100.0,0.2236,4.4,,in_stock,https://www.amazon.com/s?k=Armaf+Legesi+Homme,https://www.fragrantica.com/perfume/Armaf/Legesi-Homme-52265.html,,4.37,931,male,Woody Aromatic,"aromatic, woody, lavender, fresh spicy, herbal, powdery, musky, green","Perfumers, Perfumers","Lavender, Rosemary, Petitgrain","Sage, Jasmine, Galbanum, Rose","Sandalwood, Musk, Cedar, Oakmoss",523,284,77,36,11,608,577,528,222,601,299,arabic,0.5499462943071965,0.8668098818474759,spring,11,,1,0,0.0,0.0,0.0,0.0,0.0,0.0,0.0,0.0,0.0,0.0,0.0,0.0,0.0,0.0,0.0,0.0,0.0,1.0,0.0,0.0,0.024074426271078985,0.026492569866519322
2026-04-14,Amber Oud Gold Edition,Al Haramain,arabic,USA,USD,43.21,36.98,100.0,0.3698,4.2,,in_stock,https://www.amazon.com/s?k=Al+Haramain+Amber+Oud+Gold,https://www.fragrantica.com/perfume/Al-Haramain-Perfumes/Amber-Oud-Gold-Edition-51816.html,,4.27,5217,unisex,Oriental Vanilla,"sweet, fruity, ozonic, powdery, vanilla, musky, fresh, amber, aquatic, citrus","Perfumers, Perfumers","Bergamot, Green Notes","Melon, Pineapple, Amber, Gourmand Accord","Vanilla, Musk, Woody Notes",2900,1400,447,294,158,2800,2500,2600,2300,2800,2500,arabic,0.5274091171379112,0.8270821311790729,spring,9,,2,0,0.0,0.0,0.0,0.0,0.0,0.0,0.0,0.0,0.0,0.0,0.0,0.0,0.0,0.0,1.0,0.0,0.0,0.0,0.0,0.0,0.04724546722454673,0.15113269549539068
2026-04-14,L'Aventure,Al Haramain,arabic,USA,USD,30.87,26.42,100.0,0.2642,4.3,,in_stock,https://www.amazon.com/s?k=Al+Haramain+L+Aventure,https://www.fragrantica.com/perfume/Al-Haramain-Perfumes/L-Aventure-40405.html,,4.17,2693,male,Chypre Fruity,"citrus, aromatic, woody, musky, fresh spicy, white floral, powdery","Perfumers, Perfumers","Lemon, Bergamot, elemi","Woody Notes, Jasmine, Lily-of-the-Valley","Musk, Patchouli, Amber",1300,942,243,197,53,1500,1500,1100,548,1500,926,arabic,0.45594149908592324,0.819744058500914,spring,9,,1,0,0.0,0.0,0.0,0.0,0.0,0.0,1.0,0.0,0.0,0.0,0.0,0.0,0.0,0.0,0.0,0.0,0.0,0.0,0.0,0.0,0.030509065550906555,0.07773286416378282
2026-04-14,L'Aventure Knight,Al Haramain,arabic,USA,USD,30.87,26.42,100.0,0.2642,4.3,,in_stock,https://www.amazon.com/s?k=Al+Haramain+L+Aventure+Knight,https://www.fragrantica.com/perfume/Al-Haramain-Perfumes/L-Aventure-Knight-51824.html,,3.99,866,male,Oriental Fougere,"powdery, citrus, ozonic, iris, woody, amber, green, musky, aquatic, animalic","Perfumers, Perfumers","Lemon Verbena, Bergamot, Tea","Violet Leaf, Iris","Powdery Notes, Ambergris, Musk, Sandalwood",352,299,102,82,31,528,475,344,133,509,270,arabic,0.37066974595842955,0.7517321016166282,spring,9,,1,0,0.0,0.0,0.0,0.0,0.0,0.0,0.0,0.0,0.0,0.0,0.0,0.0,1.0,0.0,0.0,0.0,0.0,0.0,0.0,0.0,0.030509065550906555,0.02460232064442958
2026-04-14,Detour Noir,Al Haramain,arabic,USA,USD,25.99,22.24,100.0,0.2224,4.2,,in_stock,https://www.amazon.com/s?k=Al+Haramain+Detour+Noir,https://www.fragrantica.com/perfume/Al-Haramain-Perfumes/D-tour-Noir-70748.html,,4.29,4802,unisex,Oriental Spicy,"vanilla, woody, warm spicy, fresh spicy, powdery, aromatic, fruity, lavender, fresh, citrus","Perfumers, Perfumers","Apple, Lavender, Jasmine, Violet","Vanilla, Patchouli, Bergamot, Mandarin Orange","Sandalwood, Cardamom, Pepper, Guaiac Wood, Geranium",2700,1300,448,226,119,2600,892,3100,3100,2500,2900,arabic,0.538493636553307,0.8345503859795536,fall,13,,2,0,0.0,0.0,0.0,0.0,0.0,0.0,0.0,0.0,0.0,0.0,0.0,0.0,0.0,1.0,0.0,0.0,0.0,0.0,0.0,0.0,0.023884239888423985,0.13906418123127925
2026-04-14,Supremacy Silver,Afnan,arabic,USA,USD,34.99,29.95,100.0,0.2995,4.2,,in_stock,https://www.amazon.com/s?k=Afnan+Supremacy+Silver,https://www.fragrantica.com/perfume/Afnan/Supremacy-Silver-27352.html,,4.06,2257,male,Woody Floral Musk,"fruity, leather, woody, sweet, smoky, citrus, musky, mossy, tropical, fresh","Perfumers, Perfumers, Imran Fazlani","Pineapple, Black Currant, Bergamot, Apple","Birch, Patchouli, Moroccan Jasmine, Rose","Musk, Oakmoss, Ambergris, Vanilla",956,797,247,198,59,1200,1100,962,464,1200,752,arabic,0.39743021710234827,0.7766947275143996,spring,12,,1,0,0.0,0.0,0.0,0.0,0.0,0.0,0.0,0.0,0.0,0.0,0.0,0.0,0.0,0.0,0.0,0.0,0.0,0.0,1.0,0.0,0.036103714974007856,0.06505365399715009
2026-04-14,Supremacy Gold,Afnan,arabic,USA,USD,34.99,29.95,100.0,0.2995,4.2,,in_stock,https://www.amazon.com/s?k=Afnan+Supremacy+Gold,https://www.fragrantica.com/perfume/Afnan/Supremacy-Gold-27351.html,,3.83,248,unisex,Oriental,"amber, powdery, fresh spicy, floral, violet, vanilla, iris, oud, warm spicy, woody","Perfumers, Perfumers","Nutmeg, Violet, Peach Blossom, Cumin","Iris, Patchouli","Amber, Vanilla, Agarwood (Oud), Benzoin",87,80,40,33,8,96,49,121,105,82,98,arabic,0.3185483870967742,0.6733870967741935,fall,10,,2,0,0.0,0.0,0.0,0.0,0.0,0.0,0.0,0.0,0.0,0.0,1.0,0.0,0.0,0.0,0.0,0.0,0.0,0.0,0.0,0.0,0.036103714974007856,0.0066304126559455605
2026-04-14,Black Afgano,Nasomatto,designer,UAE,AED,459.75,107.14,30.0,3.5713,4.4,,in_stock,https://www.amazon.ae/s?k=Nasomatto+Black+Afgano+30ml,https://www.fragrantica.com/perfume/Nasomatto/Black-Afgano-6472.html,,4.06,12067,unisex,Woody Aromatic,"amber, smoky, woody, oud, cannabis, balsamic, green, aromatic, warm spicy, tobacco","Perfumers, Perfumers, Alessandro Gualtieri","cannabis, Green Notes, Davana, Saffron, Thyme","Resins, Woodsy Notes, Tobacco, Coffee, Cinnamon, Violet, Raspberry","Agarwood (Oud), Incense, Amber, Animal notes, Guaiac Wood, Musk, Tonka, Cedar, Gurjan balsam, Ambroxan, Vanilla",5900,3400,888,1400,516,1500,855,4400,5000,1800,4800,niche,0.4448116325181758,0.7683410442828817,winter,23,,2,2,0.0,0.0,0.0,0.0,0.0,0.0,0.0,0.0,0.0,0.0,0.0,0.0,0.0,0.0,0.0,0.0,0.0,1.0,0.0,0.0,0.5546468872828705,0.35033588274638666
2026-04-14,Baraonda,Nasomatto,designer,UAE,AED,821.45,191.44,30.0,6.3813,4.7,,in_stock,https://www.amazon.ae/s?k=Nasomatto+Baraonda+30ml,https://www.fragrantica.com/perfume/Nasomatto/Baraonda-40200.html,,4.42,5818,unisex,Oriental Woody,"woody, whiskey, musky, rose, floral, amber, warm spicy","Perfumers, Perfumers, Alessandro Gualtieri","Whiskey, Woody Notes, Ambrette (Musk Mallow), Rose, Ambroxan, Musk",,,3600,1500,363,310,65,997,471,2600,2500,1100,2300,niche,0.605515587529976,0.8735868448098664,fall,6,,2,2,0.0,0.0,0.0,0.0,0.0,0.0,0.0,0.0,0.0,0.0,0.0,0.0,0.0,0.0,0.0,1.0,0.0,0.0,0.0,0.0,1.0,0.1686102306104051
2026-04-14,Bleu de Chanel,Chanel,designer,UAE,AED,939.0,218.83,100.0,2.1883,2.6,,in_stock,https://www.amazon.ae/s?k=Chanel+Bleu+de+Chanel+100ml,https://www.fragrantica.com/perfume/Chanel/Bleu-de-Chanel-9099.html,,4.18,20400,male,Woody Aromatic,"citrus, woody, fresh spicy, aromatic, amber, smoky, balsamic, warm spicy, green, fresh","Perfumers, Perfumers, Jacques Polge","Grapefruit, Lemon, Mint, Pink Pepper","Ginger, Nutmeg, Jasmine, Iso E Super","Incense, Cedar, Vetiver, Sandalwood, Patchouli, Labdanum, White Musk",9700,7300,1200,2000,215,8500,7800,7200,5000,8600,7500,designer,0.46460935586578495,0.8327210384521185,spring,15,,1,1,0.0,0.0,0.0,0.0,0.0,0.0,0.0,0.0,0.0,0.0,0.0,0.0,0.0,0.0,0.0,0.0,0.0,1.0,0.0,0.0,0.33545708127298085,0.5926658330182918
2026-04-14,Allure Homme Sport,Chanel,designer,UAE,AED,509.0,118.62,100.0,1.1862,4.2,,in_stock,https://www.amazon.ae/s?k=Chanel+Allure+Homme+Sport+100ml,https://www.fragrantica.com/perfume/Chanel/Allure-Homme-Sport-607.html,,4.26,15010,male,Woody Spicy,"citrus, aromatic, vanilla, aldehydic, marine, sweet, fresh spicy, fresh, amber, powdery","Perfumers, Perfumers, Jacques Polge","Orange, Sea Notes, Aldehydes, Blood Mandarin","Pepper, Neroli, Cedar","Vanilla, Tonka Bean, White Musk, Amber, Vetiver, Elemi resin",7500,5400,835,1200,118,6200,7000,2900,1400,7000,2400,designer,0.4904005846010762,0.8569720321530592,summer,13,,1,1,0.0,0.0,0.0,0.0,0.0,0.0,0.0,0.0,0.0,0.0,0.0,0.0,0.0,0.0,0.0,0.0,0.0,0.0,0.0,1.0,0.17663560289083302,0.43592055137115765
2026-04-14,Coco Mademoiselle,Chanel,designer,UAE,AED,649.0,151.25,100.0,1.5125,4.5,,in_stock,https://www.amazon.ae/s?k=Chanel+Coco+Mademoiselle+100ml,https://www.fragrantica.com/perfume/Chanel/Coco-Mademoiselle-611.html,,4.11,32623,female,Oriental Floral,"citrus, woody, patchouli, sweet, white floral, rose, earthy, vanilla, warm spicy, yellow floral","Perfumers, Perfumers, Jacques Polge","Orange, Mandarin Orange, Bergamot, Orange Blossom","Turkish Rose, Jasmine, Mimosa, Ylang-Ylang","Patchouli, White Musk, Vanilla, Vetiver, Tonka Bean, Opoponax",14800,11500,1800,4000,506,9100,5100,8500,7400,10600,7200,designer,0.43838557320738514,0.8066000122676807,spring,14,,0,1,0.0,0.0,0.0,0.0,0.0,0.0,0.0,0.0,0.0,0.0,0.0,1.0,0.0,0.0,0.0,0.0,0.0,0.0,0.0,0.0,0.22835045010777227,0.9481199290429523
2026-04-14,Chanel No 5 Eau Premiere,Chanel,designer,UAE,AED,556.99,129.81,100.0,1.2981,,,in_stock,https://www.amazon.ae/s?k=Chanel+No+5+Eau+Premiere+100ml,https://www.fragrantica.com/perfume/Chanel/Chanel-N-5-Eau-Premiere-1360.html,,4.21,6177,female,Floral Aldehyde,"woody, aldehydic, fresh, white floral, yellow floral, vanilla, sweet, rose, floral, powdery","Perfumers, Perfumers, Jacques Polge","Aldehydes, Ylang-Ylang, Neroli","Jasmine, Tincture of Rose","Vanille, Sandalwood, Vetyver",2900,2400,72,752,12,1400,820,1100,891,1700,851,designer,0.4706649282920469,0.863754889178618,spring,8,,0,1,0.0,0.0,0.0,0.0,0.0,0.0,0.0,0.0,1.0,0.0,0.0,0.0,0.0,0.0,0.0,0.0,0.0,0.0,0.0,0.0,0.19437048307341195,0.17905022246779304
2026-04-14,Black Orchid,Tom Ford,designer,UAE,AED,389.0,90.66,100.0,0.9066,4.4,,in_stock,https://www.amazon.ae/s?k=Tom+Ford+Black+Orchid+100ml,https://www.fragrantica.com/perfume/Tom-Ford/Black-Orchid-1018.html,,3.89,31376,female,Oriental Floral,"warm spicy, earthy, woody, sweet, amber, patchouli, floral, chocolate, powdery, balsamic","Perfumers, Perfumers, David Apel, Pierre Negrin","Truffle, Gardenia, Black Currant, Ylang-Ylang, Jasmine, Bergamot, Mandarin Orange, Amalfi Lemon","Orchid, Spices, Gardenia, Fruity Notes, Ylang-Ylang, Jasmine, Lotus","Mexican chocolate, Patchouli, Vanille, Incense, Amber, Sandalwood, Vetiver, White Musk",13700,8900,1900,5400,1500,3000,1700,10000,12000,3600,12300,niche,0.3885350318471338,0.7197452229299363,winter,20,,0,2,0.0,0.0,0.0,0.0,0.0,0.0,0.0,0.0,0.0,0.0,0.0,1.0,0.0,0.0,0.0,0.0,0.0,0.0,0.0,0.0,0.13232217573221758,0.9118562247360922
2026-04-14,Tobacco Vanille,Tom Ford,designer,UAE,AED,750.5,174.9,50.0,3.498,4.4,,in_stock,https://www.amazon.ae/s?k=Tom+Ford+Tobacco+Vanille+100ml,https://www.fragrantica.com/perfume/Tom-Ford/Tobacco-Vanille-1825.html,,4.19,29838,unisex,Oriental Spicy,"vanilla, sweet, tobacco, warm spicy, fruity, woody, cacao, powdery","Perfumers, Perfumers, Olivier Gillotin","Tobacco Leaf, Spicy Notes","Vanilla, Cacao, Tonka Bean, Tobacco Blossom","Dried Fruits, Woody Notes",16200,7800,2000,2900,953,2500,1600,11700,14300,5100,12300,niche,0.5107359394365726,0.803939302582655,winter,8,,2,2,0.0,0.0,0.0,0.0,0.0,0.0,0.0,0.0,0.0,0.0,0.0,0.0,0.0,1.0,0.0,0.0,0.0,0.0,0.0,0.0,0.5430296690756942,0.8671300200657225
2026-04-14,1888,Xerjoff,designer,UAE,AED,649.0,151.25,100.0,1.5125,3.5,,in_stock,https://www.amazon.ae/s?k=Xerjoff+1888+100ml,https://www.fragrantica.com/perfume/Xerjoff/1888-21616.html,,4.18,2330,unisex,Oriental Floral,"warm spicy, woody, amber, floral, aromatic, yellow floral, fresh spicy, leather, powdery, rose","Perfumers, Perfumers","Carnation, Pepper, Coriander, Saffron","Ylang-Ylang, Rose, Neroli","Amber, Sandalwood, Patchouli, Birch",1100,759,212,200,32,456,178,958,945,630,809,niche,0.4637429439861051,0.8072079895788102,fall,11,,2,2,0.0,0.0,0.0,0.0,0.0,0.0,0.0,0.0,0.0,0.0,0.0,1.0,0.0,0.0,0.0,0.0,0.0,0.0,0.0,0.0,0.22835045010777227,0.06717654927734318
2026-04-14,Fiero,Xerjoff,designer,UAE,AED,498.25,116.12,100.0,1.1612,3.1,,in_stock,https://www.amazon.ae/s?k=Xerjoff+Fiero+100ml,https://www.fragrantica.com/perfume/Xerjoff/Fiero-11802.html,,4.21,1524,male,Aromatic Spicy,"citrus, aromatic, fresh spicy, woody, green","Perfumers, Perfumers, Chris Maurice","Amalfi Lemon, Lemongrass, Bergamot, Blood Orange","Mint, Neroli, Tarragon, Thyme","Vetiver, Patchouli, Nutmeg, Sandalwood, Coumarin",739,524,127,115,19,713,795,247,65,737,175,niche,0.47244094488188976,0.8287401574803149,summer,13,,1,2,0.0,0.0,0.0,0.0,0.0,1.0,0.0,0.0,0.0,0.0,0.0,0.0,0.0,0.0,0.0,0.0,0.0,0.0,0.0,0.0,0.17267338658552048,0.04373745892343037
2026-04-14,Eros,Versace,designer,UAE,AED,207.0,48.24,100.0,0.4824,4.6,,in_stock,https://www.amazon.ae/s?k=Versace+Eros+100ml,https://www.fragrantica.com/perfume/Versace/Eros-16657.html,,4.07,28922,male,Aromatic Fougere,"vanilla, aromatic, green, fresh spicy, amber, fruity, citrus, woody, sweet, fresh","Perfumers, Perfumers, Aurélien Guichard","Mint, Green Apple, Lemon","Tonka Bean, Ambroxan, Geranium","Madagascar Vanilla, Virginian Cedar, Atlas Cedar, Vetiver, Oakmoss",11900,11000,2700,2700,633,12800,10200,12100,11700,11100,13800,designer,0.38941692876646045,0.791483772854526,spring,11,,1,1,0.0,0.0,0.0,1.0,0.0,0.0,0.0,0.0,0.0,0.0,0.0,0.0,0.0,0.0,0.0,0.0,0.0,0.0,0.0,0.0,0.06509128946367439,0.8404920464128885
2026-04-14,Pour Femme Dylan Blue,Versace,designer,UAE,AED,200.0,46.61,100.0,0.4661,4.7,,in_stock,https://www.amazon.ae/s?k=Versace+Pour+Femme+Dylan+Blue+100ml,https://www.fragrantica.com/perfume/Versace/Versace-Pour-Femme-Dylan-Blue-47459.html,,3.78,5986,female,Floral Fruity,"fruity, floral, green, rose, fresh, woody, sweet, musky","Perfumers, Perfumers, Calice Becker, Natalie Gracia-Cetto","Granny Smith apple, Black Currant, Clover, Forget me not, Shiso","Peach, Petalia, Rose, Rose Hip, Jasmine","Musk, White Woods, Patchouli, Styrax",1600,2600,831,887,107,2100,2000,957,647,2200,855,designer,0.24780082987551869,0.6970954356846473,spring,14,,0,1,0.0,0.0,0.0,0.0,0.0,0.0,0.0,0.0,0.0,1.0,0.0,0.0,0.0,0.0,0.0,0.0,0.0,0.0,0.0,0.0,0.06250792443261062,0.17349579783057548
2026-04-14,Bright Crystal,Versace,designer,UAE,AED,180.75,42.12,90.0,0.468,4.7,,in_stock,https://www.amazon.ae/s?k=Versace+Bright+Crystal+90ml,https://www.fragrantica.com/perfume/Versace/Bright-Crystal-632.html,,3.74,23674,female,Floral Fruity,"floral, citrus, fresh, woody, rose, fresh spicy, aquatic","Perfumers, Perfumers, Alberto Morillas","Yuzu, Pomegranate, Ice","Peony, Lotus, Magnolia","Musk, Mahogany, Amber",5800,11000,2200,4300,343,8600,7700,1700,1400,9500,1500,designer,0.2308082730617942,0.7105697246542317,spring,9,,0,1,0.0,0.0,0.0,0.0,0.0,0.0,0.0,0.0,0.0,1.0,0.0,0.0,0.0,0.0,0.0,0.0,0.0,0.0,0.0,0.0,0.06280905287181437,0.687876232297089
2026-04-14,1 Million,Paco Rabanne,designer,UAE,AED,320.0,74.58,100.0,0.7458,4.6,,in_stock,https://www.amazon.ae/s?k=Paco+Rabanne+1+Million+100ml,https://www.fragrantica.com/perfume/Paco-Rabanne/1-Million-3747.html,,3.74,23413,male,Woody Spicy,"warm spicy, cinnamon, citrus, amber, woody, leather, rose, animalic, green, patchouli","Perfumers, Perfumers, Christophe Raynaud, Michel Girard, Olivier Pescheux","Blood Mandarin, Grapefruit, Mint","Cinnamon, Spicy Notes, Rose","Amber, Leather, Woody Notes, Indian Patchouli",7400,8600,2000,4600,751,3600,2100,8500,10000,4100,10200,designer,0.2847415528242902,0.6851954948396214,winter,10,,1,1,0.0,0.0,0.0,0.0,0.0,0.0,0.0,0.0,0.0,0.0,0.0,0.0,0.0,0.0,0.0,0.0,0.0,0.0,0.0,1.0,0.10683720045644732,0.6802861546514671
2026-04-14,Invictus,Rabanne,designer,UAE,AED,289.0,67.35,100.0,0.6735,4.7,,in_stock,https://www.amazon.ae/s?k=Rabanne+Invictus+100ml,https://www.fragrantica.com/perfume/Rabanne/Invictus-18471.html,,3.8,14484,male,Woody Aquatic,"citrus, marine, aromatic, fresh spicy, woody, salty, amber, white floral, aquatic, animalic","Perfumers, Perfumers, Anne Flipo, Dominique Ropion, Olivier Polge, Véronique Nyberg","Sea Notes, Grapefruit, Mandarin Orange","Bay Leaf, Jasmine","Ambergris, Guaiac Wood, Oakmoss, Patchouli",4400,5900,1500,2300,407,6300,7000,3000,1600,6800,3000,designer,0.27524643275660027,0.7100020679671882,summer,9,,1,1,0.0,0.0,0.0,0.0,0.0,0.0,0.0,0.0,0.0,0.0,0.0,0.0,0.0,0.0,0.0,0.0,1.0,0.0,0.0,0.0,0.09537847090148345,0.4206240730508622
2026-04-14,Phantom Parfum,Rabanne,designer,UAE,AED,247.48,57.67,100.0,0.5767,4.8,,in_stock,https://www.amazon.ae/s?k=Rabanne+Phantom+Parfum+100ml,https://www.fragrantica.com/perfume/Rabanne/Phantom-Parfum-81927.html,,3.91,2108,male,Aromatic,"aromatic, vanilla, warm spicy, citrus, lavender, woody, powdery, fresh spicy, sweet, green","Perfumers, Perfumers, Anne Flipo, Dominique Ropion, Juliette Karagueuzoglou","Cardamom, Bergamot, Rhubarb, Lemon","Lavender, Cedarwood, Patchouli, Geranium","Vanilla, Tolu Balsam, Haitian Vetiver",809,701,320,160,118,783,293,1100,1100,613,1000,designer,0.3277988614800759,0.7163187855787476,fall,11,,1,1,0.0,1.0,0.0,0.0,0.0,0.0,0.0,0.0,0.0,0.0,0.0,0.0,0.0,0.0,0.0,0.0,0.0,0.0,0.0,0.0,0.0800367693673133,0.06072062116497513
2026-04-14,Acqua di Gio,Giorgio Armani,designer,UAE,AED,215.0,50.11,100.0,0.5011,4.6,,in_stock,https://www.amazon.ae/s?k=Giorgio+Armani+Acqua+di+Gio+100ml,https://www.fragrantica.com/perfume/Giorgio-Armani/Acqua-di-Gio-410.html,,4.13,24147,unisex,Aromatic Aquatic,"citrus, aromatic, marine, fresh spicy, floral, woody, fresh","Perfumers, Perfumers, Alberto Morillas, Annick Menardo, Christian Dussoulier","Lime, Lemon, Bergamot, Jasmine, Orange, Mandarin Orange, Neroli","Sea Notes, Jasmine, Calone, Rosemary, Peach, Freesia, Hiacynth, Cyclamen, Violet, Coriander, Rose, Nutmeg, Mignonette","White Musk, Cedar, Oakmoss, Patchouli, Amber",9600,10400,1800,2000,256,9100,13100,2500,1300,12200,2700,designer,0.38842700365813104,0.8313934153641503,summer,24,,2,1,0.0,0.0,1.0,0.0,0.0,0.0,0.0,0.0,0.0,0.0,0.0,0.0,0.0,0.0,0.0,0.0,0.0,0.0,0.0,0.0,0.06805502726004817,0.7016314304824498
2026-04-14,Armani Code Parfum,Giorgio Armani,designer,UAE,AED,328.3,76.51,100.0,0.7651,4.6,,in_stock,https://www.amazon.ae/s?k=Giorgio+Armani+Armani+Code+Parfum+100ml,https://www.fragrantica.com/perfume/Giorgio-Armani/Armani-Code-Parfum-75126.html,,4.41,6331,male,Woody Aromatic,"iris, aromatic, powdery, woody, citrus, vanilla, earthy, aldehydic, violet, fresh spicy","Perfumers, Perfumers, Antoine Maisondieu","Bergamot, Bergamot Leaf","Iris, Aldehydes, Clary Sage, Orris","Tonka Bean, Cedar",3800,1700,589,190,72,3600,2100,3900,3700,3300,3600,designer,0.5869941741458038,0.8660053534876397,fall,8,,1,1,0.0,0.0,0.0,0.0,0.0,0.0,0.0,0.0,0.0,0.0,0.0,0.0,0.0,0.0,0.0,0.0,0.0,1.0,0.0,0.0,0.1098960314441486,0.18352865908628258
