scrape_date,name,brand,category,country,currency,price,price_eur,bottle_size_ml,price_per_ml,amazon_rating,amazon_reviews,availability,amazon_url,fragrantica_url,year,rating,votes,gender,fragrance_family,main_accords,perfumers,top_notes,middle_notes,base_notes,votes_love,votes_like,votes_ok,votes_dislike,votes_hate,season_spring,season_summer,season_fall,season_winter,wear_day,wear_night,brand_origin,sentiment_polarisation,crowd_pleaser_index,season_dominant,note_count,years_on_market,gender_id,brand_origin_id,fam_,fam_aromatic,fam_aromatic_aquatic,fam_aromatic_fougere,fam_aromatic_fruity,fam_aromatic_spicy,fam_chypre_fruity,fam_floral,fam_floral_aldehyde,fam_floral_fruity,fam_oriental,fam_oriental_floral,fam_oriental_fougere,fam_oriental_spicy,fam_oriental_vanilla,fam_oriental_woody,fam_woody_aquatic,fam_woody_aromatic,fam_woody_floral_musk,fam_woody_spicy,price_per_ml_scaled,votes_scaled
2026-04-15,Royal Oud,Creed,designer,USA,USD,41.99,35.65,100.0,0.3565,3.8,,in_stock,https://www.amazon.com/s?k=Creed+Royal+Oud,https://www.fragrantica.com/perfume/Creed/Royal-Oud-12317.html,,4.36,5496,unisex,Oriental Fougere,"woody, musky, powdery, citrus, aromatic, soft spicy, oud, green, amber","Perfumers, Perfumers, Julien Rasquinet, Olivier Creed","Pink Pepper, Lemon, Sicilian Bergamot","Cedar, Angelica, Galbanum","Sandalwood, Agarwood (Oud), Musk",3300,1500,310,404,59,1700,695,2400,2200,1800,2100,niche,0.5815539206890364,0.8612955320294275,fall,9,,2,2,0.0,0.0,0.0,0.0,0.0,0.0,0.0,0.0,0.0,0.0,0.0,0.0,1.0,0.0,0.0,0.0,0.0,0.0,0.0,0.0,0.04522836043231593,0.159107417845832
2026-04-15,Wind Flowers,Creed,designer,USA,USD,460.0,390.49,100.0,3.9049,4.1,,in_stock,https://www.amazon.com/s?k=Creed+Wind+Flowers,https://www.fragrantica.com/perfume/Creed/Wind-Flowers-70182.html,,3.61,1017,female,Floral,"white floral, sweet, powdery, musky, tuberose, rose, woody, iris, animalic, fruity","Perfumers, Perfumers, Olivier Creed","Jasmine, Orange Blossom, Peach","Jasmine Sambac, Tuberose, Rose","Musk, Orange Blossom, Praline, Iris, Sandalwood",317,278,201,153,68,350,271,174,100,332,133,niche,0.2448377581120944,0.5850540806293019,spring,10,,0,2,0.0,0.0,0.0,0.0,0.0,0.0,0.0,1.0,0.0,0.0,0.0,0.0,0.0,0.0,0.0,0.0,0.0,0.0,0.0,0.0,0.6075560204113973,0.028968242438329895
2026-04-15,Le Male,Jean Paul Gaultier,designer,USA,USD,77.68,65.94,100.0,0.6594,4.6,,in_stock,https://www.amazon.com/s?k=Jean+Paul+Gaultier+Le+Male,https://www.fragrantica.com/perfume/Jean-Paul-Gaultier/Le-Male-430.html,,4.0,24160,female,Oriental Fougere,"aromatic, vanilla, fresh spicy, lavender, warm spicy, green, powdery, sweet, amber, woody","Perfumers, Perfumers, Francis Kurkdjian","Lavender, Mint, Cardamom, Bergamot, Artemisia","Cinnamon, Orange Blossom, Caraway","Vanilla, Tonka Bean, Amber, Sandalwood, Cedar",9800,8800,1900,3200,458,8500,5600,9400,9600,9100,9500,designer,0.38670419736733175,0.7699312857024588,winter,13,,0,1,0.0,0.0,0.0,0.0,0.0,0.0,0.0,0.0,0.0,0.0,0.0,0.0,1.0,0.0,0.0,0.0,0.0,0.0,0.0,0.0,0.09323000855757345,0.7013975651567539
2026-04-15,Ultra Male,Jean Paul Gaultier,designer,USA,USD,91.79,77.92,100.0,0.7792,4.7,,in_stock,https://www.amazon.com/s?k=Jean+Paul+Gaultier+Ultra+Male,https://www.fragrantica.com/perfume/Jean-Paul-Gaultier/Ultra-Male-30947.html,,4.45,16733,male,Oriental Fougere,"vanilla, fruity, aromatic, sweet, cinnamon, warm spicy, fresh spicy, lavender, powdery, green","Perfumers, Perfumers, Francis Kurkdjian","Pear, Lavender, Mint, Bergamot, Lemon","Cinnamon, Clary Sage, Caraway","Black Vanilla Husk, Amber, Patchouli, Cedar",10700,4100,829,871,202,5600,2700,9200,10400,4000,10400,designer,0.6285474793437912,0.8861214225841216,winter,12,,1,1,0.0,0.0,0.0,0.0,0.0,0.0,0.0,0.0,0.0,0.0,0.0,0.0,1.0,0.0,0.0,0.0,0.0,0.0,0.0,0.0,0.11221514373553927,0.48560304500682805
2026-04-15,Le Male Le Parfum,Jean Paul Gaultier,designer,USA,USD,105.9,89.9,125.0,0.7192,,,in_stock,https://www.amazon.com/s?k=Jean+Paul+Gaultier+Le+Male+Le+Parfum,https://www.fragrantica.com/perfume/Jean-Paul-Gaultier/Le-Male-Le-Parfum-61856.html,,4.6,25624,male,Oriental,"warm spicy, vanilla, lavender, aromatic, powdery, iris, woody, amber, violet","Perfumers, Perfumers, Natalie Gracia-Cetto, Quentin Bisch",Cardamom,"Lavender, Iris","Vanilla, Oriental notes, Woodsy Notes",18800,4600,1200,578,377,7900,2800,16200,18800,7200,16800,designer,0.7209156720798279,0.9156720798278224,winter,6,,1,1,0.0,0.0,0.0,0.0,0.0,0.0,0.0,0.0,0.0,0.0,1.0,0.0,0.0,0.0,0.0,0.0,0.0,0.0,0.0,0.0,0.10270672878831097,0.7439346834413225
2026-04-15,Classique,Jean Paul Gaultier,designer,USA,USD,79.26,67.28,100.0,0.6728,4.6,,in_stock,https://www.amazon.com/s?k=Jean+Paul+Gaultier+Classique,https://www.fragrantica.com/perfume/Jean-Paul-Gaultier/Classique-427.html,,3.92,12440,female,Oriental Floral,"white floral, sweet, powdery, citrus, vanilla, soft spicy, floral, anis, woody, yellow floral","Perfumers, Perfumers, Jacques Cavallier Belletrud","Orange Blossom, Star Anise, Rose, Mandarin Orange, Pear, Bergamot","Ylang-Ylang, Ginger, Orchid, Tuberose, Iris, Plum","Vanilla, Amber, Musk, Cinnamon, Sandalwood",4700,4700,507,2300,169,1700,1100,3100,3300,2400,3500,designer,0.36611182934712344,0.7595345830639948,winter,17,,0,1,0.0,0.0,0.0,0.0,0.0,0.0,0.0,0.0,0.0,0.0,0.0,1.0,0.0,0.0,0.0,0.0,0.0,0.0,0.0,0.0,0.09535355456245442,0.36086817561088996
2026-04-15,Scandal Pour Homme,Jean Paul Gaultier,designer,USA,USD,84.52,71.75,100.0,0.7175,4.6,,in_stock,https://www.amazon.com/s?k=Jean+Paul+Gaultier+Scandal+Pour+Homme,https://www.fragrantica.com/perfume/Jean-Paul-Gaultier/Scandal-Pour-Homme-68074.html,,4.27,7005,male,Oriental Woody,"caramel, aromatic, sweet, citrus, vanilla, amber, soft spicy, woody","Perfumers, Perfumers, Christophe Raynaud, Natalie Gracia-Cetto, Quentin Bisch","Mandarin Orange, Clary Sage","Caramel, Tonka Bean",Vetiver,3900,1900,640,365,194,2300,949,4000,4400,2100,4100,designer,0.5295042148878412,0.8286898128304043,winter,5,,1,1,0.0,0.0,0.0,0.0,0.0,0.0,0.0,0.0,0.0,0.0,0.0,0.0,0.0,0.0,0.0,1.0,0.0,0.0,0.0,0.0,0.10243732369813952,0.2029520295202952
2026-04-15,Le Male Elixir,Jean Paul Gaultier,designer,USA,USD,101.45,86.12,100.0,0.8612,3.2,,in_stock,https://www.amazon.com/s?k=Jean+Paul+Gaultier+Le+Male+Elixir,https://www.fragrantica.com/perfume/Jean-Paul-Gaultier/Le-Male-Elixir-81642.html,,4.52,23530,male,Oriental Fougere,"vanilla, sweet, honey, aromatic, amber, lavender, tobacco, green, fresh spicy, powdery","Perfumers, Perfumers, Quentin Bisch","Lavender, Mint","Vanilla, Benzoin","Honey, Tonka Bean, Tobacco",16800,4100,1300,747,579,5000,2300,14000,18100,6500,14900,designer,0.6894924764090793,0.8883788149281646,winter,7,,1,1,0.0,0.0,0.0,0.0,0.0,0.0,0.0,0.0,0.0,0.0,0.0,0.0,1.0,0.0,0.0,0.0,0.0,0.0,0.0,0.0,0.12520997749675128,0.6830926576982305
2026-04-15,Bleu de Chanel,Chanel,designer,USA,USD,173.95,147.67,100.0,1.4767,5.0,,in_stock,https://www.amazon.com/s?k=Chanel+Bleu+de+Chanel,https://www.fragrantica.com/perfume/Chanel/Bleu-de-Chanel-9099.html,,4.18,20400,male,Woody Aromatic,"citrus, woody, fresh spicy, aromatic, amber, smoky, balsamic, warm spicy, green, fresh","Perfumers, Perfumers, Jacques Polge","Grapefruit, Lemon, Mint, Pink Pepper","Ginger, Nutmeg, Jasmine, Iso E Super","Incense, Cedar, Vetiver, Sandalwood, Patchouli, Labdanum, White Musk",9700,7300,1200,2000,215,8500,7800,7200,5000,8600,7500,designer,0.46460935586578495,0.8327210384521185,spring,15,,1,1,0.0,0.0,0.0,0.0,0.0,0.0,0.0,0.0,0.0,0.0,0.0,0.0,0.0,0.0,0.0,0.0,0.0,1.0,0.0,0.0,0.2227504674970682,0.5921492285789
2026-04-15,Allure Homme Sport,Chanel,designer,USA,USD,167.99,142.61,100.0,1.4261,4.2,,in_stock,https://www.amazon.com/s?k=Chanel+Allure+Homme+Sport,https://www.fragrantica.com/perfume/Chanel/Allure-Homme-Sport-607.html,,4.26,15010,male,Woody Spicy,"citrus, aromatic, vanilla, aldehydic, marine, sweet, fresh spicy, fresh, amber, powdery","Perfumers, Perfumers, Jacques Polge","Orange, Sea Notes, Aldehydes, Blood Mandarin","Pepper, Neroli, Cedar","Vanilla, Tonka Bean, White Musk, Amber, Vetiver, Elemi resin",7500,5400,835,1200,118,6200,7000,2900,1400,7000,2400,designer,0.4904005846010762,0.8569720321530592,summer,13,,1,1,0.0,0.0,0.0,0.0,0.0,0.0,0.0,0.0,0.0,0.0,0.0,0.0,0.0,0.0,0.0,0.0,0.0,0.0,0.0,1.0,0.21473170422490567,0.4355405758781997
2026-04-15,Coco Mademoiselle,Chanel,designer,USA,USD,173.15,146.99,100.0,1.4699,4.4,,in_stock,https://www.amazon.com/s?k=Chanel+Coco+Mademoiselle,https://www.fragrantica.com/perfume/Chanel/Coco-Mademoiselle-611.html,,4.11,32629,female,Oriental Floral,"citrus, woody, patchouli, sweet, white floral, rose, earthy, vanilla, warm spicy, yellow floral","Perfumers, Perfumers, Jacques Polge","Orange, Mandarin Orange, Bergamot, Orange Blossom","Turkish Rose, Jasmine, Mimosa, Ylang-Ylang","Patchouli, White Musk, Vanilla, Vetiver, Tonka Bean, Opoponax",14800,11500,1800,4000,506,9100,5100,8500,7400,10600,7200,designer,0.43838557320738514,0.8066000122676807,spring,14,,0,1,0.0,0.0,0.0,0.0,0.0,0.0,0.0,0.0,0.0,0.0,0.0,1.0,0.0,0.0,0.0,0.0,0.0,0.0,0.0,0.0,0.22167284713638236,0.9474678211349042
2026-04-15,Chanel No 5 Eau Premiere,Chanel,designer,USA,USD,209.0,177.42,100.0,1.7742,4.4,,in_stock,https://www.amazon.com/s?k=Chanel+No+5+Eau+Premiere,https://www.fragrantica.com/perfume/Chanel/Chanel-N-5-Eau-Premiere-1360.html,,4.21,6177,female,Floral Aldehyde,"woody, aldehydic, fresh, white floral, yellow floral, vanilla, sweet, rose, floral, powdery","Perfumers, Perfumers, Jacques Polge","Aldehydes, Ylang-Ylang, Neroli","Jasmine, Tincture of Rose","Vanille, Sandalwood, Vetyver",2900,2400,72,752,12,1400,820,1100,891,1700,851,designer,0.4706649282920469,0.863754889178618,spring,8,,0,1,0.0,0.0,0.0,0.0,0.0,0.0,0.0,0.0,1.0,0.0,0.0,0.0,0.0,0.0,0.0,0.0,0.0,0.0,0.0,0.0,0.2698963582770752,0.17889415114623586
2026-04-15,Egoiste Platinum,Chanel,designer,USA,USD,171.95,145.97,100.0,1.4597,4.4,,in_stock,https://www.amazon.com/s?k=Chanel+Egoiste+Platinum,https://www.fragrantica.com/perfume/Chanel/Egoiste-Platinum-614.html,,4.23,11906,male,Woody Floral Musk,"aromatic, fresh spicy, woody, lavender, green, herbal","Perfumers, Perfumers, Jacques Polge","Lavender, Rosemary, Neroli, Petitgrain","Geranium, Clary Sage, Galbanum, Jasmine","Oakmoss, Vetiver, Cedar, Sandalwood, Amber",6200,3700,606,1200,151,4900,4200,3700,2100,5000,2700,designer,0.5101627730454584,0.8349498186725142,spring,13,,1,1,0.0,0.0,0.0,0.0,0.0,0.0,0.0,0.0,0.0,0.0,0.0,0.0,0.0,0.0,0.0,0.0,0.0,0.0,1.0,0.0,0.22005641659535355,0.3453525873841416
2026-04-15,Oud Wood,Tom Ford,designer,USA,USD,180.0,152.8,100.0,1.528,3.0,,in_stock,https://www.amazon.com/s?k=Tom+Ford+Oud+Wood,https://www.fragrantica.com/perfume/Tom-Ford/Oud-Wood-1826.html,,4.29,16676,unisex,Oriental Woody,"woody, oud, warm spicy, aromatic, vanilla, balsamic, fresh spicy, amber, powdery, sweet","Perfumers, Perfumers, Richard Herpin","Agarwood (Oud), Brazilian Rosewood, Cardamom, Sandalwood, Sichuan Pepper, Vanilla, Vetiver, Tonka Bean, Amber",,,9300,4700,1300,1100,312,4000,1700,7500,7300,4700,6800,niche,0.5378171373863092,0.8377213977979895,fall,9,,2,2,0.0,0.0,0.0,0.0,0.0,0.0,0.0,0.0,0.0,0.0,0.0,0.0,0.0,0.0,0.0,1.0,0.0,0.0,0.0,0.0,0.2308801622769484,0.48394688671296165
2026-04-15,Black Orchid,Tom Ford,designer,USA,USD,132.94,112.85,100.0,1.1285,5.0,,in_stock,https://www.amazon.com/s?k=Tom+Ford+Black+Orchid,https://www.fragrantica.com/perfume/Tom-Ford/Black-Orchid-1018.html,,3.89,31397,female,Oriental Floral,"warm spicy, earthy, woody, sweet, amber, patchouli, floral, chocolate, powdery, balsamic","Perfumers, Perfumers, David Apel, Pierre Negrin","Truffle, Gardenia, Black Currant, Ylang-Ylang, Jasmine, Bergamot, Mandarin Orange, Amalfi Lemon","Orchid, Spices, Gardenia, Fruity Notes, Ylang-Ylang, Jasmine, Lotus","Mexican chocolate, Patchouli, Vanille, Incense, Amber, Sandalwood, Vetiver, White Musk",13700,8900,1900,5400,1500,3000,1700,10100,12000,3600,12300,niche,0.3885350318471338,0.7197452229299363,winter,20,,0,2,0.0,0.0,0.0,0.0,0.0,0.0,0.0,0.0,0.0,0.0,0.0,1.0,0.0,0.0,0.0,0.0,0.0,0.0,0.0,0.0,0.16756996608665334,0.9116715576604585
2026-04-15,Tobacco Vanille,Tom Ford,designer,USA,USD,145.0,123.09,100.0,1.2309,4.4,,in_stock,https://www.amazon.com/s?k=Tom+Ford+Tobacco+Vanille,https://www.fragrantica.com/perfume/Tom-Ford/Tobacco-Vanille-1825.html,,4.19,29862,unisex,Oriental Spicy,"vanilla, sweet, tobacco, warm spicy, fruity, woody, cacao, powdery","Perfumers, Perfumers, Olivier Gillotin","Tobacco Leaf, Spicy Notes","Vanilla, Cacao, Tonka Bean, Tobacco Blossom","Dried Fruits, Woody Notes",16200,7800,2000,2900,953,2500,1600,11700,14300,5100,12300,niche,0.5107359394365726,0.803939302582655,winter,8,,2,2,0.0,0.0,0.0,0.0,0.0,0.0,0.0,0.0,0.0,0.0,0.0,0.0,0.0,1.0,0.0,0.0,0.0,0.0,0.0,0.0,0.18379766092992297,0.8670715053607229
2026-04-15,Lost Cherry,Tom Ford,designer,USA,USD,91.8,77.93,100.0,0.7793,4.4,,in_stock,https://www.amazon.com/s?k=Tom+Ford+Lost+Cherry,https://www.fragrantica.com/perfume/Tom-Ford/Lost-Cherry-51411.html,,4.07,16987,unisex,Oriental Floral,"cherry, sweet, almond, nutty, fruity, vanilla, warm spicy, amber, woody, balsamic","Perfumers, Perfumers, Louise Turner","Bitter Almond, Black Cherry, Cherry Liqueur","Sour Cherry, Plum, Turkish Rose, Jasmine Sambac","Vanilla, Tonka Bean, Cinnamon, Peru Balsam, Sandalwood, Benzoin, Cloves, Cedar, Patchouli, Vetiver",8000,5000,1900,1500,629,3400,2100,6300,6200,4100,6000,niche,0.43284984438311114,0.7634036056139527,fall,17,,2,2,0.0,0.0,0.0,0.0,0.0,0.0,0.0,0.0,0.0,0.0,0.0,1.0,0.0,0.0,0.0,0.0,0.0,0.0,0.0,0.0,0.11223099109378466,0.49298311880756607
2026-04-15,Tuscan Leather,Tom Ford,designer,USA,USD,141.65,120.25,100.0,1.2025,4.4,,in_stock,https://www.amazon.com/s?k=Tom+Ford+Tuscan+Leather,https://www.fragrantica.com/perfume/Tom-Ford/Tuscan-Leather-1849.html,,4.26,10176,unisex,Leather,"leather, fruity, animalic, sweet, amber, smoky, warm spicy, woody","Perfumers, Perfumers","Raspberry, Saffron, Thyme","Olibanum, Jasmine","Leather, Suede, Woody Notes, Amber",5600,2900,514,947,186,1400,548,3700,3800,2000,3600,niche,0.5335567162708189,0.8376860155711048,winter,9,,2,2,0.0,0.0,0.0,0.0,0.0,0.0,0.0,0.0,0.0,0.0,0.0,0.0,0.0,0.0,0.0,0.0,0.0,0.0,0.0,0.0,0.1792970111882349,0.295086730394863
2026-04-15,Verde Accento,Xerjoff,designer,USA,USD,160.13,135.93,100.0,1.3593,4.0,,in_stock,https://www.amazon.com/s?k=Xerjoff+Verde+Accento,https://www.fragrantica.com/perfume/Xerjoff/Verde-Accento-105329.html,,4.2,20,unisex,,"woody, citrus, powdery, white floral, patchouli, musky, warm spicy, iris, earthy, soft spicy","Perfumers, Perfumers","Italian Mandarin, Bergamot","Jasmine, Iris, Pink Pepper","Patchouli, Sandalwood, Musk, Amber, Bourbon Vanilla",11,5,2,1,1,5,7,4,1,7,2,niche,0.5,0.8,summer,10,,2,2,1.0,0.0,0.0,0.0,0.0,0.0,0.0,0.0,0.0,0.0,0.0,0.0,0.0,0.0,0.0,0.0,0.0,0.0,0.0,0.0,0.2041456689169915,0.0
2026-04-15,1888,Xerjoff,designer,USA,USD,290.0,246.18,100.0,2.4618,4.5,,in_stock,https://www.amazon.com/s?k=Xerjoff+1888,https://www.fragrantica.com/perfume/Xerjoff/1888-21616.html,,4.18,2332,unisex,Oriental Floral,"warm spicy, woody, amber, floral, aromatic, yellow floral, fresh spicy, leather, powdery, rose","Perfumers, Perfumers","Carnation, Pepper, Coriander, Saffron","Ylang-Ylang, Rose, Neroli","Amber, Sandalwood, Patchouli, Birch",1100,759,212,201,32,456,178,959,946,630,810,niche,0.4635416666666667,0.8068576388888888,fall,11,,2,2,0.0,0.0,0.0,0.0,0.0,0.0,0.0,0.0,0.0,0.0,0.0,1.0,0.0,0.0,0.0,0.0,0.0,0.0,0.0,0.0,0.3788627935723115,0.06717610483191447
2026-04-15,Pour Femme Dylan Blue,Versace,designer,USA,USD,127.14,107.93,100.0,1.0793,5.0,,in_stock,https://www.amazon.com/s?k=Versace+Pour+Femme+Dylan+Blue,https://www.fragrantica.com/perfume/Versace/Versace-Pour-Femme-Dylan-Blue-47459.html,,3.78,5986,female,Floral Fruity,"fruity, floral, green, rose, fresh, woody, sweet, musky","Perfumers, Perfumers, Calice Becker, Natalie Gracia-Cetto","Granny Smith apple, Black Currant, Clover, Forget me not, Shiso","Peach, Petalia, Rose, Rose Hip, Jasmine","Musk, White Woods, Patchouli, Styrax",1600,2600,831,887,107,2100,2000,957,647,2200,855,designer,0.24780082987551869,0.6970954356846473,spring,14,,0,1,0.0,0.0,0.0,0.0,0.0,0.0,0.0,0.0,0.0,1.0,0.0,0.0,0.0,0.0,0.0,0.0,0.0,0.0,0.0,0.0,0.15977306582992612,0.17334456809135018
2026-04-15,Bright Crystal,Versace,designer,USA,USD,50.65,43.0,100.0,0.43,4.4,,in_stock,https://www.amazon.com/s?k=Versace+Bright+Crystal,https://www.fragrantica.com/perfume/Versace/Bright-Crystal-632.html,,3.74,23681,female,Floral Fruity,"floral, citrus, fresh, woody, rose, fresh spicy, aquatic","Perfumers, Perfumers, Alberto Morillas","Yuzu, Pomegranate, Ice","Peony, Lotus, Magnolia","Musk, Mahogany, Amber",5800,11000,2200,4300,343,8600,7700,1700,1400,9500,1500,designer,0.2308082730617942,0.7105697246542317,spring,9,,0,1,0.0,0.0,0.0,0.0,0.0,0.0,0.0,0.0,0.0,1.0,0.0,0.0,0.0,0.0,0.0,0.0,0.0,0.0,0.0,0.0,0.056876168742670596,0.6874800244065432
2026-04-15,1 Million,Paco Rabanne,designer,USA,USD,79.99,67.9,100.0,0.679,4.7,,in_stock,https://www.amazon.com/s?k=Paco+Rabanne+1+Million,https://www.fragrantica.com/perfume/Paco-Rabanne/1-Million-3747.html,,3.74,23415,male,Woody Spicy,"warm spicy, cinnamon, citrus, amber, woody, leather, rose, animalic, green, patchouli","Perfumers, Perfumers, Christophe Raynaud, Michel Girard, Olivier Pescheux","Blood Mandarin, Grapefruit, Mint","Cinnamon, Spicy Notes, Rose","Amber, Leather, Woody Notes, Indian Patchouli",7400,8600,2000,4600,751,3600,2100,8500,10000,4100,10200,designer,0.2847415528242902,0.6851954948396214,winter,10,,1,1,0.0,0.0,0.0,0.0,0.0,0.0,0.0,0.0,0.0,0.0,0.0,0.0,0.0,0.0,0.0,0.0,0.0,0.0,0.0,1.0,0.09633609077366803,0.6797512857018333
2026-04-15,Invictus,Rabanne,designer,USA,USD,85.99,73.0,100.0,0.73,4.7,,in_stock,https://www.amazon.com/s?k=Rabanne+Invictus,https://www.fragrantica.com/perfume/Rabanne/Invictus-18471.html,,3.8,14495,male,Woody Aquatic,"citrus, marine, aromatic, fresh spicy, woody, salty, amber, white floral, aquatic, animalic","Perfumers, Perfumers, Anne Flipo, Dominique Ropion, Olivier Polge, Véronique Nyberg","Sea Notes, Grapefruit, Mandarin Orange","Bay Leaf, Jasmine","Ambergris, Guaiac Wood, Oakmoss, Patchouli",4400,5900,1500,2300,407,6300,7000,3000,1600,6800,3000,designer,0.27524643275660027,0.7100020679671882,summer,9,,1,1,0.0,0.0,0.0,0.0,0.0,0.0,0.0,0.0,0.0,0.0,0.0,0.0,0.0,0.0,0.0,0.0,1.0,0.0,0.0,0.0,0.10441824347881207,0.42057704041607347
2026-04-15,Acqua di Gio,Giorgio Armani,designer,USA,USD,120.0,101.87,100.0,1.0187,1.0,,in_stock,https://www.amazon.com/s?k=Giorgio+Armani+Acqua+di+Gio,https://www.fragrantica.com/perfume/Giorgio-Armani/Acqua-di-Gio-410.html,,4.13,24147,unisex,Aromatic Aquatic,"citrus, aromatic, marine, fresh spicy, floral, woody, fresh","Perfumers, Perfumers, Alberto Morillas, Annick Menardo, Christian Dussoulier","Lime, Lemon, Bergamot, Jasmine, Orange, Mandarin Orange, Neroli","Sea Notes, Jasmine, Calone, Rosemary, Peach, Freesia, Hiacynth, Cyclamen, Violet, Coriander, Rose, Nutmeg, Mignonette","White Musk, Cedar, Oakmoss, Patchouli, Amber",9600,10400,1800,2000,256,9100,13100,2500,1300,12200,2700,designer,0.38842700365813104,0.8313934153641503,summer,24,,2,1,0.0,0.0,1.0,0.0,0.0,0.0,0.0,0.0,0.0,0.0,0.0,0.0,0.0,0.0,0.0,0.0,0.0,0.0,0.0,0.0,0.15016956673322554,0.7010198448441177
2026-04-15,My Way,Giorgio Armani,designer,USA,USD,,,100.0,,4.5,,unavailable,https://www.amazon.com/s?k=Giorgio+Armani+My+Way,https://www.fragrantica.com/perfume/Giorgio-Armani/My-Way-62036.html,,3.78,12969,female,Floral,"white floral, tuberose, citrus, animalic, vanilla","Perfumers, Perfumers, Bruno Jovanovic, Carlos Benaïm","Orange Blossom, Bergamot","Tuberose, Indian Jasmine","Madagascar Vanilla, White Musk, Virginian Cedar",4400,4300,2000,1700,596,5100,3600,2600,1800,5000,2000,designer,0.29270544783010155,0.6694367497691598,spring,7,,0,1,0.0,0.0,0.0,0.0,0.0,0.0,0.0,1.0,0.0,0.0,0.0,0.0,0.0,0.0,0.0,0.0,0.0,0.0,0.0,0.0,0.16586394685102768,0.37623848679431676
2026-04-15,Black Opium,Yves Saint Laurent,designer,USA,USD,99.0,84.04,100.0,0.8404,4.7,,in_stock,https://www.amazon.com/s?k=Yves+Saint+Laurent+Black+Opium,https://www.fragrantica.com/perfume/Yves-Saint-Laurent/Black-Opium-25324.html,,3.94,33443,female,Oriental Vanilla,"vanilla, coffee, sweet, white floral, warm spicy, soft spicy, woody, fruity, balsamic, powdery","Perfumers, Perfumers, Honorine Blanc, Marie Salamagne, Nathalie Lorson, Olivier Cresp","Pear, Pink Pepper, Orange Blossom","Coffee, Jasmine, Bitter Almond, Licorice","Vanilla, Patchouli, Cashmere Wood, Cedar",13000,11800,3300,4400,959,3200,2100,11600,13400,5200,13700,designer,0.3598732777429092,0.7412056546818494,winter,11,,0,1,0.0,0.0,0.0,0.0,0.0,0.0,0.0,0.0,0.0,0.0,0.0,0.0,0.0,0.0,1.0,0.0,0.0,0.0,0.0,0.0,0.12191372698171216,0.9711189237876631
2026-04-15,Good Girl,Carolina Herrera,designer,USA,USD,110.95,94.19,100.0,0.9419,4.7,,in_stock,https://www.amazon.com/s?k=Carolina+Herrera+Good+Girl,https://www.fragrantica.com/perfume/Carolina-Herrera/Good-Girl-39681.html,,3.95,24233,female,Oriental Floral,"sweet, white floral, warm spicy, vanilla, amber, cacao, woody, tuberose, almond, powdery","Perfumers, Perfumers, Louise Turner, Quentin Bisch","Almond, Coffee, Bergamot, Lemon","Tuberose, Jasmine Sambac, Orange Blossom, Bulgarian Rose, Orris","Tonka Bean, Cacao, Vanilla, Praline, Sandalwood, Musk, Amber, Cashmere Wood, Patchouli, Cinnamon, Cedar",9800,8000,2600,3200,690,3600,2100,8300,9000,4000,10100,designer,0.3750514615067929,0.7328118567311651,winter,20,,0,1,0.0,0.0,0.0,0.0,0.0,0.0,0.0,0.0,0.0,0.0,0.0,1.0,0.0,0.0,0.0,0.0,0.0,0.0,0.0,0.0,0.13799879560077333,0.7035186099892494
2026-04-15,Vintage Radio,Lattafa,arabic,USA,USD,31.53,26.77,100.0,0.2677,4.6,,in_stock,https://www.amazon.com/s?k=Lattafa+Vintage+Radio,https://www.fragrantica.com/perfume/Lattafa-Perfumes/Vintage-Radio-89454.html,,4.3,3603,unisex,Oriental Woody,"woody, fruity, aromatic, fresh spicy, citrus, lavender, sweet, herbal, warm spicy, powdery","Perfumers, Perfumers","Lavender, Sage, Bergamot","Plum, Palo Santo, Black Pepper","Sandalwood, Oud",2000,975,332,201,66,2000,839,2200,2000,1800,1900,arabic,0.5411303861219922,0.8324006715165081,fall,8,,2,0,0.0,0.0,0.0,0.0,0.0,0.0,0.0,0.0,0.0,0.0,0.0,0.0,0.0,0.0,0.0,1.0,0.0,0.0,0.0,0.0,0.03115590631041805,0.10410552924426883
2026-04-15,Hawas for Him,Rasasi,arabic,USA,USD,33.99,28.85,100.0,0.2885,4.2,,in_stock,https://www.amazon.com/s?k=Rasasi+Hawas+for+Him,https://www.fragrantica.com/perfume/Rasasi/Hawas-for-Him-46890.html,,4.32,10058,male,Aromatic Aquatic,"fruity, citrus, aquatic, fresh, warm spicy, amber, sweet, musky, aromatic, animalic","Perfumers, Perfumers","Apple, Bergamot, Lemon, Cinnamon","Watery Notes, Plum, Orange Blossom, Cardamon","Ambergris, Musk, Patchouli, Driftwood",5400,3100,919,408,172,6400,7500,2800,1400,6700,3100,arabic,0.5228522852285229,0.8500850085008501,summer,12,,1,0,0.0,0.0,1.0,0.0,0.0,0.0,0.0,0.0,0.0,0.0,0.0,0.0,0.0,0.0,0.0,0.0,0.0,0.0,0.0,0.0,0.034452156825457186,0.2916581921724729
2026-04-15,La Yuqawam Homme,Rasasi,arabic,USA,USD,32.9,27.93,75.0,0.3724,4.3,,in_stock,https://www.amazon.com/s?k=Rasasi+La+Yuqawam+Homme,https://www.fragrantica.com/perfume/Rasasi/La-Yuqawam-Homme-19668.html,,4.4,3860,male,Oriental,"leather, fruity, sweet, animalic, amber, woody, musky, warm spicy, smoky","Perfumers, Perfumers","Raspberry, Saffron, Thyme","Olibanum, Jasmine, Artemisia","Leather, Suede, Woody Notes, Amber",2400,971,200,223,66,780,261,2100,2200,1100,2000,arabic,0.6046632124352331,0.8733160621761658,winter,10,,1,0,0.0,0.0,0.0,0.0,0.0,0.0,0.0,0.0,0.0,0.0,1.0,0.0,0.0,0.0,0.0,0.0,0.0,0.0,0.0,0.0,0.04774809039333143,0.1115727692709998
2026-04-15,Hawas Ice,Rasasi,arabic,USA,USD,33.99,28.85,100.0,0.2885,4.2,,in_stock,https://www.amazon.com/s?k=Rasasi+Hawas+Ice,https://www.fragrantica.com/perfume/Rasasi/Hawas-Ice-89050.html,,4.43,5750,male,Aromatic,"fruity, citrus, sweet, fresh, aromatic, musky, powdery, fresh spicy, green, white floral","Perfumers, Perfumers","Apple, Italian Lemon, Sicilian Bergamot, Star Anise","Plum, Orange Blossom, Cardamon","Musk, Amber, Driftwood, Moss",3500,1500,401,168,105,3800,4300,2100,1000,4000,1800,arabic,0.5983433204088826,0.8812125484666902,summer,11,,1,0,0.0,1.0,0.0,0.0,0.0,0.0,0.0,0.0,0.0,0.0,0.0,0.0,0.0,0.0,0.0,0.0,0.0,0.0,0.0,0.0,0.034452156825457186,0.16648749164657
2026-04-15,Egra Men,Rasasi,arabic,USA,USD,29.4,24.96,100.0,0.2496,4.2,,in_stock,https://www.amazon.com/s?k=Rasasi+Egra+Men,https://www.fragrantica.com/perfume/Rasasi/Egra-Men-19678.html,,4.01,610,male,Woody Aromatic,"woody, aromatic, fresh spicy, green, ozonic, powdery, amber, aquatic, iris, citrus","Perfumers, Perfumers","Violet Leaf, Juniper Berries, Spruce, Grapefruit","Fir, Iris, Galbanum","Ambergris, Oakmoss, Sandalwood, Musk",215,267,64,50,14,354,345,203,72,343,122,arabic,0.3295081967213115,0.7901639344262295,spring,11,,1,0,0.0,0.0,0.0,0.0,0.0,0.0,0.0,0.0,0.0,0.0,0.0,0.0,0.0,0.0,0.0,0.0,0.0,1.0,0.0,0.0,0.02828753446800418,0.01714269111195049
2026-04-15,Hawas Black,Rasasi,arabic,USA,USD,33.99,28.85,100.0,0.2885,4.2,,in_stock,https://www.amazon.com/s?k=Rasasi+Hawas+Black,https://www.fragrantica.com/perfume/Rasasi/Hawas-Black-96817.html,,4.26,2649,male,Aromatic Fruity,"woody, citrus, mossy, earthy, fresh spicy, fruity, patchouli, sweet, aromatic","Perfumers, Perfumers","Bergamot, Grapefruit, Pineapple","Patchouli, Cedarwood, Jasmine","Oakmoss, Woody Notes, Amber",1500,630,253,144,100,1600,1500,1600,1400,1600,1500,arabic,0.5329272934906738,0.8108108108108109,spring,9,,1,0,0.0,0.0,0.0,0.0,1.0,0.0,0.0,0.0,0.0,0.0,0.0,0.0,0.0,0.0,0.0,0.0,0.0,0.0,0.0,0.0,0.034452156825457186,0.07638666937850482
