scrape_date,name,brand,category,country,currency,price,price_eur,bottle_size_ml,price_per_ml,amazon_rating,amazon_reviews,availability,amazon_url,fragrantica_url,year,rating,votes,gender,fragrance_family,main_accords,perfumers,top_notes,middle_notes,base_notes,votes_love,votes_like,votes_ok,votes_dislike,votes_hate,season_spring,season_summer,season_fall,season_winter,wear_day,wear_night,brand_origin,sentiment_polarisation,crowd_pleaser_index,season_dominant,note_count,years_on_market,gender_id,brand_origin_id,fam_,fam_aromatic,fam_aromatic_aquatic,fam_aromatic_fougere,fam_aromatic_fruity,fam_aromatic_spicy,fam_chypre_fruity,fam_floral,fam_floral_aldehyde,fam_floral_fruity,fam_oriental,fam_oriental_floral,fam_oriental_fougere,fam_oriental_spicy,fam_oriental_vanilla,fam_oriental_woody,fam_woody_aquatic,fam_woody_aromatic,fam_woody_floral_musk,fam_woody_spicy,price_per_ml_scaled,votes_scaled
2026-04-14,Sauvage,Dior,designer,UAE,AED,389.0,90.66,100.0,0.9066,4.5,,in_stock,https://www.amazon.ae/s?k=Dior+Sauvage+100ml,https://www.fragrantica.com/perfume/Dior/Sauvage-31861.html,,3.86,31880,male,Aromatic Fougere,"fresh spicy, amber, citrus, aromatic, musky, woody, lavender, herbal, warm spicy","Perfumers, Perfumers, François Demachy","Calabrian bergamot, Pepper","Sichuan Pepper, Lavender, Pink Pepper, Vetiver, Patchouli, Geranium, elemi","Ambroxan, Cedar, Labdanum",12400,10300,3200,4300,1700,14200,13200,13200,9600,14100,12800,designer,0.335423197492163,0.7115987460815048,spring,12,,1,1,0.0,0.0,0.0,1.0,0.0,0.0,0.0,0.0,0.0,0.0,0.0,0.0,0.0,0.0,0.0,0.0,0.0,0.0,0.0,0.0,0.13232217573221758,0.9265129263966033
2026-04-14,Sauvage Elixir,Dior,designer,UAE,AED,338.0,78.77,60.0,1.3128,4.6,,in_stock,https://www.amazon.ae/s?k=Dior+Sauvage+Elixir+100ml,https://www.fragrantica.com/perfume/Dior/Sauvage-Elixir-68415.html,,4.31,17772,male,Aromatic,"warm spicy, fresh spicy, woody, aromatic, lavender, soft spicy, cinnamon, amber, powdery, balsamic","Perfumers, Perfumers, François Demachy","Nutmeg, Cinnamon, Cardamom, Grapefruit",Lavender,"Licorice, Sandalwood, Amber, Patchouli, Haitian Vetiver",11300,3400,1300,1000,809,5900,2400,10200,11600,5400,10500,designer,0.5890841709248132,0.8254253467347971,winter,10,,1,1,0.0,1.0,0.0,0.0,0.0,0.0,0.0,0.0,0.0,0.0,0.0,0.0,0.0,0.0,0.0,0.0,0.0,0.0,0.0,0.0,0.1967002662609357,0.5162416029313404
2026-04-14,Sauvage EDP,Dior,designer,UAE,AED,520.0,121.19,100.0,1.2119,3.4,,in_stock,https://www.amazon.ae/s?k=Dior+Sauvage+Parfum+100ml,https://www.fragrantica.com/perfume/Dior/Sauvage-Eau-de-Parfum-48100.html,,4.21,13727,male,Oriental Fougere,"fresh spicy, citrus, amber, lavender, musky, aromatic, herbal, anis, soft spicy, floral","Perfumers, Perfumers, François Demachy",Bergamot,"Sichuan Pepper, Lavender, Star Anise, Nutmeg","Ambroxan, Vanilla",7100,4100,1100,994,371,7300,6000,7400,6800,6900,7300,designer,0.4924259055982437,0.8196121478229053,fall,7,,1,1,0.0,0.0,0.0,0.0,0.0,0.0,0.0,0.0,0.0,0.0,0.0,0.0,1.0,0.0,0.0,0.0,0.0,0.0,0.0,0.0,0.1807087612526943,0.39860993980283244
2026-04-14,Oud Ispahan,Dior,designer,UAE,AED,1360.0,316.95,125.0,2.5356,3.4,,in_stock,https://www.amazon.ae/s?k=Dior+Oud+Ispahan+125ml,https://www.fragrantica.com/perfume/Dior/Oud-Ispahan-15231.html,,4.08,2578,unisex,Oriental Floral,"oud, rose, woody, warm spicy, amber, patchouli, balsamic, floral, powdery","Perfumers, Perfumers, François Demachy",Labdanum,"Rose, Patchouli, Saffron","Agarwood (Oud), Sandalwood, Cedar",1300,701,163,322,95,355,169,819,964,427,922,designer,0.46687330492057344,0.7752808988764045,winter,7,,2,1,0.0,0.0,0.0,0.0,0.0,0.0,0.0,0.0,0.0,0.0,0.0,1.0,0.0,0.0,0.0,0.0,0.0,0.0,0.0,0.0,0.39050019018638266,0.07438857707854712
2026-04-14,Fahrenheit,Dior,designer,UAE,AED,1002.0,233.52,100.0,2.3352,4.6,,in_stock,https://www.amazon.ae/s?k=Dior+Fahrenheit+100ml,https://www.fragrantica.com/perfume/Dior/Fahrenheit-228.html,,4.0,22012,male,Aromatic Fougere,"leather, woody, ozonic, fresh spicy, aromatic, animalic, aquatic, floral, citrus, green","Perfumers, Perfumers, Jean-Louis Sieuzac, Maurice Roger, Michel Almairac","Nutmeg Flower, Lavender, Cedar, Mandarin Orange, Chamomile, Bergamot, Hawthorn, Lemon","Violet Leaf, Nutmeg, Cedar, Sandalwood, Carnation, Honeysuckle, Jasmine, Lily-of-the-Valley","Leather, Vetiver, Musk, Amber, Patchouli, Tonka Bean",10600,6100,984,3300,976,4400,2200,7900,8000,5500,7900,designer,0.4382513661202186,0.7604735883424408,winter,21,,1,1,0.0,0.0,0.0,1.0,0.0,0.0,0.0,0.0,0.0,0.0,0.0,0.0,0.0,0.0,0.0,0.0,0.0,0.0,0.0,0.0,0.35873906428299734,0.6395440137261175
2026-04-14,Dior Homme Intense 2025,Dior,designer,UAE,AED,469.0,109.3,100.0,1.093,4.4,,in_stock,https://www.amazon.ae/s?k=Dior+Homme+Intense+100ml,https://www.fragrantica.com/perfume/Dior/Dior-Homme-Intense-2025-101596.html,,4.1,1803,male,Oriental Woody,"iris, woody, powdery, musky, violet, floral, earthy","Perfumers, Perfumers",Tuscan Iris,Ambrette,Virginia Cedar,1100,329,133,86,192,423,132,861,957,435,848,designer,0.4934782608695652,0.7766304347826087,winter,3,,1,1,0.0,0.0,0.0,0.0,0.0,0.0,0.0,0.0,0.0,0.0,0.0,0.0,0.0,0.0,0.0,1.0,0.0,0.0,0.0,0.0,0.16186446050462786,0.0518509901997848
2026-04-14,Miss Dior EDP 2021,Dior,designer,UAE,AED,560.0,130.51,100.0,1.3051,4.6,,in_stock,https://www.amazon.ae/s?k=Dior+Miss+Dior+Eau+de+Parfum+100ml,https://www.fragrantica.com/perfume/Dior/Miss-Dior-Eau-de-Parfum-2021--68905.html,,3.89,6630,female,Oriental Floral,"powdery, vanilla, rose, floral, fruity, sweet, fresh, iris, musky, amber","Perfumers, Perfumers, François Demachy","Iris, Peony, Lily-of-the-Valley","Rose, Apricot, Peach","Vanilla, Musk, Tonka Bean, Sandalwood, Benzoin",2400,2200,1100,711,195,2700,1600,1600,1200,2600,1000,designer,0.3337874659400545,0.696336663639116,spring,11,,0,1,0.0,0.0,0.0,0.0,0.0,0.0,0.0,0.0,0.0,0.0,0.0,1.0,0.0,0.0,0.0,0.0,0.0,0.0,0.0,0.0,0.19547990363889944,0.19222380550789542
2026-04-14,J'adore,Dior,designer,UAE,AED,520.0,121.19,100.0,1.2119,4.6,,in_stock,https://www.amazon.ae/s?k=Dior+Jadore+100ml,https://www.fragrantica.com/perfume/Dior/J-adore-210.html,,3.8,28776,female,Floral Fruity,"white floral, floral, fruity, sweet, fresh, citrus, aquatic, powdery, ozonic, tuberose","Perfumers, Perfumers, Calice Becker","Pear, Melon, Magnolia, Peach, Mandarin Orange, Bergamot","Jasmine, Lily-of-the-Valley, Tuberose, Freesia, Rose, Orchid, Violet, Plum","Musk, Vanilla, Cedar, Blackberry",9000,11600,2000,5700,488,8100,4900,5800,4200,8700,5500,designer,0.2956787550368209,0.7155759344171182,spring,18,,0,1,0.0,0.0,0.0,0.0,0.0,0.0,0.0,0.0,0.0,1.0,0.0,0.0,0.0,0.0,0.0,0.0,0.0,0.0,0.0,0.0,0.1807087612526943,0.8362462558525025
2026-04-14,Ambre Nuit,Dior,designer,UAE,AED,1199.0,279.43,125.0,2.2354,3.5,,in_stock,https://www.amazon.ae/s?k=Dior+Ambre+Nuit+125ml,https://www.fragrantica.com/perfume/Dior/Ambre-Nuit-48395.html,,4.38,2017,unisex,Oriental,"amber, rose, floral, animalic, powdery","Perfumers, Perfumers, François Demachy","Amber, Turkish Rose",,,1200,542,147,101,27,549,262,901,839,558,845,designer,0.5815567674764501,0.8636588993554785,fall,2,,2,1,0.0,0.0,0.0,0.0,0.0,0.0,0.0,0.0,0.0,0.0,1.0,0.0,0.0,0.0,0.0,0.0,0.0,0.0,0.0,0.0,0.34292189679218965,0.05807427225404949
2026-04-14,Gris Dior,Dior,designer,UAE,AED,454.29,105.87,100.0,1.0587,4.5,,in_stock,https://www.amazon.ae/s?k=Dior+Gris+Dior+125ml,https://www.fragrantica.com/perfume/Dior/Gris-Dior-48387.html,,4.21,3547,unisex,Floral,"woody, earthy, mossy, rose, patchouli, citrus, warm spicy, amber, powdery, floral","Perfumers, Perfumers, François Demachy","Oakmoss, Rose, Patchouli, Bergamot, Cedar, Amber, Sandalwood",,,1800,1100,381,201,95,1400,960,1400,1000,1400,1000,designer,0.47665641599105396,0.8107352530053117,spring,7,,2,1,0.0,0.0,0.0,0.0,0.0,0.0,0.0,1.0,0.0,0.0,0.0,0.0,0.0,0.0,0.0,0.0,0.0,0.0,0.0,0.0,0.15642829973373906,0.10256783086631575
2026-04-14,Silver Mountain Water,Creed,designer,UAE,AED,1700.0,396.18,100.0,3.9618,4.5,,in_stock,https://www.amazon.ae/s?k=Creed+Silver+Mountain+Water+100ml,https://www.fragrantica.com/perfume/Creed/Silver-Mountain-Water-472.html,,4.16,10431,unisex,Aromatic,"citrus, green, fruity, musky, woody, aromatic, powdery, fresh spicy, fresh, floral","Perfumers, Perfumers, Olivier Creed, Pierre Bourdon","Bergamot, Mandarin Orange","Green Tea, Black Currant","Musk, Sandalwood, Petitgrain, Galbanum",5000,3400,987,918,158,4600,4600,1600,990,4600,1200,niche,0.4627735831023607,0.8028290165344547,spring,8,,2,2,0.0,1.0,0.0,0.0,0.0,0.0,0.0,0.0,0.0,0.0,0.0,0.0,0.0,0.0,0.0,0.0,0.0,0.0,0.0,0.0,0.6165367059718524,0.302759763864251
2026-04-14,Green Irish Tweed,Creed,designer,UAE,AED,2244.0,522.96,100.0,5.2296,3.3,,in_stock,https://www.amazon.ae/s?k=Creed+Green+Irish+Tweed+100ml,https://www.fragrantica.com/perfume/Creed/Green-Irish-Tweed-474.html,,4.3,11635,male,Woody Floral Musk,"ozonic, aquatic, iris, powdery, woody, amber, animalic, violet, balsamic, green","Perfumers, Perfumers, Olivier Creed, Pierre Bourdon","Iris, Vervain",Violet Leaf,"Ambergris, Sandalwood",6700,3100,764,973,171,5800,4800,3500,1400,5500,2400,niche,0.55765288691493,0.8370345063204646,spring,5,,1,2,0.0,0.0,0.0,0.0,0.0,0.0,0.0,0.0,0.0,0.0,0.0,0.0,0.0,0.0,0.0,0.0,0.0,0.0,1.0,0.0,0.8174686192468619,0.33777299560880564
2026-04-14,Millesime Imperial,Creed,designer,UAE,AED,1214.0,282.92,50.0,5.6584,4.3,,in_stock,https://www.amazon.ae/s?k=Creed+Millesime+Imperial+100ml,https://www.fragrantica.com/perfume/Creed/Millesime-Imperial-466.html,,4.23,7077,unisex,Woody Floral Musk,"marine, citrus, salty, fruity, aromatic, powdery, musky, sweet, woody, iris","Perfumers, Perfumers, Olivier Creed, Pierre Bourdon","Sea Salt, Fruity Notes","Sicilian Lemon, Bergamot, Iris, Mandarin Orange","Sea Notes, Musk, Woody Notes",3600,2200,553,592,81,2700,3400,874,361,3200,944,niche,0.5008539709649872,0.8255052661542841,summer,9,,2,2,0.0,0.0,0.0,0.0,0.0,0.0,0.0,0.0,0.0,0.0,0.0,0.0,0.0,0.0,0.0,0.0,0.0,0.0,1.0,0.0,0.8854285533155827,0.20522290400442025
2026-04-14,Wind Flowers,Creed,designer,UAE,AED,30.75,7.17,100.0,0.0717,,,in_stock,https://www.amazon.ae/s?k=Creed+Wind+Flowers+75ml,https://www.fragrantica.com/perfume/Creed/Wind-Flowers-70182.html,,3.61,1017,female,Floral,"white floral, sweet, powdery, musky, tuberose, rose, woody, iris, animalic, fruity","Perfumers, Perfumers, Olivier Creed","Jasmine, Orange Blossom, Peach","Jasmine Sambac, Tuberose, Rose","Musk, Orange Blossom, Praline, Iris, Sandalwood",317,278,201,153,68,350,271,174,100,332,133,niche,0.2448377581120944,0.5850540806293019,spring,10,,0,2,0.0,0.0,0.0,0.0,0.0,0.0,0.0,1.0,0.0,0.0,0.0,0.0,0.0,0.0,0.0,0.0,0.0,0.0,0.0,0.0,0.0,0.028993514991130367
2026-04-14,Le Male,Jean Paul Gaultier,designer,UAE,AED,419.0,97.65,100.0,0.9765,4.7,,in_stock,https://www.amazon.ae/s?k=Jean+Paul+Gaultier+Le+Male+125ml,https://www.fragrantica.com/perfume/Jean-Paul-Gaultier/Le-Male-430.html,,4.0,24153,female,Oriental Fougere,"aromatic, vanilla, fresh spicy, lavender, warm spicy, green, powdery, sweet, amber, woody","Perfumers, Perfumers, Francis Kurkdjian","Lavender, Mint, Cardamom, Bergamot, Artemisia","Cinnamon, Orange Blossom, Caraway","Vanilla, Tonka Bean, Amber, Sandalwood, Cedar",9800,8800,1900,3200,458,8500,5600,9400,9600,9100,9500,designer,0.38670419736733175,0.7699312857024588,winter,13,,0,1,0.0,0.0,0.0,0.0,0.0,0.0,0.0,0.0,0.0,0.0,0.0,0.0,1.0,0.0,0.0,0.0,0.0,0.0,0.0,0.0,0.14340053252187143,0.7018059150260273
2026-04-14,Ultra Male,Jean Paul Gaultier,designer,UAE,AED,614.0,143.09,125.0,1.1447,4.3,,in_stock,https://www.amazon.ae/s?k=Jean+Paul+Gaultier+Ultra+Male+125ml,https://www.fragrantica.com/perfume/Jean-Paul-Gaultier/Ultra-Male-30947.html,,4.45,16731,male,Oriental Fougere,"vanilla, fruity, aromatic, sweet, cinnamon, warm spicy, fresh spicy, lavender, powdery, green","Perfumers, Perfumers, Francis Kurkdjian","Pear, Lavender, Mint, Bergamot, Lemon","Cinnamon, Clary Sage, Caraway","Black Vanilla Husk, Amber, Patchouli, Cedar",10700,4100,828,871,202,5600,2700,9200,10400,4000,10400,designer,0.6285851146637926,0.8861744805700258,winter,12,,1,1,0.0,0.0,0.0,0.0,0.0,0.0,0.0,0.0,0.0,0.0,0.0,0.0,1.0,0.0,0.0,0.0,0.0,0.0,0.0,0.0,0.1700583238240142,0.4859685346206415
2026-04-14,Le Male Le Parfum,Jean Paul Gaultier,designer,UAE,AED,614.0,143.09,125.0,1.1447,4.3,,in_stock,https://www.amazon.ae/s?k=Jean+Paul+Gaultier+Le+Male+Le+Parfum+125ml,https://www.fragrantica.com/perfume/Jean-Paul-Gaultier/Le-Male-Le-Parfum-61856.html,,4.6,25603,male,Oriental,"warm spicy, vanilla, lavender, aromatic, powdery, iris, woody, amber, violet","Perfumers, Perfumers, Natalie Gracia-Cetto, Quentin Bisch",Cardamom,"Lavender, Iris","Vanilla, Oriental notes, Woodsy Notes",18800,4600,1200,577,377,7900,2800,16200,18800,7200,16800,designer,0.7209438835407372,0.915707912655553,winter,6,,1,1,0.0,0.0,0.0,0.0,0.0,0.0,0.0,0.0,0.0,0.0,1.0,0.0,0.0,0.0,0.0,0.0,0.0,0.0,0.0,0.0,0.1700583238240142,0.74397301305726
2026-04-14,Le Male Elixir,Jean Paul Gaultier,designer,UAE,AED,419.0,97.65,100.0,0.9765,4.7,,in_stock,https://www.amazon.ae/s?k=Jean+Paul+Gaultier+Le+Male+Elixir+125ml,https://www.fragrantica.com/perfume/Jean-Paul-Gaultier/Le-Male-Elixir-81642.html,,4.52,23518,male,Oriental Fougere,"vanilla, sweet, honey, aromatic, amber, lavender, tobacco, green, fresh spicy, powdery","Perfumers, Perfumers, Quentin Bisch","Lavender, Mint","Vanilla, Benzoin","Honey, Tonka Bean, Tobacco",16800,4100,1300,746,579,5000,2300,14000,18000,6500,14900,designer,0.6895217853347503,0.8884165781083954,winter,7,,1,1,0.0,0.0,0.0,0.0,0.0,0.0,0.0,0.0,0.0,0.0,0.0,0.0,1.0,0.0,0.0,0.0,0.0,0.0,0.0,0.0,0.14340053252187143,0.6833396341640736
2026-04-14,Hawas Elixir,Rasasi,arabic,UAE,AED,97.0,22.61,100.0,0.2261,4.3,,in_stock,https://www.amazon.ae/s?k=Rasasi+Hawas+Elixir+100ml,https://www.fragrantica.com/perfume/Rasasi/Hawas-Elixir-110808.html,,4.54,987,unisex,Oriental Vanilla,"vanilla, aromatic, green, sweet, fresh spicy, warm spicy, amber, chocolate, lavender, powdery","Perfumers, Perfumers","Mint, Bergamot, Artemisia","Dark Chocolate, Lavender, Benzoin","Vanilla, Tonka Bean, White Musk",660,238,57,21,11,312,86,619,747,279,664,arabic,0.6575481256332321,0.9098277608915907,winter,9,,2,0,0.0,0.0,0.0,0.0,0.0,0.0,0.0,0.0,0.0,0.0,0.0,0.0,0.0,0.0,1.0,0.0,0.0,0.0,0.0,0.0,0.02447064790161024,0.028121092273242793
2026-04-14,Hawas Viper,Rasasi,arabic,UAE,AED,97.0,22.61,100.0,0.2261,4.3,,in_stock,https://www.amazon.ae/s?k=Rasasi+Hawas+Viper+100ml,https://www.fragrantica.com/perfume/Rasasi/Hawas-Viper-113594.html,,3.71,139,male,Oriental,"warm spicy, aromatic, tobacco, sweet, green, cannabis, coffee, fruity, herbal, musky","Perfumers, Perfumers","Saffron, cannabis, Thyme, Green Notes, Davana","Tobacco, Coffee, Cinnamon, Violet, Raspberry","Gurjan balsam, Musk, Tonka",74,18,7,12,28,32,13,58,83,29,66,arabic,0.33093525179856115,0.6618705035971223,winter,13,,1,0,0.0,0.0,0.0,0.0,0.0,0.0,0.0,0.0,0.0,0.0,1.0,0.0,0.0,0.0,0.0,0.0,0.0,0.0,0.0,0.0,0.02447064790161024,0.003460610114287376
2026-04-14,Sauvage,Dior,designer,USA,USD,116.18,99.44,100.0,0.9944,4.5,,in_stock,https://www.amazon.com/s?k=Dior+Sauvage,https://www.fragrantica.com/perfume/Dior/Sauvage-31861.html,,3.86,31880,male,Aromatic Fougere,"fresh spicy, amber, citrus, aromatic, musky, woody, lavender, herbal, warm spicy","Perfumers, Perfumers, François Demachy","Calabrian bergamot, Pepper","Sichuan Pepper, Lavender, Pink Pepper, Vetiver, Patchouli, Geranium, elemi","Ambroxan, Cedar, Labdanum",12400,10300,3200,4300,1700,14200,13200,13200,9600,14100,12800,designer,0.335423197492163,0.7115987460815048,spring,12,,1,1,0.0,0.0,0.0,1.0,0.0,0.0,0.0,0.0,0.0,0.0,0.0,0.0,0.0,0.0,0.0,0.0,0.0,0.0,0.0,0.0,0.14623747939647522,0.9265129263966033
2026-04-14,Sauvage Elixir,Dior,designer,USA,USD,173.75,148.71,100.0,1.4871,4.6,,in_stock,https://www.amazon.com/s?k=Dior+Sauvage+Elixir,https://www.fragrantica.com/perfume/Dior/Sauvage-Elixir-68415.html,,4.31,17772,male,Aromatic,"warm spicy, fresh spicy, woody, aromatic, lavender, soft spicy, cinnamon, amber, powdery, balsamic","Perfumers, Perfumers, François Demachy","Nutmeg, Cinnamon, Cardamom, Grapefruit",Lavender,"Licorice, Sandalwood, Amber, Patchouli, Haitian Vetiver",11300,3400,1300,1000,809,5900,2400,10200,11600,5400,10500,designer,0.5890841709248132,0.8254253467347971,winter,10,,1,1,0.0,1.0,0.0,0.0,0.0,0.0,0.0,0.0,0.0,0.0,0.0,0.0,0.0,0.0,0.0,0.0,0.0,0.0,0.0,0.0,0.22432483834157477,0.5162416029313404
2026-04-14,Sauvage EDP,Dior,designer,USA,USD,149.9,128.3,100.0,1.283,4.3,,in_stock,https://www.amazon.com/s?k=Dior+Sauvage+Parfum,https://www.fragrantica.com/perfume/Dior/Sauvage-Eau-de-Parfum-48100.html,,4.21,13727,male,Oriental Fougere,"fresh spicy, citrus, amber, lavender, musky, aromatic, herbal, anis, soft spicy, floral","Perfumers, Perfumers, François Demachy",Bergamot,"Sichuan Pepper, Lavender, Star Anise, Nutmeg","Ambroxan, Vanilla",7100,4100,1100,994,371,7300,6000,7400,6800,6900,7300,designer,0.4924259055982437,0.8196121478229053,fall,7,,1,1,0.0,0.0,0.0,0.0,0.0,0.0,0.0,0.0,0.0,0.0,0.0,0.0,1.0,0.0,0.0,0.0,0.0,0.0,0.0,0.0,0.19197730442500316,0.39860993980283244
2026-04-14,Fahrenheit,Dior,designer,USA,USD,100.0,85.59,100.0,0.8559,4.6,,in_stock,https://www.amazon.com/s?k=Dior+Fahrenheit,https://www.fragrantica.com/perfume/Dior/Fahrenheit-228.html,,4.0,22012,male,Aromatic Fougere,"leather, woody, ozonic, fresh spicy, aromatic, animalic, aquatic, floral, citrus, green","Perfumers, Perfumers, Jean-Louis Sieuzac, Maurice Roger, Michel Almairac","Nutmeg Flower, Lavender, Cedar, Mandarin Orange, Chamomile, Bergamot, Hawthorn, Lemon","Violet Leaf, Nutmeg, Cedar, Sandalwood, Carnation, Honeysuckle, Jasmine, Lily-of-the-Valley","Leather, Vetiver, Musk, Amber, Patchouli, Tonka Bean",10600,6100,984,3300,976,4400,2200,7900,8000,5500,7900,designer,0.4382513661202186,0.7604735883424408,winter,21,,1,1,0.0,0.0,0.0,1.0,0.0,0.0,0.0,0.0,0.0,0.0,0.0,0.0,0.0,0.0,0.0,0.0,0.0,0.0,0.0,0.0,0.12428680106504374,0.6395440137261175
2026-04-14,Dior Homme Intense 2025,Dior,designer,USA,USD,175.4,150.12,100.0,1.5012,4.1,,in_stock,https://www.amazon.com/s?k=Dior+Homme+Intense,https://www.fragrantica.com/perfume/Dior/Dior-Homme-Intense-2025-101596.html,,4.1,1803,male,Oriental Woody,"iris, woody, powdery, musky, violet, floral, earthy","Perfumers, Perfumers",Tuscan Iris,Ambrette,Virginia Cedar,1100,329,133,86,192,423,132,861,957,435,848,designer,0.4934782608695652,0.7766304347826087,winter,3,,1,1,0.0,0.0,0.0,0.0,0.0,0.0,0.0,0.0,0.0,0.0,0.0,0.0,0.0,0.0,0.0,1.0,0.0,0.0,0.0,0.0,0.22655952833777104,0.0518509901997848
2026-04-14,Miss Dior EDP 2021,Dior,designer,USA,USD,161.18,137.95,100.0,1.3795,4.6,,in_stock,https://www.amazon.com/s?k=Dior+Miss+Dior+Eau+de+Parfum,https://www.fragrantica.com/perfume/Dior/Miss-Dior-Eau-de-Parfum-2021--68905.html,,3.89,6630,female,Oriental Floral,"powdery, vanilla, rose, floral, fruity, sweet, fresh, iris, musky, amber","Perfumers, Perfumers, François Demachy","Iris, Peony, Lily-of-the-Valley","Rose, Apricot, Peach","Vanilla, Musk, Tonka Bean, Sandalwood, Benzoin",2400,2200,1100,711,195,2700,1600,1600,1200,2600,1000,designer,0.3337874659400545,0.696336663639116,spring,11,,0,1,0.0,0.0,0.0,0.0,0.0,0.0,0.0,0.0,0.0,0.0,0.0,1.0,0.0,0.0,0.0,0.0,0.0,0.0,0.0,0.0,0.20727145936350957,0.19222380550789542
2026-04-14,J'adore,Dior,designer,USA,USD,151.99,130.08,100.0,1.3008,4.6,,in_stock,https://www.amazon.com/s?k=Dior+Jadore,https://www.fragrantica.com/perfume/Dior/J-adore-210.html,,3.8,28776,female,Floral Fruity,"white floral, floral, fruity, sweet, fresh, citrus, aquatic, powdery, ozonic, tuberose","Perfumers, Perfumers, Calice Becker","Pear, Melon, Magnolia, Peach, Mandarin Orange, Bergamot","Jasmine, Lily-of-the-Valley, Tuberose, Freesia, Rose, Orchid, Violet, Plum","Musk, Vanilla, Cedar, Blackberry",9000,11600,2000,5700,488,8100,4900,5800,4200,8700,5500,designer,0.2956787550368209,0.7155759344171182,spring,18,,0,1,0.0,0.0,0.0,0.0,0.0,0.0,0.0,0.0,0.0,1.0,0.0,0.0,0.0,0.0,0.0,0.0,0.0,0.0,0.0,0.0,0.1947984024343857,0.8362462558525025
2026-04-14,Gris Dior,Dior,designer,USA,USD,119.99,102.7,100.0,1.027,4.5,,in_stock,https://www.amazon.com/s?k=Dior+Gris+Dior,https://www.fragrantica.com/perfume/Dior/Gris-Dior-48387.html,,4.21,3547,unisex,Floral,"woody, earthy, mossy, rose, patchouli, citrus, warm spicy, amber, powdery, floral","Perfumers, Perfumers, François Demachy","Oakmoss, Rose, Patchouli, Bergamot, Cedar, Amber, Sandalwood",,,1800,1100,381,201,95,1400,960,1400,1000,1400,1000,designer,0.47665641599105396,0.8107352530053117,spring,7,,2,1,0.0,0.0,0.0,0.0,0.0,0.0,0.0,1.0,0.0,0.0,0.0,0.0,0.0,0.0,0.0,0.0,0.0,0.0,0.0,0.0,0.15140420945860275,0.10256783086631575
2026-04-14,Silver Mountain Water,Creed,designer,USA,USD,490.0,419.38,100.0,4.1938,4.2,,in_stock,https://www.amazon.com/s?k=Creed+Silver+Mountain+Water,https://www.fragrantica.com/perfume/Creed/Silver-Mountain-Water-472.html,,4.16,10431,unisex,Aromatic,"citrus, green, fruity, musky, woody, aromatic, powdery, fresh spicy, fresh, floral","Perfumers, Perfumers, Olivier Creed, Pierre Bourdon","Bergamot, Mandarin Orange","Green Tea, Black Currant","Musk, Sandalwood, Petitgrain, Galbanum",5000,3400,987,918,158,4600,4600,1600,990,4600,1200,niche,0.4627735831023607,0.8028290165344547,spring,8,,2,2,0.0,1.0,0.0,0.0,0.0,0.0,0.0,0.0,0.0,0.0,0.0,0.0,0.0,0.0,0.0,0.0,0.0,0.0,0.0,0.0,0.6533060732851529,0.302759763864251
2026-04-14,Green Irish Tweed,Creed,designer,USA,USD,490.0,419.38,100.0,4.1938,4.2,,in_stock,https://www.amazon.com/s?k=Creed+Green+Irish+Tweed,https://www.fragrantica.com/perfume/Creed/Green-Irish-Tweed-474.html,,4.3,11635,male,Woody Floral Musk,"ozonic, aquatic, iris, powdery, woody, amber, animalic, violet, balsamic, green","Perfumers, Perfumers, Olivier Creed, Pierre Bourdon","Iris, Vervain",Violet Leaf,"Ambergris, Sandalwood",6700,3100,764,973,171,5800,4800,3500,1400,5500,2400,niche,0.55765288691493,0.8370345063204646,spring,5,,1,2,0.0,0.0,0.0,0.0,0.0,0.0,0.0,0.0,0.0,0.0,0.0,0.0,0.0,0.0,0.0,0.0,0.0,0.0,1.0,0.0,0.6533060732851529,0.33777299560880564
2026-04-14,Millesime Imperial,Creed,designer,USA,USD,37.0,31.67,100.0,0.3167,5.0,,in_stock,https://www.amazon.com/s?k=Creed+Millesime+Imperial,https://www.fragrantica.com/perfume/Creed/Millesime-Imperial-466.html,,4.23,7077,unisex,Woody Floral Musk,"marine, citrus, salty, fruity, aromatic, powdery, musky, sweet, woody, iris","Perfumers, Perfumers, Olivier Creed, Pierre Bourdon","Sea Salt, Fruity Notes","Sicilian Lemon, Bergamot, Iris, Mandarin Orange","Sea Notes, Musk, Woody Notes",3600,2200,553,592,81,2700,3400,874,361,3200,944,niche,0.5008539709649872,0.8255052661542841,summer,9,,2,2,0.0,0.0,0.0,0.0,0.0,0.0,0.0,0.0,0.0,0.0,0.0,0.0,0.0,0.0,0.0,0.0,0.0,0.0,1.0,0.0,0.038829719792062886,0.20522290400442025
2026-04-14,Viking,Creed,designer,USA,USD,510.0,436.49,100.0,4.3649,4.2,,in_stock,https://www.amazon.com/s?k=Creed+Viking,https://www.fragrantica.com/perfume/Creed/Viking-41698.html,,3.96,4101,male,Woody Aromatic,"aromatic, fresh spicy, green, citrus, soft spicy, lavender, woody, rose, musky, warm spicy","Perfumers, Perfumers, Olivier Creed","Pink Pepper, Peppermint, Bergamot, Lemon, Absinthe, Orange","Lavender, Bulgarian Rose, Clove, Allspice, Orris Root, Jasmine","Vetiver, Cedar, White Musk, Tonka Bean",1800,1200,457,572,108,1700,1200,1700,1300,1800,1200,niche,0.40899202320522116,0.7251631617113851,spring,16,,1,2,0.0,0.0,0.0,0.0,0.0,0.0,0.0,0.0,0.0,0.0,0.0,0.0,0.0,0.0,0.0,0.0,0.0,1.0,0.0,0.0,0.6804234816787117,0.11867857038997295
2026-04-14,Aventus Cologne,Creed,designer,USA,USD,40.0,34.23,50.0,0.6846,,,in_stock,https://www.amazon.com/s?k=Creed+Aventus+Cologne,https://www.fragrantica.com/perfume/Creed/Aventus-Cologne-51692.html,,4.33,3239,male,Aromatic Fruity,"citrus, woody, musky, leather, fresh spicy, powdery, smoky, aromatic, earthy, sweet","Perfumers, Perfumers, Olivier Creed","Mandarin Orange, Ginger, Pink Pepper, Bergamot, Spearmint","Vetiver, Patchouli, Sandalwood, Ozonic notes","Musk, Birch, Tonka Bean, Styrax, Cedar",1900,798,230,224,56,1600,1800,860,304,1700,697,niche,0.5748129675810474,0.8410224438902744,summer,14,,1,2,0.0,0.0,0.0,0.0,1.0,0.0,0.0,0.0,0.0,0.0,0.0,0.0,0.0,0.0,0.0,0.0,0.0,0.0,0.0,0.0,0.09713769494104221,0.09361095762933666
2026-04-14,Royal Oud,Creed,designer,USA,USD,41.99,35.94,100.0,0.3594,3.8,,in_stock,https://www.amazon.com/s?k=Creed+Royal+Oud,https://www.fragrantica.com/perfume/Creed/Royal-Oud-12317.html,,4.36,5496,unisex,Oriental Fougere,"woody, musky, powdery, citrus, aromatic, soft spicy, oud, green, amber","Perfumers, Perfumers, Julien Rasquinet, Olivier Creed","Pink Pepper, Lemon, Sicilian Bergamot","Cedar, Angelica, Galbanum","Sandalwood, Agarwood (Oud), Musk",3300,1500,310,404,59,1700,695,2400,2200,1800,2100,niche,0.5815539206890364,0.8612955320294275,fall,9,,2,2,0.0,0.0,0.0,0.0,0.0,0.0,0.0,0.0,0.0,0.0,0.0,0.0,1.0,0.0,0.0,0.0,0.0,0.0,0.0,0.0,0.045597185241536706,0.1592462267717451
2026-04-14,Wind Flowers,Creed,designer,USA,USD,460.0,393.7,100.0,3.937,4.1,,in_stock,https://www.amazon.com/s?k=Creed+Wind+Flowers,https://www.fragrantica.com/perfume/Creed/Wind-Flowers-70182.html,,3.61,1017,female,Floral,"white floral, sweet, powdery, musky, tuberose, rose, woody, iris, animalic, fruity","Perfumers, Perfumers, Olivier Creed","Jasmine, Orange Blossom, Peach","Jasmine Sambac, Tuberose, Rose","Musk, Orange Blossom, Praline, Iris, Sandalwood",317,278,201,153,68,350,271,174,100,332,133,niche,0.2448377581120944,0.5850540806293019,spring,10,,0,2,0.0,0.0,0.0,0.0,0.0,0.0,0.0,1.0,0.0,0.0,0.0,0.0,0.0,0.0,0.0,0.0,0.0,0.0,0.0,0.0,0.6126061873969824,0.028993514991130367
